index,published,keyword,domain,language,valid,title,description,url,image,archive,content,quote,de,en,la,added
e11046e54f16a1cc79d3b561c47f97fe,2026-07-04T04:51:05Z,'cold snap',slickdeals.net,en,0.7,Coleman Snap 'N Go 45-Quart Collapsible Hard Cooler $153.99 + Free S&H at Amazon (2 replies),"Amazon.com has Coleman Snap 'N Go 45-Quart Collapsible Hard Cooler, Portable Hard-Sided Cooler with Waterproof Removable Liner, Spacing-Saving & Quick Set Up, 55 Hours Cold for $153.99.  Ship",https://slickdeals.net/f/19719849-coleman-snap-n-go-45-quart-collapsible-hard-cooler-153-99-free-s-h-at-amazon,https://slickdeals.net/attachment/2/9/8/1/5/7/1/1/450x450/20895804.thumb,,"This collaborative space allows users to contribute additional information, tips, and insights to enhance the original deal post. Feel free to share your knowledge and help fellow shoppers make infor… [+26 chars]",,"Coleman Snap 'N Go 45-Quart zusammenklappbarer Hartkühler 153,99 $ + kostenloser Versand und Versand bei Amazon (2 Antworten). Bei Amazon.com gibt es den zusammenklappbaren 45-Quart-Festkühler Snap 'N Go von Coleman, einen tragbaren Hartschalenkühler mit wasserdichtem herausnehmbarem Innenfutter, platzsparend und schnell aufgebaut, 55 Stunden kalt für 153,99 $.  Schiff","Coleman Snap 'N Go 45-Quart Collapsible Hard Cooler $153.99 + Free S&H at Amazon (2 replies). Amazon.com has Coleman Snap 'N Go 45-Quart Collapsible Hard Cooler, Portable Hard-Sided Cooler with Waterproof Removable Liner, Spacing-Saving & Quick Set Up, 55 Hours Cold for $153.99.  Ship","Coleman Snap 'N Go 45-Quart Collapsible Hard Cooler $153.99 + Free S&H apud Amazon (2 responsa). Amazon.com habet Coleman Snap 'N Go 45-Quart Collapsible Hard Cooler, Portable Hard- Sided Cooler with Waterproof Removable Liner, Spacing-Saving & Velox Erigite, 55 Horae Frigus for $153.99.  Navis",2026-07-06 02:43:13+00:00
ffec8c02c8a2eaa89e9062d21be3576b,2026-07-02T23:08:25Z,'cold snap',nypost.com,en,0.8,Mamdani can’t even get City Hall to stick to his 78-degree AC rule – as temps in building hit as low as 54,"Zo’s so cold. Temperatures inside City Hall plunged as low as 54 degrees Thursday during the ongoing heat wave — despite Mayor Zohran Mamdani urging New Yorkers to set their air conditioners to a balmy 78, The Post found. Sweaty Post reporters armed with an i…",https://nypost.com/2026/07/02/us-news/mamdani-cant-even-get-city-hall-to-stick-to-his-78-degree-ac-rule-as-temps-in-building-hit-as-low-as-54/,https://nypost.com/wp-content/uploads/sites/2/2026/07/133061015.jpg?quality=75&strip=all&w=1200,http://web.archive.org/web/20260702232134/https://nypost.com/2026/07/02/us-news/mamdani-cant-even-get-city-hall-to-stick-to-his-78-degree-ac-rule-as-temps-in-building-hit-as-low-as-54/,"Zo’s so cold.
Temperatures inside City Hall plunged as low as 54 degrees Thursday during the ongoing heat wave — despite Mayor Zohran Mamdani urging New Yorkers to set their air conditioners to a ba… [+4812 chars]",,"Mamdani kann das Rathaus nicht einmal dazu bringen, sich an seine 78-Grad-Wechselstromregel zu halten – da die Temperaturen im Gebäude auf bis zu 54 Grad sinken. Zo ist so kalt. Die Temperaturen im Rathaus sanken am Donnerstag während der anhaltenden Hitzewelle auf bis zu 54 Grad – obwohl Bürgermeister Zohran Mamdani die New Yorker dazu drängte, ihre Klimaanlagen auf milde 78 Grad einzustellen, wie The Post herausfand. Verschwitzte Post-Reporter bewaffnet mit einem I…","Mamdani can’t even get City Hall to stick to his 78-degree AC rule – as temps in building hit as low as 54. Zo’s so cold. Temperatures inside City Hall plunged as low as 54 degrees Thursday during the ongoing heat wave — despite Mayor Zohran Mamdani urging New Yorkers to set their air conditioners to a balmy 78, The Post found. Sweaty Post reporters armed with an i…","Mamdani etiam City Hall nequeunt, ut 78-gradum AC regulae eius adhaereant — sicut temps in aedificando tam demissa quam 54. Zo's tam frigida est. Temperaturae intus City Hall demissae sicut 54 gradus Iovis per undam caloris permanenti — non obstante Major Zohran Mamdani New Yorkers hortatus est ut suas aeris conditioners ad balsamum 78, Post inventum inveniatur. Sudor Post notarios armatus cum i…",2026-07-06 02:43:13+00:00
f165f654561c4b9f0bece59908c18008,2026-07-01T06:00:00Z,'cold snap',www.naturalnews.com,en,0.9,Intermittency of Wind and Solar Power Raises Grid Reliability Concerns,"Grid operators face increased risks during prolonged periods of low wind and solar generation, a phenomenon known as “Dunkelflaute,” according to multiple reports and officials. A recent cold snap in Europe and a heatwave in Texas highlighted the vulnerabilit…",https://www.naturalnews.com/2026-07-01-intermittency-wind-solar-raises-grid-reliability-concerns.html,https://www.naturalnews.com/wp-content/uploads/sites/91/2026/07/intermittency-wind-power-solar-power-2402-original.jpg,http://web.archive.org/web/20260702032036/https://www.naturalnews.com/2026-07-01-intermittency-wind-solar-raises-grid-reliability-concerns.html,"Grid operators face increased risks during prolonged periods of low wind and solar generation, a phenomenon known as ""Dunkelflaute,"" according to multiple reports and officials.
A recent cold snap i… [+6704 chars]",,"Die Unterbrechung von Wind- und Solarenergie wirft Bedenken hinsichtlich der Netzzuverlässigkeit auf. Mehreren Berichten und Beamten zufolge sind Netzbetreiber während längerer Perioden geringer Wind- und Solarstromerzeugung, einem Phänomen, das als „Dunkelflaute“ bekannt ist, erhöhten Risiken ausgesetzt. Ein jüngster Kälteeinbruch in Europa und eine Hitzewelle in Texas haben die Verwundbarkeit deutlich gemacht …","Intermittency of Wind and Solar Power Raises Grid Reliability Concerns. Grid operators face increased risks during prolonged periods of low wind and solar generation, a phenomenon known as “Dunkelflaute,” according to multiple reports and officials. A recent cold snap in Europe and a heatwave in Texas highlighted the vulnerabilit…","Intermittency of Wind and Solar Power Raises Grid Reliability Curas. Grid operariorum pericula in longum tempus venti gravis et generationis solaris augebant, phaenomenon ""Dunkelflaute"" secundum multiplices relationes et magistratus. Recens frigus frangeretur in Europa et aestuarium in Texas illustravit vulnerabilem…",2026-07-06 02:43:13+00:00
166f6c9a32031d139db732aa078dd087,2026-07-02T03:01:28Z,'cold front',www.dailymail.com,en,0.9,Bitter polar blast to freeze millions of Aussies with snow dumps finally expected on our barren ski fields,A strong cold front lurking over the Great Australian Bight is surging towards Tasmania and the south-east mainland,https://www.dailymail.com/news/article-15946411/winter-blast-australia-cold-tasmania-snow-temperatures-sydney-melbourne.html,https://i.dailymail.com/1s/2026/07/02/02/109736145-0-image-a-13_1782956394054.jpg,,"Millions of Aussies are urged to rug up as a chilly winter blast sweeps across the nation this weekend, bringing freezing temperatures and snow.
Australia's south-east will feel the brunt of the con… [+5258 chars]",,"Eine bittere Polarexplosion wird Millionen Australier erfrieren lassen, und endlich werden Schneehaufen auf unseren kargen Skigebieten erwartet. Eine starke Kaltfront, die über der Großen Australischen Bucht lauert, drängt auf Tasmanien und das südöstliche Festland zu",Bitter polar blast to freeze millions of Aussies with snow dumps finally expected on our barren ski fields. A strong cold front lurking over the Great Australian Bight is surging towards Tasmania and the south-east mainland,Aussiae decies centena millia nivibus eri ad durandum amarum polarium exspectatur tandem in campis nostris sterilibus ski. Frons frigoris fortis latens in Magno Australiae Bight surgit ad Tasmaniam et continentem meridiem-orientalem.,2026-07-06 02:43:13+00:00
98038198ccc5d70c659bf0acf4ff797e,2026-07-03T20:21:07Z,'heating system',bringatrailer.com,en,0.3,Modified 2001 BMW M3 Coupe 6-Speed,"This 2001 BMW M3 is a Canadian-market coupe that has been fitted with a CSL-style carbon-fiber intake system for the 3.2-liter inline-six, which is linked with a six-speed manual transmission and a limited-slip differential. Finished in Laguna Seca Blue over …",https://bringatrailer.com/listing/2001-bmw-m3-coupe-45/,https://bringatrailer.com/wp-content/uploads/2026/06/T2A6724-63013-1-copy-2026-06-29-2va-54758.jpg,,"This 2001 BMW M3 is a Canadian-market coupe that has been fitted with a CSL-style carbon-fiber intake system for the 3.2-liter inline-six, which is linked with a six-speed manual transmission and a l… [+3355 chars]",,"Modifiziertes BMW M3 Coupé 2001 mit 6 Gängen. Bei diesem BMW M3 aus dem Jahr 2001 handelt es sich um ein Coupé für den kanadischen Markt, das mit einem Kohlefaser-Ansaugsystem im CSL-Stil für den 3,2-Liter-Reihensechszylinder ausgestattet ist, der mit einem Sechsgang-Schaltgetriebe und einem Sperrdifferenzial verbunden ist. Lackiert in Laguna Seca Blue über …","Modified 2001 BMW M3 Coupe 6-Speed. This 2001 BMW M3 is a Canadian-market coupe that has been fitted with a CSL-style carbon-fiber intake system for the 3.2-liter inline-six, which is linked with a six-speed manual transmission and a limited-slip differential. Finished in Laguna Seca Blue over …","Modified 2001 BMW M3 Tempo 6-Speed. Hoc 2001 BMW M3 est coufa Canadian-fori quae attractio systematis CSL-styli carbonis fibrarum accommodata est pro 3.2 sex-trina inline-sex, quae coniungitur cum transmissione manuali sex velocitate et differentiali limitata. Consummatum est in Laguna Seca Blue super ...",2026-07-06 17:40:07+00:00
472cd3f4e84fc5ad3f4f9f93ad384456,2026-07-04T09:00:10Z,'cold front',sports.yahoo.com,en,0.3,"World Cup 2026 power rankings: undisputed No 1, co-hosts surge and giants fall",We assess the standing of the nations who played in the tournament’s last 32 before the next round of games begins,https://sports.yahoo.com/articles/world-cup-2026-power-rankings-090010602.html,https://s.yimg.com/lo/mysterio/api/0dc9b0a91491e15a715a2c01c9356da6f5829ddd7ae261c90022311098a68414/lightyear_networkapi/resizefill_w1000_h800;quality_80;format_webp/https:%2F%2Fmedia.zenfs.com%2Fen%2Fthe_guardian_765%2Fa88aee34212d77c6941c6bf9b0c07efa,http://web.archive.org/web/20260705063446/https://sports.yahoo.com/articles/world-cup-2026-power-rankings-090010602.html,Les Bleus look unstoppable all six of our judges ranked them No 1. Sweden did their best to cope with the French front four but were blown away by the slickest operation in town. Even when an opponen… [+10310 chars],,"Power-Rangliste der Weltmeisterschaft 2026: unangefochtene Nr. 1, Co-Gastgeber steigen und Giganten fallen. Wir bewerten die Platzierung der Nationen, die in den letzten 32 des Turniers gespielt haben, bevor die nächste Spielrunde beginnt","World Cup 2026 power rankings: undisputed No 1, co-hosts surge and giants fall. We assess the standing of the nations who played in the tournament’s last 32 before the next round of games begins","World Cup 2026 power rankings: I undisputed No, co-milites assurgunt et gigantes cadunt. Nos aestimamus stantem nationum quae ultimo in torneamento luserunt 32 ante proximum circum ludos incipit .",2026-07-07 02:38:56+00:00
0173d9d2e5dca74f462c952938b37d72,2026-07-04T12:45:59Z,'cold front',www.dealnews.com,en,0.3,IZOD Men's Fleece Jacket for $8 + free shipping,"This IZOD fleece jacket now just costs $7.88 at Walmart. It's a drop of $3 from it's already-cheap price of $11. It comes in sizes up to 2XL and features a zip front, attached hood, and two side pockets for a lightweight layer. Buy Now at Walmart
 Features
…",https://www.dealnews.com/IZOD-Mens-Fleece-Jacket-for-8-free-shipping-w-35/21875115.html,https://d.dlnws.com/64599/1783169151-product-trimmed.jpg?h=1024&w=587,http://web.archive.org/web/20260705052053/https://www.dealnews.com/IZOD-Mens-Fleece-Jacket-for-8-free-shipping-w-35/21875115.html,"moreREI's 4th of July Sale includes lots of deals on Arc'teryx jackets, shoes, sweaters, and other activewear, with discounts as high as 70%. The Arc'teryx Women's Patera Down Parka drops to $400, do… [+566 chars]",,"IZOD Herren-Fleecejacke für 8 $ + kostenloser Versand. Diese IZOD-Fleecejacke kostet jetzt bei Walmart nur noch 7,88 $. Das ist ein Preisnachlass von 3 US-Dollar gegenüber dem ohnehin schon günstigen Preis von 11 US-Dollar. Es ist in Größen bis 2XL erhältlich und verfügt über einen Reißverschluss vorne, eine angenähte Kapuze und zwei Seitentaschen für eine leichte Schicht. Jetzt bei Walmart kaufen
 Funktionen
…","IZOD Men's Fleece Jacket for $8 + free shipping. This IZOD fleece jacket now just costs $7.88 at Walmart. It's a drop of $3 from it's already-cheap price of $11. It comes in sizes up to 2XL and features a zip front, attached hood, and two side pockets for a lightweight layer. Buy Now at Walmart
 Features
…","IZOD Hominum vellus Jacket $8 + free shipping. Hoc iaccam vellus IZOD modo $7.88 apud Walmart constat. Gutta est $3 inde iam vilis pretii $11. Venit in magnitudinum usque ad 2XL et lineamenta frontis avi, cucullo affixa, et duo loculi lateris pro strato leve. Buy nunc apud Walmart
 Features
...",2026-07-07 02:38:56+00:00
3247d49f762d5ac3c065ec92302d3d2e,2026-07-04T14:45:00Z,'cold front',brobible.com,en,0.3,California Tourist Visits Legendary Montana Dive Bar. What Happens When He Uses The Front Door?,"What happens when a California man uses the front door to enter the legendary Moose’s Saloon in Kalispell, Montana? Stephan Negherbon recently found out the hard way. Everybody looks at you with squinted eyes as if they have seen an alien, which, they might a…",https://brobible.com/culture/article/mooses-saloon-kalispell-montana-back-door-bar/,https://brobible.com/wp-content/uploads/2026/07/mooses-saloon-kalispell-montana-back-door-bar.jpg,http://web.archive.org/web/20260705014600/https://brobible.com/culture/article/mooses-saloon-kalispell-montana-back-door-bar/,"iStockphoto / @stephan.negherbon / TikTok
What happens when a California man uses the front door to enter the legendary Moose’s Saloon in Kalispell, Montana? Stephan Negherbon recently found out the… [+3175 chars]",,"Kalifornien-Tourist besucht legendäre Montana-Kneipe. Was passiert, wenn er die Haustür benutzt? Was passiert, wenn ein Mann aus Kalifornien die Haustür benutzt, um den legendären Moose’s Saloon in Kalispell, Montana, zu betreten? Stephan Negherbon hat es kürzlich auf die harte Tour erfahren. Jeder schaut dich mit zusammengekniffenen Augen an, als hätte er einen Außerirdischen gesehen, was für ihn vielleicht ein … ist.","California Tourist Visits Legendary Montana Dive Bar. What Happens When He Uses The Front Door?. What happens when a California man uses the front door to enter the legendary Moose’s Saloon in Kalispell, Montana? Stephan Negherbon recently found out the hard way. Everybody looks at you with squinted eyes as if they have seen an alien, which, they might a…","California VIATOR Visitationes Legendary Montana Dive Bar. Quid accidit cum utitur ante ianuam?. Quid accidit cum homo ante ianuam Californiae utitur ut Saloon in Kalispell, Montana fabulosus ingrediatur? Stephanus Negherbon nuper adinvenit viam duram. Te omnes oculis caesis intuentur quasi alienam, quam possent.",2026-07-07 02:38:56+00:00
1e2c5c1adaf9e5074bc819f290abef27,2026-07-04T15:20:07Z,'cold front',bringatrailer.com,en,0.3,1970 Toyota Land Cruiser FJ40 at No Reserve,"This 1970 Toyota Land Cruiser FJ40 wears a repaint in gray and features a winch, a suspension lift, Pro Comp shocks, front disc brakes, air conditioning, and tan upholstery on the seats. Power is provided by a 3.9-liter F inline-six linked with a three-speed …",https://bringatrailer.com/listing/1970-toyota-land-cruiser-fj40-105/,https://bringatrailer.com/wp-content/uploads/2026/06/1970_toyota_land-cruiser-fj40_img_0960-09171-scaled-11088.jpeg,,"This 1970 Toyota Land Cruiser FJ40 wears a repaint in gray and features a winch, a suspension lift, Pro Comp shocks, front disc brakes, air conditioning, and tan upholstery on the seats. Power is pro… [+1510 chars]",,"1970 Toyota Land Cruiser FJ40 ohne Reserve. Dieser Toyota Land Cruiser FJ40 aus dem Jahr 1970 trägt eine Neulackierung in Grau und verfügt über eine Seilwinde, eine Höherlegung der Federung, Pro Comp-Stoßdämpfer, Scheibenbremsen vorne, eine Klimaanlage und hellbraune Polsterung der Sitze. Für die Leistung sorgt ein 3,9-Liter-F-Reihensechszylinder, der mit einem Dreiganggetriebe verbunden ist …","1970 Toyota Land Cruiser FJ40 at No Reserve. This 1970 Toyota Land Cruiser FJ40 wears a repaint in gray and features a winch, a suspension lift, Pro Comp shocks, front disc brakes, air conditioning, and tan upholstery on the seats. Power is provided by a 3.9-liter F inline-six linked with a three-speed …","1970 Toyota Land Yaria FJ40 ad No Subsidium. Hoc 1970 Toyota Land Yaria FJ40 gerit repactum in griseo et in lineamentis PREHENSIO, Suspensio vitae, Pro Comp impulsus, discus frontis scopuli, condiciones aeris, et upholstery tan in sedibus. Potestas providetur a 3.9-sextario F inline-sex annexo cum velocitate trium ...",2026-07-07 02:38:56+00:00
9918513dc69f8b323d6d42086d56bd87,2026-07-04T21:30:00Z,'cold front',www.behindthesteelcurtain.com,en,0.3,"Saturday Night Open Thread: Happy 250th Birthday, America!","Come and join this merry band of Steelers’ faithful for some lively debate about our Steelers, good food, music, and the merits of the odd cold beverage.",https://www.behindthesteelcurtain.com/pittsburgh-steelers-discussion/172161/saturday-night-open-thread-happy-250th-birthday-america,https://s.yimg.com/lo/mysterio/api/9eaf1fca70a493285193874be67cd79f8057a0581ced1ce951b85c525f8a2ac1/lightyear_networkapi/resizefill_w1200;quality_80;format_webp/https:%2F%2Fmedia.zenfs.com%2Fen%2Fsb_nation_articles_115%2F9e49e8e35ff47f1a9d60273408e9ea44,,"Live from Delaware, it's Saturday Night! I, NAS204PSU, am here at BTSC to bring you this Saturday Night Open Thread (aka SNOT).
The United States of America celebrates 250 years today! This old girl… [+2024 chars]",,"Offener Thread am Samstagabend: Alles Gute zum 250. Geburtstag, Amerika!. Kommen Sie und schließen Sie sich dieser fröhlichen Truppe von Steelers-Gläubigen an, um eine lebhafte Debatte über unsere Steelers, gutes Essen, Musik und die Vorzüge des einen oder anderen kalten Getränks zu führen.","Saturday Night Open Thread: Happy 250th Birthday, America!. Come and join this merry band of Steelers’ faithful for some lively debate about our Steelers, good food, music, and the merits of the odd cold beverage.","Nocte Diei Saturni Open Thread: Felix 250th Natalis, America!. Age et iunge hanc laetam catervam Steelers fidelis pro vivida aliqua disceptatione de nostris Steelers, bonis cibis, musica, meritis frigoris imparis potus.",2026-07-07 02:38:56+00:00
f5451c403b7f2c611987a30fd8a8bd63,2026-07-05T04:00:00Z,'cold front',www.americanthinker.com,en,0.3,Mamdomino Theory: Democrats Struggle to Contain the Spread of Communism in Their Party,"Photo Credit:Zohran Mamdani in front of a city
 
 Karamccurdy via wikim cc4By William SullivanUgandan-born, socialism-loving New York City Mayor Zohran Mamdani has emerged as a “kingmaker” in the Democrat party, says one pundit.",https://www.americanthinker.com/articles/2026/07/mamdomino-theory-democrats-struggle-to-contain-the-spread-of-communism-in-their-party/,https://images.americanthinker.com/3m/3m9ha7hvbgc1kgebfrf0_1200.jpg,,"Ugandan-born, socialism-loving New York City Mayor Zohran Mamdani has emerged as a “kingmaker” in the Democrat party, says Phillip Elliot of TIME. 
Two prominent House Democrats lost their primaries… [+7767 chars]",,"Mamdomino-Theorie: Demokraten kämpfen darum, die Ausbreitung des Kommunismus in ihrer Partei einzudämmen. Bildquelle: Zohran Mamdani vor einer Stadt
 
 Karamccurdy über Wikim cc4 Von William Sullivan Der in Uganda geborene, sozialismusliebende New Yorker Bürgermeister Zohran Mamdani hat sich laut einem Experten als „Königsmacher“ in der Demokratischen Partei herausgestellt.","Mamdomino Theory: Democrats Struggle to Contain the Spread of Communism in Their Party. Photo Credit:Zohran Mamdani in front of a city
 
 Karamccurdy via wikim cc4By William SullivanUgandan-born, socialism-loving New York City Mayor Zohran Mamdani has emerged as a “kingmaker” in the Democrat party, says one pundit.","Mamdomino Theoria Democratae contendunt dilatationem communismi in Factione continere. Photo Credit: Zohran Mamdani in conspectu urbis
 
 Karamccurdy per wikim cc4 By William SullivanUgandan primogenitus, socialismus-amans New York City Major Zohran Mamdani emersit ""rex"" in factione Democratica, dicit unum pundit.",2026-07-07 02:38:56+00:00
dd148a8ccaddf68116ea36c0867428f3,2026-07-01T23:23:31Z,'cold impacts',themomedit.com,en,0.3,Your Favorites This Month: June 2026,"From Frēda Salvador flats to the Crocs sandals we keep raving about — June's 20 best sellers, straight from your carts to this list.",https://themomedit.com/june-2026-best-sellers/,https://themomedit.com/wp-content/uploads/2026/07/Top-Sellers-FI3.jpg,,"Happy official July! I hope you guys have been enjoying summer so far (although, the heat in Philly today was actually ridiculous, so consider me ready for winter). 
While I dream about colder days,… [+9540 chars]",,"Ihre Favoriten in diesem Monat: Juni 2026. Von Frēda Salvador Flats bis hin zu den Crocs-Sandalen, von denen wir immer wieder schwärmen – die 20 Bestseller im Juni, direkt aus Ihrem Einkaufswagen zu dieser Liste.","Your Favorites This Month: June 2026. From Frēda Salvador flats to the Crocs sandals we keep raving about — June's 20 best sellers, straight from your carts to this list.","Favores Tui Hoc mense: Iunii 2026. A Frēda Salvador ad Crocs soleas blanditias deliramus circiter - XX Iunii venditores optimi, recta a carris tuis ad hunc album.",2026-07-07 08:18:43+00:00
e1dcc459d17ee23c56e1a5989670ac27,2026-07-02T11:54:20Z,'cold impacts',economictimes.indiatimes.com,en,0.3,The cooler mistake most people make can push picnic food past 40°F in just hours,"Packing your cooler the wrong way can lead to foodborne illness. Contrary to popular belief, placing ice at the bottom traps cold air there, leaving food at the top dangerously warm. Experts advise layering ice packs above your food to allow chill to circulat…",https://economictimes.indiatimes.com/news/international/us/the-cooler-mistake-most-people-make-can-push-picnic-food-past-40f-in-just-hours/articleshow/132137963.cms,"https://img.etimg.com/thumb/msid-132138042,width-1200,height-630,imgsize-1267774,overlay-economictimes/articleshow.jpg",http://web.archive.org/web/20260706085318/https://economictimes.indiatimes.com/news/international/us/the-cooler-mistake-most-people-make-can-push-picnic-food-past-40f-in-just-hours/articleshow/132137963.cms,"Summer means heading outdoors; backyard hangouts, beach trips, road trip snack stops, picnics, and a cooler are always part of the plan. The problem is that most people pack their coolers the same wa… [+4678 chars]",,"Der coolere Fehler, den die meisten Leute machen, besteht darin, das Picknick-Essen in nur wenigen Stunden auf über 40 °F zu erhitzen. Wenn Sie Ihre Kühlbox falsch verpacken, kann dies zu lebensmittelbedingten Krankheiten führen. Entgegen der landläufigen Meinung wird durch das Platzieren von Eis am Boden dort kalte Luft eingeschlossen, sodass das Essen oben gefährlich warm bleibt. Experten empfehlen, Eisbeutel über Ihr Essen zu legen, damit die Kälte zirkulieren kann …","The cooler mistake most people make can push picnic food past 40°F in just hours. Packing your cooler the wrong way can lead to foodborne illness. Contrary to popular belief, placing ice at the bottom traps cold air there, leaving food at the top dangerously warm. Experts advise layering ice packs above your food to allow chill to circulat…","Frigidiorem errorem plerique facere possunt urnam picnic cibum praeteritum 40°F in iustis horis. Stipare tua frigidior Thracam perversa via potest ad morbum edendum ducere. Contra opinionem vulgi, in imo pedicas frigidam aerem positam glaciem ibi relinquens, in summo cibo periculose calefactus est. Periti monent stratis sarcinas glaciem super cibum tuum ut frigus patitur ut circulat...",2026-07-07 08:18:43+00:00
