index,published,keyword,domain,language,valid,title,description,url,image,archive,content,quote,de,en,la,added
d73892ac2a3168f8785474378d23714e,2026-04-12T00:00:00Z,'cold snap',economictimes.indiatimes.com,en,0.3,"AI adoption drives demand: Tech Inc hiring cold but MNCs, local companies covet its leaders","As per experts, many MNCs are considering shifting global tech positions to India, mostly to their GCCs. Ratna Gupta, senior partner, ABC Consultants, said the uptick in tech leadership hiring is strong, especially over the last two–three quarters in comparis…",https://economictimes.indiatimes.com/jobs/c-suite/ai-adoption-drives-demand-tech-inc-hiring-cold-but-mncs-local-companies-covet-its-leaders/articleshow/130198103.cms,"https://img.etimg.com/thumb/msid-130198093,width-1200,height-630,imgsize-4756,overlay-etcareers/articleshow.jpg",,"NEW DELHI: Demand for senior technology leaders in the country is bucking a slowdown in broader tech hiring, with executive search firms reporting rising mandates from both tech and core sector compa… [+3670 chars]",,"Die Einführung von KI steigert die Nachfrage: Tech Inc. stellt wenig ein, aber MNCs und lokale Unternehmen begehren seine Führungskräfte. Experten zufolge erwägen viele multinationale Unternehmen die Verlagerung globaler Technologiepositionen nach Indien, vor allem in ihre Golf-Kooperationspartner. Ratna Gupta, Senior Partner bei ABC Consultants, sagte, der Anstieg bei der Einstellung von Führungskräften im Technologiebereich sei stark, insbesondere in den letzten zwei bis drei Quartalen im Vergleich zu …","AI adoption drives demand: Tech Inc hiring cold but MNCs, local companies covet its leaders. As per experts, many MNCs are considering shifting global tech positions to India, mostly to their GCCs. Ratna Gupta, senior partner, ABC Consultants, said the uptick in tech leadership hiring is strong, especially over the last two–three quarters in comparis…","AI adoptatio petit postulat: Tech Inc hiring frigus sed MNCs, locales societates concupiscunt duces suos. Sicut per peritos, multi MNCs positiones globales mobiles in Indiam, maxime GCCs suas, considerant. Ratna Gupta, senior particeps, ABC Consultorum, dixit uptick in tech conductionis principatus fortis esse, praesertim in duabus proximis tribus partibus in comparis…",2026-04-14 08:45:16+00:00
75010b770e9431989f0fab42476e34bf,2026-04-12T05:30:36Z,'cold snap',golf.com,en,0.3,Cameron Young started this Masters cold. Now there's no hotter player,Tiger Woods won the 1997 Masters after opening with a 40 on Thursday.,https://golf.com/news/cameron-young-started-masters-cold-now-no-hotter-player/,https://s.yimg.com/ny/api/res/1.2/gXJFQ4Hz.FeYGHFIq9jiNA--/YXBwaWQ9aGlnaGxhbmRlcjt3PTEyMDA7aD02NzU7Y2Y9d2VicA--/https://media.zenfs.com/en/golf_articles_613/2b8e58358b609feca6450a30eb4ce694,,"AUGUSTA, Ga. Professional golfers are semi-predictable, almost like publicly-traded companies. They have trends, patterns, tendencies, runs. Cameron Young, the most mature 28-year-old you could ever … [+4613 chars]",,"Cameron Young startete kalt in dieses Masters. Jetzt gibt es keinen heißeren Spieler. Tiger Woods gewann das Masters 1997, nachdem er am Donnerstag mit einer 40 eröffnet hatte.",Cameron Young started this Masters cold. Now there's no hotter player. Tiger Woods won the 1997 Masters after opening with a 40 on Thursday.,Cameron Young hoc magistri frigus inceperunt. Nunc non orci nisl. Tiger Woods 1997 Dominos vicit post foramen cum 40 die Iovis.,2026-04-14 08:45:16+00:00
799f3a8092627aa7056e6615ed9da05b,2026-04-11T02:20:28Z,'cold snap',nypost.com,en,0.6,Yankees’ lineup fails to wake up enough as they suffer third consecutive loss,An offense that spent Wednesday and Thursday being as cold as the air in The Bronx did not instantly heat up in a warmer climate,https://nypost.com/2026/04/10/sports/yankees-fall-to-rays-for-third-straight-loss/,https://nypost.com/wp-content/uploads/sites/2/2026/04/newspress-collage-tqulkb4rf-1775873278290.jpg?quality=75&strip=all&1775858915&w=1200,,"ST. PETERSBURG, Fla. The Yankees wasted no time snapping their scoreless streak Friday night.
But it did not get much better from there.
An offense that spent Wednesday and Thursday being as cold a… [+4254 chars]",,"Die Aufstellung der Yankees wacht nicht ausreichend auf, da sie die dritte Niederlage in Folge hinnehmen müssen. Ein Vergehen, das am Mittwoch und Donnerstag so kalt war wie die Luft in der Bronx, erwärmte sich in einem wärmeren Klima nicht sofort",Yankees’ lineup fails to wake up enough as they suffer third consecutive loss. An offense that spent Wednesday and Thursday being as cold as the air in The Bronx did not instantly heat up in a warmer climate,Yankees line satis excitare non possunt cum tertia detrimenta consecutiva patiuntur. Offensa quae Mercurii et Iovis tam frigida est quam aer in Bronx consumptus est non statim in calidiore climate calefacit,2026-04-14 08:45:16+00:00
09ee4bf9dfc0c513d5fbe4478c8c2c8e,2026-04-11T04:55:13Z,'cold front',kyweathercenter.com,en,0.9,Near Record Highs for Sunday,"Good Saturday, everyone. The weekend is off and running with a weak cold front on top of the region. This is spitting out some isolated showers and storms today before it heads back to the north as a warm front. That’s when a true summertime look and feel eng…",https://kyweathercenter.com/?p=77138,,,"Good Saturday, everyone. The weekend is off and running with a weak cold front on top of the region. This is spitting out some isolated showers and storms today before it heads back to the north as a… [+924 chars]",,"Nahezu Rekordhochs für Sonntag. Schönen Samstag allerseits. Das Wochenende beginnt mit einer schwachen Kaltfront über der Region. Diese spuckt heute einige vereinzelte Schauer und Stürme aus, bevor sie als Warmfront wieder nach Norden zieht. Dann ist ein echter Sommer-Look und -Feeling gefragt …","Near Record Highs for Sunday. Good Saturday, everyone. The weekend is off and running with a weak cold front on top of the region. This is spitting out some isolated showers and storms today before it heads back to the north as a warm front. That’s when a true summertime look and feel eng…","Apud Recordum Maximum pro die dominico. Sabbato bono omnes. Volutpat et cursus ante, in lacinia tellus, eget tristique tellus. Haec aliquot imbres et tempestates solitariae hodie exspuunt antequam eam retro ad septentrionem quasi calido fronte vertant. Id est cum aestivum tempus verum spectant et lat sentiunt…",2026-04-14 08:45:16+00:00
5a600c27197a74e6ecf3edcfd70c7af3,2026-04-01T22:21:00Z,'cold spell',www.snopes.com,en,0.3,Is Trump being added to Mount Rushmore? Here's the stone-cold truth,"In April 2026, sculptors began adding U.S. President Donald Trump's face to Mount Rushmore, the national memorial featuring the faces of four previous presidents.",https://www.snopes.com//fact-check/trump-mount-rushmore/,https://mediaproxy.snopes.com/width/1200/https://media.snopes.com/2026/04/trumps_face_to_appear_on_mount_rushmore_claim.png,http://web.archive.org/web/20260403083332/https://www.snopes.com/fact-check/trump-mount-rushmore/,"Claim:
In April 2026, sculptors began adding U.S. President Donald Trump's face to Mount Rushmore, the national memorial featuring the faces of four previous presidents.
In early April 2026, a rumo… [+5407 chars]",,"Wird Trump zum Mount Rushmore hinzugefügt? Hier ist die eiskalte Wahrheit. Im April 2026 begannen Bildhauer damit, das Gesicht von US-Präsident Donald Trump auf dem Mount Rushmore, dem nationalen Denkmal mit den Gesichtern von vier früheren Präsidenten, anzubringen.","Is Trump being added to Mount Rushmore? Here's the stone-cold truth. In April 2026, sculptors began adding U.S. President Donald Trump's face to Mount Rushmore, the national memorial featuring the faces of four previous presidents.","Estne BUCINUM monte Rushmore addita? Hic est veritas lapidea frigida. Mense Aprili 2026, sculptores US Praeses Donald Trump faciem in Montem Rushmore addere coeperunt, memorialis nationalis facies quattuor praesidentium priorum ponens.",2026-04-14 10:59:07+00:00
b7198f37a70811fc930fb582599b9d7f,2026-04-09T03:09:36Z,'colder than usual',thesurvivalmom.com,en,0.3,How to Prepare for a Long-Term Power Outage (Before You Need To),"How to prepare for a long-term power outage with backup power, food and water, security, and the hard lessons learned from multiple extended outages including Hurricane Beryl.",https://thesurvivalmom.com/preparing-power-outage/,https://thesurvivalmom.com/wp-content/uploads/2017/06/american-public-power-association-bOehaMcbaaE-unsplash-scaled.jpg,,"Our next-door neighbors have lived in their home since 1972. They’ve survived floods, hurricanes, and more power outages than either of them can count. When Hurricane Beryl knocked out power across t… [+37595 chars]",,"So bereiten Sie sich auf einen längeren Stromausfall vor (bevor es nötig ist). Wie man sich mit Notstrom, Nahrung und Wasser, Sicherheit auf einen langfristigen Stromausfall vorbereitet und welche harten Lehren man aus mehreren längeren Ausfällen, einschließlich Hurrikan Beryl, gezogen hat.","How to Prepare for a Long-Term Power Outage (Before You Need To). How to prepare for a long-term power outage with backup power, food and water, security, and the hard lessons learned from multiple extended outages including Hurricane Beryl.","Praeparare ad diutum terminum Power Outage (Antequam debes). Quam eu eu vim parare ad longum tempus cum potentia, cibi et aquae, securitatis, et difficiles lectiones ex multiplicibus enucleationibus productis incluso Hurricane Beryl didicit.",2026-04-14 16:04:43+00:00
58a4cfcef77474d05b1b0cdf78c0b8cb,2026-04-09T07:59:25Z,'heating system',economictimes.indiatimes.com,en,0.3,Volkswagen Taigun facelift 2026 launches in India with new 8-speed auto gearbox & better efficiency: Check updated features here,"Volkswagen Taigun facelift features: Volkswagen has launched the updated Taigun facelift with more than 40 new features across design, technology, comfort and performance. Key additions include a new 8-speed automatic transmission, ventilated front seats, pan…",https://economictimes.indiatimes.com/news/new-updates/volkswagen-taigun-facelift-2026-launches-in-india-with-new-8-speed-auto-gearbox-better-efficiency-check-updated-features-here/articleshow/130133735.cms,"https://img.etimg.com/thumb/msid-130134152,width-1200,height-630,imgsize-661597,overlay-economictimes/articleshow.jpg",,"Volkswagen has introduced the much-awaited facelift of its popular mid-size SUV, the Taigun, for 2026. The updated model brings more than 40 new features across design, technology, comfort, performan… [+2841 chars]",,"Das Volkswagen Taigun Facelift 2026 kommt in Indien mit neuem 8-Gang-Automatikgetriebe und besserer Effizienz auf den Markt: Sehen Sie sich die aktualisierten Funktionen hier an. Features des Volkswagen Taigun Facelifts: Volkswagen hat das aktualisierte Taigun Facelift mit mehr als 40 neuen Features in den Bereichen Design, Technologie, Komfort und Leistung auf den Markt gebracht. Zu den wichtigsten Neuerungen gehören ein neues 8-Gang-Automatikgetriebe, belüftete Vordersitze, eine Paneel…","Volkswagen Taigun facelift 2026 launches in India with new 8-speed auto gearbox & better efficiency: Check updated features here. Volkswagen Taigun facelift features: Volkswagen has launched the updated Taigun facelift with more than 40 new features across design, technology, comfort and performance. Key additions include a new 8-speed automatic transmission, ventilated front seats, pan…","Volkswagen Taigun facelift 2026 in India movet cum novis 8-celeritate auto- gearbox & meliorem efficientiam: perscriptio notas renovatas hic. Volkswagen Taigun lineamenta facelift: Volkswagen renovatum Taigun facelift eiecit cum plus quam 40 novis notis per consilium, technologiam, consolationem et effectum. Clavis additamenta includunt novam 8-celeritate transmissio latae sententiae, ventilata ante sedilia, sartagine…",2026-04-14 16:04:43+00:00
fccf3229199f3d22a61ee9e185e09074,2026-04-01T00:00:00Z,'cold impacts',www.nature.com,en,0.3,Seasonal outdoor thermal comfort and neutral PET thresholds in a severe cold Dwa climate city of Shenyang China,Scientific Reports - Seasonal outdoor thermal comfort and neutral PET thresholds in a severe cold Dwa climate city of Shenyang China,https://www.nature.com/articles/s41598-026-46003-0,,,"<li>Higashino, M., Aso, D. &amp; Stefan, H. G. Acceleration of rises in the level of Higashino, M., Aso, D. &amp; Stefan, H. G. Acceleration of rises in the level of rivers induced by rising air temp… [+15154 chars]",,"Saisonaler thermischer Komfort im Freien und neutrale PET-Schwellenwerte in einer Stadt mit streng kaltem Dwa-Klima in Shenyang, China. Wissenschaftliche Berichte – Saisonaler thermischer Komfort im Freien und neutrale PET-Schwellenwerte in einer Stadt mit streng kaltem Dwa-Klima in Shenyang, China",Seasonal outdoor thermal comfort and neutral PET thresholds in a severe cold Dwa climate city of Shenyang China. Scientific Reports - Seasonal outdoor thermal comfort and neutral PET thresholds in a severe cold Dwa climate city of Shenyang China,Temporis velit scelerisque commodo et neutra PET limina in gravi frigore Dwa climatis urbem Shenyang Sinarum. Scientific Renuntiationes - Temporis velit scelerisque commodo ac neutra PET limina in gravi frigore aeris Dwa urbis Shenyang Sinarum,2026-04-14 20:48:55+00:00
7cad77bdfb795ba4708cb56bfb8d834c,2026-04-04T02:44:49Z,'cold impacts',www.sciencedaily.com,en,0.3,"Meteor impacts may have sparked life on Earth, scientists say","Asteroid impacts may have helped kick-start life on Earth by creating hot, chemical-rich environments ideal for early biology. These impact-generated hydrothermal systems could have lasted thousands of years—long enough for life’s building blocks to form. Sci…",https://www.sciencedaily.com/releases/2026/04/260403224449.htm,https://www.sciencedaily.com/images/1920/giant-asteroid-striking-earth.webp,,"Meteor strikes may have done more than reshape Earth's surface. New research suggests they could have created the hot, chemically rich environments needed for life to begin.""No one knows, from a scie… [+6426 chars]",,"Meteoreinschläge könnten Leben auf der Erde entfacht haben, sagen Wissenschaftler. Asteroideneinschläge haben möglicherweise dazu beigetragen, das Leben auf der Erde anzukurbeln, indem sie heiße, chemikalienreiche Umgebungen geschaffen haben, die sich ideal für die frühe Biologie eignen. Diese durch Einwirkungen erzeugten hydrothermalen Systeme könnten Tausende von Jahren überdauert haben – lange genug, um die Bausteine ​​des Lebens zu bilden. Wissenschaft…","Meteor impacts may have sparked life on Earth, scientists say. Asteroid impacts may have helped kick-start life on Earth by creating hot, chemical-rich environments ideal for early biology. These impact-generated hydrothermal systems could have lasted thousands of years—long enough for life’s building blocks to form. Sci…","Ut metus ligula, sagittis vitae tellus in, blandit dictum est. Impetus asteroides fortasse vitam calcitranti-incipitis in Terra adiuvaverunt creando calidum, chemicorum ambitus culturas aptas primae biologiae. Hae systemata hydrothermalia impacta generatae milia annorum durare potuerunt - satis diu ad cuneos aedificationis vitae formandos. Sci…",2026-04-14 20:48:55+00:00
6b4ca5a1c075a326401b6d9077216fd3,2026-04-06T09:04:30Z,'colder than usual',www.aljazeera.com,en,0.3,A visual guide to Artemis II and previous missions to the moon,Artemis II is expected to break the record for the farthest distance humans have travelled from Earth.,https://www.aljazeera.com/news/2026/4/6/a-visual-guide-to-artemis-ii-and-previous-missions-to-the-moon,https://www.aljazeera.com/wp-content/uploads/2026/04/INTERACTIVE-Moon-poster-image-1775455632.png?resize=1200%2C630,http://web.archive.org/web/20260406230709/https://www.aljazeera.com/news/2026/4/6/a-visual-guide-to-artemis-ii-and-previous-missions-to-the-moon,"Monday, April 6, 2026, is one of the most significant days for human spaceflight in more than 50 years.
At 13:56 EDT (17:56 GMT) Artemis II mission is expected to break the record for the farthest d… [+8432 chars]",,"Ein visueller Führer zu Artemis II und früheren Missionen zum Mond. Es wird erwartet, dass Artemis II den Rekord für die weiteste Distanz bricht, die Menschen von der Erde zurückgelegt haben.",A visual guide to Artemis II and previous missions to the moon. Artemis II is expected to break the record for the farthest distance humans have travelled from Earth.,Ductor visualis ad Artemis II et missiones priorem ad lunam. Artemis II expectatur recordum frangere propter longinquum spatium homines e Terra profecti sunt.,2026-04-15 02:03:52+00:00
6a18ea636d19df50ec4a891c9cde41eb,2026-04-10T05:00:00Z,'colder than usual',wattsupwiththat.com,en,0.3,The ‘Leading UK Scientists’ Letter Urging Abandonment of North Sea is Ideology Masquerading as Science,"From Tilak’s Substack Tilak Doshi The Financial Times reported on Good Friday that “more than 65 leading UK scientists” had signed an open letter, published as a Google Doc, urging the Government to abandon…",https://wattsupwiththat.com/2026/04/09/the-leading-uk-scientists-letter-urging-abandonment-of-north-sea-is-ideology-masquerading-as-science/,https://i0.wp.com/wattsupwiththat.com/wp-content/uploads/2026/04/Indices_Financial_Times.webp?fit=1024%2C512&quality=75&ssl=1,,"From Tilak’s Substack
Tilak Doshi
The Financial Times reported on Good Friday that more than 65 leading UK scientists had signed an open letter, published as a Google Doc, urging the Government to … [+16402 chars]",,"Der Brief „Führender britischer Wissenschaftler“, in dem er zur Aufgabe der Nordsee drängt, ist eine als Wissenschaft getarnte Ideologie. Aus Tilaks Substack Tilak Doshi Die Financial Times berichtete am Karfreitag, dass „mehr als 65 führende britische Wissenschaftler“ einen offenen Brief unterzeichnet hatten, der als Google-Dokument veröffentlicht wurde und die Regierung aufforderte, aufzugeben …","The ‘Leading UK Scientists’ Letter Urging Abandonment of North Sea is Ideology Masquerading as Science. From Tilak’s Substack Tilak Doshi The Financial Times reported on Good Friday that “more than 65 leading UK scientists” had signed an open letter, published as a Google Doc, urging the Government to abandon…","The 'deducere UK Scientistae' Epistola Urgens Deditio Maris Septentrionalis est Ideologia Masquerading ut Scientia. Ex Substack Tilak Tilak Doshi Renuntiata Tempora Financial in Parasceve quod ""plus 65 plusquam 65 phisicum UK scientiarum"" subscripserat epistolam apertam, evulgatam Google Doc, hortans Regimen ut desereret…",2026-04-15 02:03:52+00:00
0ca9b670d716cd561348b1d0024cbc52,2026-04-10T05:13:33Z,'colder than usual',www.thehindubusinessline.com,en,0.3,"March 2026 was the fourth-warmest month on record, says European weather agency","Sea surface temperature in March stood at 20.97°C, the second highest on record, indicating likely El Niño conditions later this year, says Copernicus report",https://www.thehindubusinessline.com/economy/agri-business/march-2026-was-the-fourth-warmest-month-on-record-says-european-weather-agency/article70845952.ece,https://bl-i.thgim.com/public/incoming/v5cy5p/article68152961.ece/alternates/LANDSCAPE_1200/PTI05_06_2024_000138B.jpg,,"March 2026 was the fourth-warmest month on record across the world, with temperatures 1.48°C higher than before industrialisation, the Copernicus Climate Change Service (C3S), implemented by the Euro… [+3061 chars]",,"Nach Angaben der Europäischen Wetteragentur war der März 2026 der viertwärmste Monat seit Beginn der Aufzeichnungen. Laut Copernicus-Bericht lag die Meeresoberflächentemperatur im März bei 20,97 °C, dem zweithöchsten seit Beginn der Aufzeichnungen, was auf wahrscheinliche El-Niño-Bedingungen später in diesem Jahr hindeutet","March 2026 was the fourth-warmest month on record, says European weather agency. Sea surface temperature in March stood at 20.97°C, the second highest on record, indicating likely El Niño conditions later this year, says Copernicus report","Martius 2026 mense Martio 2026 in commentariis calidissimus erat, dicit procurationem tempestatis Europaei. Temperatura superficiei maris mense Martio stabat 20.97°C, secunda summa in memoria, ostendens condiciones probabile El Niño hoc anno post relationem Copernicus.",2026-04-15 02:03:52+00:00
8ebaabe29b73b3057a343d3c74bd7b7d,2026-04-12T23:21:08Z,'colder than usual',punchng.com,en,0.3,NELFUND: The accidental stimulus package,"Discover how NELFUND is more than a student loan scheme—it’s a massive, targeted economic stimulus package injecting billions into Nigeria’s youth.

Read More: https://punchng.com/nelfund-the-accidental-stimulus-package/",https://punchng.com/nelfund-the-accidental-stimulus-package/,https://cdn.punchng.com/wp-content/uploads/2025/03/11201609/NELFUND-1079x630.jpg,,"The basic premise of a student loan is a beautiful piece of financial time travel. Right now, you are 19, you have no money, and your marketable skills consist mostly of arguing on X (formerly Twitte… [+10379 chars]",,"NELFUND: Das zufällige Konjunkturpaket. Entdecken Sie, warum NELFUND mehr ist als ein Studienkreditprogramm – es ist ein massives, gezieltes Konjunkturpaket, das der Jugend Nigerias Milliarden zugute kommt.

Lesen Sie mehr: https://punchng.com/nelfund-the-accidental-stimulus-package/","NELFUND: The accidental stimulus package. Discover how NELFUND is more than a student loan scheme—it’s a massive, targeted economic stimulus package injecting billions into Nigeria’s youth.

Read More: https://punchng.com/nelfund-the-accidental-stimulus-package/","NELFUND: In stimuli sarcina accidentalis. Quomodo NELFUND plus quam discipulus mutui schema - est ingens, stimulus oeconomicus iaculis injiciens billions in iuvenem Nigeriae.

Lege More: https://punchng.com/nelfund-the-accidental-stimulus-package/",2026-04-15 02:03:52+00:00
67eb2b52310d72b60af88dfe00210a5a,2026-04-02T19:00:00Z,'cold spell',reactormag.com,en,0.2,Read an Excerpt From The Killing Spell by Shay Kauwe,"In a future where language magic reigns, a young Hawaiian woman must solve a murder to clear her name.
The post Read an Excerpt From The Killing Spell by Shay Kauwe appeared first on Reactor.",https://reactormag.com/excerpts-the-killing-spell-by-shay-kauwe/,https://reactormag.com/wp-content/uploads/2026/03/The-Killing-Spell-header.png,,"We’re thrilled to share an excerpt from The Killing Spell by Shay Kauwe, a new fantasy novel publishing with Saga Press on April 14th.
Kea Petrova is dealing with more than her fair share of trouble… [+13710 chars]",,"Lesen Sie einen Auszug aus „The Killing Spell“ von Shay Kauwe. In einer Zukunft, in der die Magie der Sprache herrscht, muss eine junge Hawaiianerin einen Mord aufklären, um ihren Namen reinzuwaschen.
Der Beitrag „Read an Excerpt From The Killing Spell“ von Shay Kauwe erschien zuerst auf Reactor.","Read an Excerpt From The Killing Spell by Shay Kauwe. In a future where language magic reigns, a young Hawaiian woman must solve a murder to clear her name.
The post Read an Excerpt From The Killing Spell by Shay Kauwe appeared first on Reactor.","Read an Excerpt from The Kill Spell by Shay Kauwe. In futuro, ubi lingua magica regnat, femina iuvenis Hawaiian caedem solvere debet ut nomen eius purgaret.
Posta Read excerptum de Cantatio interfectionis Shay Kauwe primum apparuit in Reactor.",2026-04-15 06:53:18+00:00
6d24ca0bee130ba4a3d6bab6eb94f1eb,2026-04-05T11:43:15Z,'cold wave',www.jpost.com,en,0.2,Miracle in Sinaia: Israeli underdogs break Soviet chess dominance in 1965,"In 1965, a group of Israeli amateurs shocked the Soviet chess elite, securing a moral victory in the Cold War arena. The ""Miracle in Sinaia"" remains a powerful symbol of Israeli resilience.",https://www.jpost.com/israel-news/sports/article-892089,https://s.yimg.com/os/en/jerusalem_post_articles_818/559a4654fd47c7767147de4e6f43c0b4,http://web.archive.org/web/20260406044419/https://www.jpost.com/israel-news/sports/article-892089,"In 1965, a group of Israeli amateurs shocked the Soviet chess elite, securing a moral victory in the Cold War arena. The ""Miracle in Sinaia"" remains a powerful symbol of Israeli resilience.
In the m… [+12806 chars]",,Wunder in Sinaia: Israelische Außenseiter brechen 1965 die sowjetische Schachdominanz. 1965 schockierte eine Gruppe israelischer Amateure die sowjetische Schachelite und sicherte sich einen moralischen Sieg im Kalten Krieg. Das „Wunder von Sinaia“ bleibt ein starkes Symbol der israelischen Widerstandsfähigkeit.,"Miracle in Sinaia: Israeli underdogs break Soviet chess dominance in 1965. In 1965, a group of Israeli amateurs shocked the Soviet chess elite, securing a moral victory in the Cold War arena. The ""Miracle in Sinaia"" remains a powerful symbol of Israeli resilience.","Miraculum in Sinaia: canibus Israeli in fossis latrunculorum dominatum Sovieticum effringunt anno 1965. Anno 1965, coetus Israelitici admirati sunt electos latrunculorum Sovieticorum, qui moralem victoriam in Belli Frigidi arena impetrarunt. ""Miraculum in Sinai"" validum symbolum mollitiae Israelis manet.",2026-04-15 10:56:02+00:00
