index,published,keyword,domain,language,valid,title,description,url,image,archive,content,quote,de,en,la,added
d4ff100840d9989a007f358a48bd2302,2026-07-05T18:30:09Z,'cold impacts',spacedaily.com,en,0.3,"Titan’s atmosphere is so dense and its gravity so weak that a person with the right winged suit could plausibly glide through its sky — and those same conditions make Titan one of the most forgiving large worlds in the solar system for a spacecraft to descend onto, even if the surface itself is colder than Antarctica by almost 100 degrees Celsius.","Titan’s air is so thick, and its gravity so gentle, that a person wearing the right pair of wings could plausibly push off the ground and glide through its sky. It is one of the strangest and most charming facts in the solar system, and it comes straight out …",https://spacedaily.com/t-titans-atmosphere-is-so-dense-and-its-gravity-so-weak-that-a-person-with-the-right-winged-suit-could-plausibly-glide-through-its-sky-and-those-same-conditions-make-titan-one-of-the/,https://spacedaily.com/wp-content/uploads/2026/07/newimagesize-2026-07-05T220030.101.png,http://web.archive.org/web/20260705225248/https://spacedaily.com/t-titans-atmosphere-is-so-dense-and-its-gravity-so-weak-that-a-person-with-the-right-winged-suit-could-plausibly-glide-through-its-sky-and-those-same-conditions-make-titan-one-of-the/,"Titan’s air is so thick, and its gravity so gentle, that a person wearing the right pair of wings could plausibly push off the ground and glide through its sky. It is one of the strangest and most ch… [+4714 chars]",,"Titans Atmosphäre ist so dicht und seine Schwerkraft so schwach, dass eine Person mit dem rechten Flügelanzug durchaus durch seinen Himmel gleiten könnte – und dieselben Bedingungen machen Titan zu einem der tolerantesten großen Welten im Sonnensystem für den Abstieg eines Raumschiffs, selbst wenn die Oberfläche selbst fast 100 Grad Celsius kälter als die Antarktis ist sein Himmel. Es ist eine der seltsamsten und bezauberndsten Tatsachen im Sonnensystem, und sie kommt direkt ans Licht …","Titan’s atmosphere is so dense and its gravity so weak that a person with the right winged suit could plausibly glide through its sky — and those same conditions make Titan one of the most forgiving large worlds in the solar system for a spacecraft to descend onto, even if the surface itself is colder than Antarctica by almost 100 degrees Celsius.. Titan’s air is so thick, and its gravity so gentle, that a person wearing the right pair of wings could plausibly push off the ground and glide through its sky. It is one of the strangest and most charming facts in the solar system, and it comes straight out …","Titan atmosphaera tam densa est et gravitas tam debilis ut quis cum dextra lis alata verisimiliter per caelum labatur — et easdem condiciones faciunt Titan unam ex maxime ignoscentibus mundo in solari ratione spatii ad descendendum, etsi superficies ipsa frigidior est quam Antarctica prope 100 gradus Celsi.. Titan aer tam crassus est, et eius gravitas tam lenis alarum, ut alarum saxum depellere possit. Est unum mirabiles et venustissimas res in mundo solari, et recta exit ...",2026-07-07 08:18:43+00:00
63d17a28554813ed6776d2df77ee94d4,2026-07-06T06:08:26Z,'cold spell',www.lifesciencesworld.com,en,0.3,Where do bats go in winter?,"Where Do Bats Go in Winter? The answer to “Where do bats go in winter?” is complex: it depends on the species and location, but generally, bats either hibernate in cool, dark places or migrate to warmer climates to survive the cold months. Introduction: Unrav…",https://www.lifesciencesworld.com/where-do-bats-go-in-winter/,,,"The answer to “Where do bats go in winter?” is complex: it depends on the species and location, but generally, bats either hibernate in cool, dark places or migrate to warmer climates to survive the … [+9950 chars]",,"Wohin gehen Fledermäuse im Winter? Wohin gehen Fledermäuse im Winter? Die Antwort auf „Wohin gehen Fledermäuse im Winter?“ ist komplex: Es hängt von der Art und dem Standort ab, aber im Allgemeinen überwintern Fledermäuse entweder an kühlen, dunklen Orten oder ziehen in wärmere Klimazonen, um die kalten Monate zu überleben. Einleitung: Unrav…","Where do bats go in winter?. Where Do Bats Go in Winter? The answer to “Where do bats go in winter?” is complex: it depends on the species and location, but generally, bats either hibernate in cool, dark places or migrate to warmer climates to survive the cold months. Introduction: Unrav…","Ubi eunt vespertiliones in hieme ?. Ubi Ite in hyeme vespertiliones? Respondetur ""Ubi vespertiliones hieme?"" complexus est: pendet ex speciebus et situ, sed plerumque, vespertiliones vel in locis frigidis, obscuris, vel in calidioribus locis, ut mensibus frigidis superessent, migrare. Introduction: Unrav…",2026-07-07 21:19:38+00:00
c262749dfbd4824da0d1898492f33d5c,2026-07-01T14:55:20Z,'cold wave',www.powerlineblog.com,en,0.8,Everything Is Political,"Western Europe has been sweltering under a heat wave, and quite a few people have died as a result. The heat wave is unusual, but the phenomenon isn’t: every year, lots of Europeans die from extremes of heat and cold, far more than in the United States. And E…",http://www.powerlineblog.com/archives/2026/07/everything-is-political.php,https://www.powerlineblog.com/wp-content/themes/powerline/images/icon.png,http://web.archive.org/web/20260702033717/https://www.powerlineblog.com/archives/2026/07/everything-is-political.php,"Western Europe has been sweltering under a heat wave, and quite a few people have died as a result. The heat wave is unusual, but the phenomenon isn’t: every year, lots of Europeans die from extremes… [+2933 chars]",,"Alles ist politisch. Westeuropa litt unter einer Hitzewelle, in deren Folge zahlreiche Menschen gestorben sind. Die Hitzewelle ist ungewöhnlich, das Phänomen jedoch nicht: Jedes Jahr sterben viele Europäer an extremer Hitze und Kälte, weit mehr als in den Vereinigten Staaten. Und E…","Everything Is Political. Western Europe has been sweltering under a heat wave, and quite a few people have died as a result. The heat wave is unusual, but the phenomenon isn’t: every year, lots of Europeans die from extremes of heat and cold, far more than in the United States. And E…","Omnia Politica est. Europa occidentali sub undis aestus aestuosa est, et satis pauci homines consecuti mortui sunt. Fluctus aestus insolitus est, sed phaenomenon non est: quotannis, multi Europaei ex extremis caloris et frigoris, multo plus quam in Civitatibus Foederatis moriuntur. Et E…",2026-07-07 21:19:38+00:00
4cd639ef96b833539f1dd9ba97dea76b,2026-07-06T09:00:00Z,'cold front',www.npr.org,en,0.3,Hate food waste? 7 creative ways to turn your leftovers into a new meal,We asked our audience to share their favorite go-to recipes for leftovers. Here are seven dishes — like stuffed peppers and a biryani casserole — that can help you use up all your fridge scraps.,https://www.npr.org/2026/07/06/nx-s1-5879248/hate-food-waste-7-creative-ways-to-turn-your-leftovers-into-a-new-meal,https://npr.brightspotcdn.com/dims3/default/strip/false/crop/5000x2813+0+260/resize/1400/quality/85/format/jpeg/?url=http%3A%2F%2Fnpr-brightspot.s3.amazonaws.com%2F95%2F4d%2F4a4a4c7e4c7eb168f6d60b3be0a6%2F260702-lk-leftoversdig-3x2.jpg,http://web.archive.org/web/20260706202227/https://www.npr.org/2026/07/06/nx-s1-5879248/hate-food-waste-7-creative-ways-to-turn-your-leftovers-into-a-new-meal,Leftovers are a strangely controversial topic. Some people love them (eating cold pizza while standing in front of the fridge is a treasured pastime of mine). And some people can't stand the idea of … [+4648 chars],,"Hassen Sie Lebensmittelverschwendung? 7 kreative Möglichkeiten, Ihre Reste in eine neue Mahlzeit zu verwandeln. Wir haben unser Publikum gebeten, seine Lieblingsrezepte für Reste mitzuteilen. Hier sind sieben Gerichte – wie gefüllte Paprikaschoten und ein Biryani-Auflauf –, mit denen Sie alle Ihre Kühlschrankabfälle aufbrauchen können.",Hate food waste? 7 creative ways to turn your leftovers into a new meal. We asked our audience to share their favorite go-to recipes for leftovers. Here are seven dishes — like stuffed peppers and a biryani casserole — that can help you use up all your fridge scraps.,Odi cibum perdere? 7 vias creandi tuas reliquias in novam prandium converte. Auditores nostros rogavimus ut gratissimum ite-recipes pro reliquiis communicarent. Hic sunt septem acetabula - sicut piperis saginati et thunni biryani - quae omnia frusta tua fridge uti possunt.,2026-07-10 02:33:02+00:00
8a8ca4d139e1d81d33aa01cdbddac121,2026-07-07T18:16:18Z,'cold spell',timesofindia.indiatimes.com,en,0.3,"After 1st intense monsoon spell, rain to continue","Delhi saw its most intense monsoon spell since July 2, causing waterlogging and flight delays; IMD issues yellow alert as rain likely till Saturday.",https://timesofindia.indiatimes.com/city/delhi/after-1st-intense-monsoon-spell-rain-to-continue/articleshow/132245766.cms,https://static.toiimg.com/photo/msid-47529300/47529300.jpg,,"<ul><li>News</li>
<li>After 1st intense monsoon spell, rain to continue</li></ul>
Follow Us On Social Media
Tyler Robinsons Bizarre Chat With Cop Minutes Before Charlie Kirk Shooting Goes Viral | … [+2859 chars]",,"Nach der ersten intensiven Monsunperiode regnet es weiterhin. Delhi erlebte die intensivste Monsunperiode seit dem 2. Juli, die zu Staunässe und Flugverspätungen führte; IMD gibt Alarmstufe Gelb aus, da bis Samstag mit Regen zu rechnen ist.","After 1st intense monsoon spell, rain to continue. Delhi saw its most intense monsoon spell since July 2, causing waterlogging and flight delays; IMD issues yellow alert as rain likely till Saturday.","Post 1st intensum ETESIA incantatores, pluviam pergere. Delhi vidit suum acerrimum incantamentum cum Iulio II ETESIA, umoris et fugae moras causans; IMD exit flavum erectum ut pluviam probabile usque ad Sabbatum.",2026-07-10 08:17:54+00:00
aaacb7a035321bcf577363388fc72e61,2026-07-03T09:28:38Z,'insulation house',cryptobriefing.com,en,0.2,Trump and allies push to reshape Federal Reserve after Supreme Court ruling,"Trump's efforts to influence the Fed could impact its independence, affecting monetary policy and potentially altering financial regulations.
The post Trump and allies push to reshape Federal Reserve after Supreme Court ruling appeared first on Crypto Briefin…",https://cryptobriefing.com/trump-reshape-federal-reserve-supreme-court/,https://static.cryptobriefing.com/wp-content/uploads/2026/07/03052831/trump-allies-double-down-on-efforts-to-reshape-federal-reser-800x420.jpeg,,"The Supreme Court blocked the president from firing Fed Governor Lisa Cook, but the White House isn't done trying to bend the central bank to its will The Supreme Court just told President Trump he c… [+2859 chars]",,"Trump und seine Verbündeten drängen nach dem Urteil des Obersten Gerichtshofs auf eine Umgestaltung der Federal Reserve. Trumps Bemühungen, Einfluss auf die Fed zu nehmen, könnten deren Unabhängigkeit beeinträchtigen, die Geldpolitik beeinflussen und möglicherweise die Finanzvorschriften ändern.
Der Beitrag Trump und seine Verbündeten drängen auf eine Umgestaltung der Federal Reserve, nachdem das Urteil des Obersten Gerichtshofs erstmals auf Crypto Briefin erschien …","Trump and allies push to reshape Federal Reserve after Supreme Court ruling. Trump's efforts to influence the Fed could impact its independence, affecting monetary policy and potentially altering financial regulations.
The post Trump and allies push to reshape Federal Reserve after Supreme Court ruling appeared first on Crypto Briefin…","Trump et socii dis ad reshare Subsidium Foederatum postquam Summi Court regnaverunt. Trump conatus ad H influere potuit suam independentiam labefactare, afficiens consilium nummarium et potentias normas oeconomicas mutans.
Post BUCINUM et sociis dis reshare Subsidium Foederatum post Summi Court regnantis apparuit primum in Crypto Briefin…",2026-07-11 20:42:26+00:00
bf3bb4820c94ae2c9bb363255216080e,2026-07-03T16:39:03Z,'insulation house',cryptobriefing.com,en,0.2,Supreme Court shields Fed independence while expanding presidential power over other agencies,"The Supreme Court's decision reinforces Fed independence, potentially stabilizing markets, while increasing presidential influence over other agencies.
The post Supreme Court shields Fed independence while expanding presidential power over other agencies appe…",https://cryptobriefing.com/supreme-court-fed-independence-ruling/,https://static.cryptobriefing.com/wp-content/uploads/2026/07/03123856/photo-united-states-supreme-court-building-in-washington-dc-3-800x420.jpeg,,"A split decision preserves the central bank's autonomy from White House removal power, a ruling with direct implications for crypto and traditional markets alike. The Supreme Court just handed down a… [+3091 chars]",,"Der Oberste Gerichtshof schützt die Unabhängigkeit der Fed und weitet gleichzeitig die Macht des Präsidenten über andere Behörden aus. Die Entscheidung des Obersten Gerichtshofs stärkt die Unabhängigkeit der Fed, stabilisiert möglicherweise die Märkte und erhöht gleichzeitig den Einfluss des Präsidenten auf andere Behörden.
Der Oberste Gerichtshof schützt die Unabhängigkeit der Fed und weitet gleichzeitig die Macht des Präsidenten über andere Behörden aus.","Supreme Court shields Fed independence while expanding presidential power over other agencies. The Supreme Court's decision reinforces Fed independence, potentially stabilizing markets, while increasing presidential influence over other agencies.
The post Supreme Court shields Fed independence while expanding presidential power over other agencies appe…","Summi Court scuta libertatem H sunt dum potestatem praesidentialem in alia agentia dilatant. Iudicium Summi Court confirmat H independentiam, potentia stabilientem mercatus, dum auctoritas praesidentialis super alias agenciones augetur.
Post Summum Curiam scuta libertatem H sunt dum potentia praesidentialis dilatatur in alias agencies appe…",2026-07-11 20:42:26+00:00
9480aa2c77d3d16138b009eeb1362a36,2026-07-04T16:19:06Z,'insulation house',www.theverge.com,en,0.2,White House deletes thousands of web pages about energy conservation as heatwave slams US,"The US Department of Energy reportedly deleted about 6,000 pages related to energy conservation as a historic heatwave tears across the country. The deletion was suspiciously timed, following Republican outrage over Mayor Zohran Mamdani asking New Yorkers to …",https://www.theverge.com/policy/961449/white-house-mamdani-heatwave-deletion,https://platform.theverge.com/wp-content/uploads/sites/2/chorus/uploads/chorus_asset/file/25739860/1998630585.jpg?quality=90&strip=all&crop=0%2C21.573074875549%2C100.51963048499%2C78.946585612932&w=1200,http://web.archive.org/web/20260705010024/https://www.theverge.com/policy/961449/white-house-mamdani-heatwave-deletion,"<ul><li></li><li></li><li></li></ul>
It follows Republican outrage over Mamdani offering the same heatwave advice as everyone else.
It follows Republican outrage over Mamdani offering the same heat… [+2897 chars]",,"Das Weiße Haus löscht Tausende Webseiten zum Thema Energieeinsparung, während die Hitzewelle die USA hart trifft. Berichten zufolge hat das US-Energieministerium etwa 6.000 Seiten zum Thema Energieeinsparung gelöscht, als eine historische Hitzewelle das Land heimgesucht hat. Die Löschung erfolgte zu einem verdächtigen Zeitpunkt, nachdem sich die Republikaner darüber empört hatten, dass Bürgermeister Zohran Mamdani die New Yorker aufgefordert hatte, …","White House deletes thousands of web pages about energy conservation as heatwave slams US. The US Department of Energy reportedly deleted about 6,000 pages related to energy conservation as a historic heatwave tears across the country. The deletion was suspiciously timed, following Republican outrage over Mayor Zohran Mamdani asking New Yorkers to …","Domus Alba milia paginarum interretialium delet de industria conservationis sicut in aquis heatwave slams US. US Department of Energy circiter 6.000 paginas referens ad conservationem industriae conservationem tamquam lacrimas historicas per patriam relatas Energy delevit. Deletio erat suspiciose intempestiva, sequens iniuriam republicanam in Majorem Zohran Mamdani Novi Eboraci ad ...",2026-07-11 20:42:26+00:00
2b4b5218568bbd0c68ad340d8f16af40,2026-07-02T13:01:03Z,'insulation house',www.cnet.com,en,0.3,10 Smart Home Tricks That Keep Your House Cool Without Spiking Your Energy Bill,These ten smart home cooling tricks can keep your house comfortable during a heat wave without sending your energy bill through the roof.,https://www.cnet.com/home/security/10-smart-home-tricks-that-keep-your-house-cool-without-spiking-your-energy-bill/,https://www.cnet.com/a/img/resize/df53d278c0909beaf0092a6ec7a5a9dbd9ffc93e/hub/2026/06/26/0bcc74bb-9c04-4392-8120-05eeb52f4d1e/gettyimages-1498386235.jpg?auto=webp&fit=crop&height=675&width=1200,,"Heat waves have gotten harder to ignore, and not just because they're more frequent. The combination of extreme outdoor temperatures, pets and vulnerable family members inside and an energy bill that… [+8631 chars]",,"10 Smart-Home-Tricks, die Ihr Haus kühl halten, ohne Ihre Stromrechnung in die Höhe zu treiben. Mit diesen zehn Smart-Home-Kühltricks können Sie Ihr Zuhause während einer Hitzewelle behaglich halten, ohne dass Ihre Stromrechnung in die Höhe schießt.",10 Smart Home Tricks That Keep Your House Cool Without Spiking Your Energy Bill. These ten smart home cooling tricks can keep your house comfortable during a heat wave without sending your energy bill through the roof.,10 Smart Home Tricks that Keep Your House Cool Without Spiking Your Energy Bill. Hi decem callidi domum refrigerationem technae domum tuam consolatoriam possunt servare in aestu unda sine tua industria libellum per tectum mittendo.,2026-07-11 20:42:26+00:00
12b148fafdc1050646e5d0d04fa99660,2026-07-02T17:01:21Z,'insulation house',www.brownstoner.com,en,0.3,The Insider: Ridgewood Reno Yields a Healthy House With Bespoke Details,"Concerned about water and air quality and looking to move to a healthier home, a pair of musicians fell in love with an early 20th century two-story plus cellar row house on the Brooklyn-Queens border. It had plenty of space for their needs, a driveway and ga…",http://www.brownstoner.com/interiors-renovation/ridgewood-renovation-studio-otto-solar-cellar-laminated-glass/,https://www.brownstoner.com/wp-content/uploads/2029/08/interior-design-ideas-brooklyn-ridgewood-studio-otto-012.jpg,,"A design rethink preserved the exterior of the early 20th century house while adding green technology and extending its arched details to the interior. Photo by Devon Banks
Concerned about water and… [+9174 chars]",,"Der Insider: Ridgewood Reno schafft ein gesundes Haus mit maßgeschneiderten Details. Aus Sorge um die Wasser- und Luftqualität und auf der Suche nach einem Umzug in ein gesünderes Zuhause verliebten sich zwei Musiker in ein zweistöckiges und unterkellertes Reihenhaus aus dem frühen 20. Jahrhundert an der Grenze zwischen Brooklyn und Queens. Es gab viel Platz für ihre Bedürfnisse, eine Auffahrt und einen Garten.","The Insider: Ridgewood Reno Yields a Healthy House With Bespoke Details. Concerned about water and air quality and looking to move to a healthier home, a pair of musicians fell in love with an early 20th century two-story plus cellar row house on the Brooklyn-Queens border. It had plenty of space for their needs, a driveway and ga…","Insider: Ridgewood Reno sanum reddit domum cum Bespoke Details. Sollicitudo circa aquam et aeris qualitatem et ad domum salubriorem spectantes, par musici amavit cum primo saeculo XX duo historia plus cellarii domus in finibus Brooklyn-Reginae. Satis spatii pro necessitatibus suis habebat, gestationem et ga…",2026-07-11 20:42:26+00:00
9c19e41ac65fe6e2c6a1f6b7c578bd41,2026-07-02T19:11:12Z,'insulation house',www.vox.com,en,0.3,The fatal flaw in how America handles heat waves,"It was not the postcard-worthy aesthetics that prompted Greek islanders to first drench their cliffside-carved homes, churches, and pathways in a thick layer of pearly white paint.  Much like wearing a white tunic on a hot sunny day, painting your house a sha…",https://www.vox.com/future-perfect/494126/heat-wave-ac-passive-homes,https://platform.vox.com/wp-content/uploads/sites/2/2026/07/gettyimages-2161142803.jpg?quality=90&strip=all&crop=0%2C10.706012542635%2C100%2C78.587974914731&w=1200,http://web.archive.org/web/20260703105935/https://www.vox.com/future-perfect/494126/heat-wave-ac-passive-homes,"It was not the postcard-worthy aesthetics that prompted Greek islanders to first drench their cliffside-carved homes, churches, and pathways in a thick layer of pearly white paint.
Much like wearing… [+14814 chars]",,"Der fatale Fehler im Umgang Amerikas mit Hitzewellen. Es war nicht die postkartenwürdige Ästhetik, die die griechischen Inselbewohner dazu veranlasste, ihre in Klippen gehauenen Häuser, Kirchen und Wege zunächst mit einer dicken Schicht perlweißer Farbe zu übergießen.  Es ist so, als würde man an einem heißen, sonnigen Tag eine weiße Tunika tragen und sein Haus streichen …","The fatal flaw in how America handles heat waves. It was not the postcard-worthy aesthetics that prompted Greek islanders to first drench their cliffside-carved homes, churches, and pathways in a thick layer of pearly white paint.  Much like wearing a white tunic on a hot sunny day, painting your house a sha…","Exitiale vitium est in quo America fluctus aestus tractat. Non aesthetica postcardorum digna fuit, quae insulanos Graeciae admoverunt ut domos, ecclesias, et meatus in densissima margaritis rubigine densa perfundant.  Multum ut tunicam albam gerens in aprico calido die, pingens domum tuam sha…",2026-07-11 20:42:26+00:00
a9f3a8eda7e2e6f7002c20c59a649bff,2026-07-03T10:45:51Z,'insulation house',www.the-independent.com,en,0.3,How to keep your house cool without air conditioning during a heatwave,"Experts say that relying heavily on AC might seem like a natural adaptation, but it comes with hidden costs",https://www.the-independent.com/life-style/health-and-families/house-cooling-how-heatwave-air-conditioning-b3008291.html,"https://static.the-independent.com/2026/06/25/8/00/iStock-1505823853.jpeg?trim=9,0,9,0&width=1200&height=800&crop=1200:800",http://web.archive.org/web/20260703230835/https://www.the-independent.com/life-style/health-and-families/house-cooling-how-heatwave-air-conditioning-b3008291.html,"Your support helps us to tell the story
From reproductive rights to climate change to Big Tech, The Independent is on the ground when the story is developing. Whether it's investigating the financia… [+4954 chars]",,"So halten Sie Ihr Haus während einer Hitzewelle ohne Klimaanlage kühl. Experten sagen, dass eine starke Abhängigkeit von der Klimaanlage wie eine natürliche Anpassung erscheinen mag, aber mit versteckten Kosten verbunden ist","How to keep your house cool without air conditioning during a heatwave. Experts say that relying heavily on AC might seem like a natural adaptation, but it comes with hidden costs","Quam domum tuam refrigescant sine condicione aeris in aestu aestu. Periti dicunt quod in AC graviter freti quasi aptatio naturalis videri posset, sed fit cum sumptibus occultis",2026-07-11 20:42:26+00:00
3cbadf0676319e19767740b70a69ed05,2026-07-04T06:37:39Z,'insulation house',www.lifesciencesworld.com,en,0.3,What materials do you need for a hedgehog house?,"What Materials Do You Need for a Hedgehog House? Building a safe and cozy hedgehog house involves selecting appropriate materials that offer protection from the elements and predators. You’ll primarily need untreated wood, waterproof roofing, and insulating b…",https://www.lifesciencesworld.com/what-materials-do-you-need-for-a-hedgehog-house/,,,"What Materials Do You Need for a Hedgehog House?
Building a safe and cozy hedgehog house involves selecting appropriate materials that offer protection from the elements and predators. You’ll primar… [+8801 chars]",,"Welche Materialien benötigt man für ein Igelhaus? Welche Materialien benötigen Sie für ein Igelhaus? Um ein sicheres und gemütliches Igelhaus zu bauen, müssen geeignete Materialien ausgewählt werden, die Schutz vor Witterungseinflüssen und Raubtieren bieten. Sie benötigen in erster Linie unbehandeltes Holz, wasserdichte Dächer und isolierende Dämmstoffe.","What materials do you need for a hedgehog house?. What Materials Do You Need for a Hedgehog House? Building a safe and cozy hedgehog house involves selecting appropriate materials that offer protection from the elements and predators. You’ll primarily need untreated wood, waterproof roofing, and insulating b…","Quid opus est materiae domo erinaceo? Quid Materias eges pro domo ericius? Aedificium tutum et fovere ericius domum involvit materias aptas eligendo quae praesidium ab elementis et predonibus praebent. Praesertim ligno increato, aquae probatione texit, et insulante b…",2026-07-11 20:42:26+00:00
