index,published,keyword,domain,language,valid,title,description,url,image,archive,content,quote,de,en,la,added
a43b2e6dcd9135649b2169183e6f18cf,2026-04-02T13:00:13Z,'cold front',www.vulture.com,en,0.3,The 2026 Rock Hall Nominee Power Rankings,"Seven artists will get into the Rock & Roll Hall of Fame this year, and ten will be left out in the cold. We break down which nominees have the best and worst chances this year.",http://www.vulture.com/article/rock-and-roll-hall-of-fame-nominee-power-rankings.html,https://pyxis.nymag.com/v1/imgs/227/af4/c0a14cc9500177e8eb44fe892c6007d418-rockhall-lede-noms.1x.rsocial.w1200.jpg,,"Set the scene with some No Jacket Required while we break it down: There are way too many nominees for this years Rock &amp; Roll Hall of Fame class. Voters, including myself, had to select seven art… [+10247 chars]",,"Die Rock Hall Nominee Power Rankings 2026. Sieben Künstler werden dieses Jahr in die Rock & Roll Hall of Fame aufgenommen, zehn bleiben außen vor. Wir schlüsseln auf, welche Nominierten in diesem Jahr die besten und welche die schlechtesten Chancen haben.","The 2026 Rock Hall Nominee Power Rankings. Seven artists will get into the Rock & Roll Hall of Fame this year, and ten will be left out in the cold. We break down which nominees have the best and worst chances this year.","2026 Rock Hall Nominee Power Rankings. Septem artifices in aulam Fame Rock & Roll, hoc anno, relinquentur decem in frigido. Destruimus quos nominatim optimos et pessimos casus hoc anno habent.",2026-04-18 20:31:49+00:00
b12f0c40a3d6e47eaeaebbe4b50295a3,2026-04-10T15:36:49Z,'cold front',www.aljazeera.com,en,0.3,Potholes and progress: Mamdani reflects on 100 days as New York’s mayor,"Mamdani's first 100 days marked by childcare reforms, pothole fixes and polarising debates over affordability policies.",https://www.aljazeera.com/news/2026/4/10/potholes-and-progress-mamdani-reflects-on-100-days-as-new-yorks-mayor,https://www.aljazeera.com/wp-content/uploads/2026/04/reuters_69d80d0c-1775766796.jpg?resize=1920%2C1440,,"New York It has been almost 100 days since thousands of supporters braved the blistering cold at City Hall Park to witness the public inauguration of Zohran Mamdani.
As the first Muslim mayor of the… [+10376 chars]",,"Schlaglöcher und Fortschritt: Mamdani blickt auf 100 Tage als New Yorks Bürgermeister zurück. Mamdanis erste 100 Tage waren geprägt von Kinderbetreuungsreformen, Schlaglochreparaturen und polarisierenden Debatten über Erschwinglichkeitspolitik.","Potholes and progress: Mamdani reflects on 100 days as New York’s mayor. Mamdani's first 100 days marked by childcare reforms, pothole fixes and polarising debates over affordability policies.","Potholes et progressus: Mamdani in C diebus cogitat cum Maiori Novi Eboraci. Mamdani primus 100 dies a reformationibus tutricis signatus, potholum figit et disputationes de parabili ratione agendi.",2026-04-18 20:31:49+00:00
bd11024a97c41a4ded601514aa6dad5b,2026-04-17T06:00:00Z,'cold front',www.naturalnews.com,en,0.3,The American Empire Will End in Poverty and Despair,"Introduction: The Fraying Fabric of an Empire I look at the world in 2026, and I no longer see a beacon of liberty, but a dying empire stumbling toward its own ruin. This is not a sentiment born of pessimism, but of cold observation. The American project, hij…",https://www.naturalnews.com/2026-04-17-american-empire-will-end-in-poverty-despair.html,https://www.naturalnews.com/wp-content/uploads/sites/91/2026/04/currency-collapse-economic-imperialism-federal-reserve-987-original.jpg,,"Introduction: The Fraying Fabric of an Empire
I look at the world in 2026, and I no longer see a beacon of liberty, but a dying empire stumbling toward its own ruin. This is not a sentiment born of … [+7723 chars]",,"Das amerikanische Imperium wird in Armut und Verzweiflung enden. Einleitung: Das ausgefranste Gefüge eines Imperiums Wenn ich auf die Welt im Jahr 2026 schaue, sehe ich kein Leuchtfeuer der Freiheit mehr, sondern ein sterbendes Imperium, das seinem eigenen Untergang entgegenstolpert. Dies ist kein Gefühl, das dem Pessimismus entspringt, sondern einer kalten Beobachtung. Das amerikanische Projekt, hij…","The American Empire Will End in Poverty and Despair. Introduction: The Fraying Fabric of an Empire I look at the world in 2026, and I no longer see a beacon of liberty, but a dying empire stumbling toward its own ruin. This is not a sentiment born of pessimism, but of cold observation. The American project, hij…","Imperium Americanum in paupertate et desperatione finietur. Prooemium: The Fraying Fabric of an Empire Aspicio mundum in 2026, et non video signum libertatis amplius, sed scandalum moriens imperium in suam perniciem. Haec sententia non est pessimismi, sed frigidae observationis. American project, hij…",2026-04-18 20:31:49+00:00
f67c56201d6030b862974d3d20bcd623,2026-04-01T11:50:00Z,'cold wave',consent.yahoo.com,en,0.8,Leeds United v Celtic – 1970 European Cup semi-final – The Football Special service,"From the heat of Portugal to the cold of England, again in the centre of European success, Celtic were bound for Yorkshire on 1 April 1970…The Celtic team wave to the travelling Celtic support befor...",https://consent.yahoo.com/v2/collectConsent?sessionId=1_cc-session_b79ea833-f120-4b99-9b50-58e12c31ffe2,,,"If you click 'Accept all', we and our partners, including 251 who are part of the IAB Transparency &amp; Consent Framework, will also store and / or access information on a device (in other words, us… [+1046 chars]",,"Leeds United gegen Celtic – Halbfinale des Europapokals 1970 – The Football Special Service. Von der Hitze Portugals bis zur Kälte Englands, erneut im Zentrum des europäischen Erfolgs, reiste Celtic am 1. April 1970 nach Yorkshire ... Das Celtic-Team winkte der reisenden Celtic-Unterstützung zu, bevor ...","Leeds United v Celtic – 1970 European Cup semi-final – The Football Special service. From the heat of Portugal to the cold of England, again in the centre of European success, Celtic were bound for Yorkshire on 1 April 1970…The Celtic team wave to the travelling Celtic support befor...","Ledes United v Celtic - 1970 Calicem Europaeum semi-ultimum - Specialis iaculis muneris. Ab aestu Portugalliae ad frigus Angliae iterum in centro victoriae Europaeae, Celtica in agro Eboracensi die 1 Aprilis 1970 obligata est ... Turma Celtica fluctuanti ad subsidium iter Celticum prae...",2026-04-18 20:31:49+00:00
9a3d206159b375a732d148e19689aff7,2026-04-10T06:27:16Z,'cold impacts',economictimes.indiatimes.com,en,0.3,"'Your family is going to die': Startup founder shares scary AI promotional message, sparks debate over the casual approach","A tech founder exposed a shocking cold email with the subject line, ""Your family is going to die,"" which was a sales pitch for an AI tool. This aggressive tactic sparked widespread criticism online, igniting a debate on the ethics of automated outreach and th…",https://economictimes.indiatimes.com/news/new-updates/your-family-is-going-to-die-startup-founder-shares-scary-ai-promotional-message-sparks-debate-over-the-casual-approach/articleshow/130161050.cms,"https://img.etimg.com/thumb/msid-130161077,width-1200,height-630,imgsize-17476,overlay-economictimes/articleshow.jpg",http://web.archive.org/web/20260411063044/https://economictimes.indiatimes.com/news/new-updates/your-family-is-going-to-die-startup-founder-shares-scary-ai-promotional-message-sparks-debate-over-the-casual-approach/articleshow/130161050.cms,"A tech founder has called out what he described as the worst cold email he had ever received, triggering a wider debate on the ethics of aggressive sales tactics in automated outreach.San Francisco-b… [+2204 chars]",,"„Deine Familie wird sterben“: Startup-Gründer teilt beängstigende KI-Werbebotschaft und löst Debatte über den lockeren Ansatz aus. Ein Tech-Gründer enthüllte eine schockierende kalte E-Mail mit der Betreffzeile „Ihre Familie wird sterben“, bei der es sich um ein Verkaufsargument für ein KI-Tool handelte. Diese aggressive Taktik löste im Internet weit verbreitete Kritik aus und entfachte eine Debatte über die Ethik der automatisierten Öffentlichkeitsarbeit und die …","'Your family is going to die': Startup founder shares scary AI promotional message, sparks debate over the casual approach. A tech founder exposed a shocking cold email with the subject line, ""Your family is going to die,"" which was a sales pitch for an AI tool. This aggressive tactic sparked widespread criticism online, igniting a debate on the ethics of automated outreach and th…","""Domus tua moriturus est"": Satus conditor nuntium FORMIDULOSUS AI communicat promotionis, scintillae de accessu fortuito disputant. Fundator technicus gravem frigidam electronicam cum argumento lineae ""familia tua moriturus"" exposuit, quod erat instrumentum venditionis picis AI. Haec pugnax artis criticae diffusae in online excussit, accendit disputationem de ethica automated outreach et th…",2026-04-19 02:11:36+00:00
2fcbed96d6fef4cedbf12e59bc799217,2026-04-02T13:00:00Z,'extreme cold',www.esa.int,en,0.2,Five things Juice has revealed about Comet 3I/ATLAS already,"‘Extreme but not exotic,’ – a glimpse at Comet 3I/ATLAS through the eyes of the European Space Agency’s Jupiter Icy Moons Explorer (Juice).",https://www.esa.int/Science_Exploration/Space_Science/Juice/Five_things_Juice_has_revealed_about_Comet_3I_ATLAS_already,https://www.esa.int/var/esa/storage/images/esa_multimedia/images/2026/04/comet_3i_atlas_seen_by_juice_s_science_camera_janus/27186903-1-eng-GB/Comet_3I_ATLAS_seen_by_Juice_s_science_camera_JANUS_pillars.gif,,"Science &amp; Exploration
Extreme but not exotic, a glimpse at Comet 3I/ATLAS through the eyes of the European Space Agencys Jupiter Icy Moons Explorer (Juice).
In November 2025, Juice was in the r… [+7471 chars]",,"Fünf Dinge hat Juice bereits über Komet 3I/ATLAS verraten. „Extrem, aber nicht exotisch“ – ein Blick auf den Kometen 3I/ATLAS durch die Augen des Jupiter Icy Moons Explorer (Juice) der Europäischen Weltraumorganisation.","Five things Juice has revealed about Comet 3I/ATLAS already. ‘Extreme but not exotic,’ – a glimpse at Comet 3I/ATLAS through the eyes of the European Space Agency’s Jupiter Icy Moons Explorer (Juice).","Quinque sucus de Cometa 3I/ATLAS iam patefecit. 'Extrema sed non exotica,' - vide in Comet 3I/ATLAS per oculos Agency Iovis Icy Moons Explorer (Juice).",2026-04-19 06:28:04+00:00
230306fdf1004481aff1b1e1909c9f1a,2026-04-16T16:10:08Z,'extreme cold',bringatrailer.com,en,0.2,Original-Owner 1999 Jeep Cherokee Limited 4×4 at No Reserve,"This 1999 Jeep Cherokee is a Limited with Selec-Trac 4WD, and it is refinished in Extreme Purple. The vehicle was acquired new by the seller, who worked at a Jeep dealership, and it has just 85k miles. Powered by a 4.0-liter inline-six paired with a four-spee…",https://bringatrailer.com/listing/1999-jeep-cherokee-150/,https://bringatrailer.com/wp-content/uploads/2026/03/1999_jeep_cherokee_jeep_cherokee_1999_20260221-008-62383.jpg,,"This 1999 Jeep Cherokee is a Limited with Selec-Trac 4WD, and it is refinished in Extreme Purple. The vehicle was acquired new by the seller, who worked at a Jeep dealership, and it has just 85k mile… [+3063 chars]",,"Erstbesitzer: 1999 Jeep Cherokee Limited 4×4 ohne Reserve. Dieser Jeep Cherokee von 1999 ist ein Limited mit Selec-Trac Allradantrieb und wurde in Extreme Purple nachlackiert. Das Fahrzeug wurde vom Verkäufer, der bei einem Jeep-Händler arbeitete, neu erworben und hat nur 85.000 Meilen auf dem Tacho. Angetrieben von einem 4,0-Liter-Reihensechszylinder gepaart mit einem Vierganggetriebe…","Original-Owner 1999 Jeep Cherokee Limited 4×4 at No Reserve. This 1999 Jeep Cherokee is a Limited with Selec-Trac 4WD, and it is refinished in Extreme Purple. The vehicle was acquired new by the seller, who worked at a Jeep dealership, and it has just 85k miles. Powered by a 4.0-liter inline-six paired with a four-spee…","Original-Owner MCMXCIX Jeep Cherokee Press 4/4 ad Subsidium No. Hoc 1999 Jeep Cherokee cum Selec-Trac 4WD limitatum est, et in Extremo Purpura refinatur. Vehiculum novum a venditore quaesitum est, qui mercaturam Jeep operatus est et tantum 85k milia passuum habet. Powered by a 4.0-liter inline-sex paribus cum quattuor spee…",2026-04-19 06:28:04+00:00
99b3ab36ab8ea0520663a64bff09ad54,2026-04-02T00:00:34Z,'extreme cold',www.digitimes.com,en,0.3,MG adopts semi-solid batteries to boost EV range in Europe,"MG, the European arm of China's SAIC Motor Group, confirmed that its upcoming MG4 Urban will feature semi-solid battery technology to address the range loss issues of lithium iron phosphate (LFP) batteries in cold climates. LFP batteries are known to lose sig…",https://www.digitimes.com/news/a20260401PD217/saic-europe-ev-solid-state-battery-performance.html,https://img.digitimes.com/newsshow/20260401pd217_files/1_b.jpg,,"Keep me signed in
Some subscribers prefer to save their log-in information so they do not have to enter their User ID and Password each time they visit the site. To activate this function, check the… [+285 chars]",,"MG setzt auf halbfeste Batterien, um die Reichweite von Elektrofahrzeugen in Europa zu erhöhen. MG, der europäische Zweig der chinesischen SAIC Motor Group, bestätigte, dass sein kommender MG4 Urban mit halbfester Batterietechnologie ausgestattet sein wird, um die Reichweitenverlustprobleme von Lithium-Eisenphosphat-Batterien (LFP) in kalten Klimazonen zu beheben. Es ist bekannt, dass LFP-Batterien an Signifikanz verlieren.","MG adopts semi-solid batteries to boost EV range in Europe. MG, the European arm of China's SAIC Motor Group, confirmed that its upcoming MG4 Urban will feature semi-solid battery technology to address the range loss issues of lithium iron phosphate (LFP) batteries in cold climates. LFP batteries are known to lose sig…","MG batteries semi-solidae adoptat ut EV range in Europa boost. MG, brachium Europaeum SAIC Motor Group Sinarum confirmavit MG4 Urbanum venturam technologiam machinarum machinarum semi-solidam inmittere ut quaestiones dispendii phosphatis ferrei lithii (LFP) batteries in frigidis climatibus mitteret. LFP gravida nota carere sig ...",2026-04-19 06:28:04+00:00
6ee671e001369ea4d3dd456da24272b0,2026-04-13T11:00:48Z,'extreme cold',www.thecut.com,en,0.3,‘I Spray Myself With Magnesium and Read Under a Chicken Light.’,"It has become socially acceptable to celebrate women for their extreme beauty routines and body modification, like Kylie Jenner’s plastic surgery and Laura Reilly’s long beauty routine. Is this a good thing?",http://www.thecut.com/article/extreme-beauty-routines-plastic-surgery.html,https://pyxis.nymag.com/v1/imgs/918/385/2f8fdeba45966f439be302a1bc0a8ce7f7-Beauty-Munchausen-final.1x.rsocial.w1200.jpg,http://web.archive.org/web/20260413131221/https://www.thecut.com/article/extreme-beauty-routines-plastic-surgery.html,"Five years ago, Rachel Harrison began feeling tired. She had just turned 44 and was opening her own public-relations agency. Between the alcohol, the cigarettes, and eating out a lot, my body just fe… [+15765 chars]",,"„Ich sprühe mir Magnesium ein und lese bei Hühnerlicht.“ Es ist salonfähig geworden, Frauen für ihre extremen Schönheitsroutinen und Körpermodifikationen zu feiern, wie zum Beispiel Kylie Jenners plastische Chirurgie und Laura Reillys lange Schönheitsroutine. Ist das eine gute Sache?","‘I Spray Myself With Magnesium and Read Under a Chicken Light.’. It has become socially acceptable to celebrate women for their extreme beauty routines and body modification, like Kylie Jenner’s plastic surgery and Laura Reilly’s long beauty routine. Is this a good thing?","'Ego me Expande apud Magnesium et sub pullo luce legi.'. Socialiter acceptum est mulieres celebrare propter nimiam pulchritudinem consuetudines et corporis modificationem, sicut Kylie Jenner chirurgia plastica et Laura Reilly longam pulchritudinis consuetudinem. Estne hoc bonum?",2026-04-19 06:28:04+00:00
457452c1bbb0823dd66005239f4e9668,2026-04-09T10:01:51Z,'extreme cold',post.rlsbb.to,en,0.7,Cold Lunch 2008 1080p NF WEB-DL x264-MRCS,"Lønsj (original title) – Awards 4 wins & 5 nominations total See more awards »Plot: Bird droppings on a work shirt lead to extreme unintended consequences.Genre: DramaIMDB Rating Live: IMDB Rating: 5.1/10 From 1,087 UsersTMDB Rating: N/ARotten Rating: N/AMeta…",https://post.rlsbb.to/cold-lunch-2008-1080p-nf-web-dl-x264-mrcs/,,,"Lønsj (original title) – Awards 4 wins &amp; 5 nominations total See more awards »
Plot: Bird droppings on a work shirt lead to extreme unintended consequences.
Genre: DramaIMDB Rating Live:IMDB Ra… [+1812 chars]",,"Kaltes Mittagessen 2008 1080p NF WEB-DL x264-MRCS. Lønsj (Originaltitel) – Vergibt insgesamt 4 Siege und 5 Nominierungen. Weitere Auszeichnungen anzeigen » Handlung: Vogelkot auf einem Arbeitshemd führt zu extremen unbeabsichtigten Folgen.Genre: DramaIMDB-Bewertung Live: IMDB-Bewertung: 5,1/10 von 1.087 BenutzernTMDB-Bewertung: N/ARotten-Bewertung: N/AMeta…","Cold Lunch 2008 1080p NF WEB-DL x264-MRCS. Lønsj (original title) – Awards 4 wins & 5 nominations total See more awards »Plot: Bird droppings on a work shirt lead to extreme unintended consequences.Genre: DramaIMDB Rating Live: IMDB Rating: 5.1/10 From 1,087 UsersTMDB Rating: N/ARotten Rating: N/AMeta…","Frigus Prandium 2008 1080p NF WEB-DL x264-MRCS. Lønsj (titulus originarius) - Praemia 4 conciliat & 5 nominationum summa Vide plura praemia »Plo: Avis stercora in operis tunica ducunt ad extremas ignoratas consequentias.Genre: DramaIMDB Rating Live: IMDB Rating: 5.1/10 Ex 1,087 UsersTMDB Rating: N/ARotten Rating: N/AMeta…",2026-04-19 06:28:04+00:00
1bb45ff1a8068e68244213da65b82f53,2026-04-04T06:00:00Z,'cold impacts',www.mavsmoneyball.com,en,0.3,Player Grades: Recapping the Mavericks’ 138-127 loss vs. Magic,Assigning grades for the Mavericks as Flagg scores 51.,https://www.mavsmoneyball.com/dallas-mavericks-game-coverage/57525/player-grades-recapping-the-mavericks-138-127-loss-vs-magic,https://s.yimg.com/ny/api/res/1.2/w3V94k3hYaRhQzNPOxjG5Q--/YXBwaWQ9aGlnaGxhbmRlcjt3PTEyMDA7aD0xODAwO2NmPXdlYnA-/https://media.zenfs.com/en/sb_nation_articles_115/9b6ea64829732448e5b30c9f20f38554,,"The Dallas Mavericks kicked off the weekend with a Friday night matchup against the Orlando Magic. Both teams came in ice cold, each 2-8 in their past 10 games. But Orlando had too much firepower aga… [+3782 chars]",,"Spielernoten: Zusammenfassung der 138:127-Niederlage der Mavericks gegen Magic. Vergabe von Noten für die Mavericks, da Flagg 51 Punkte erzielt.",Player Grades: Recapping the Mavericks’ 138-127 loss vs. Magic. Assigning grades for the Mavericks as Flagg scores 51.,Ludio ludius Gradus: Reparans Mavericks 138-127 damnum vs Magic. Gradibus assignare Maverici ut Flagg ustulo 51 .,2026-04-19 10:35:34+00:00
4bee48f378612fbf084d0556c91a62f1,2026-04-02T23:15:35Z,'cold wave',www.sciencedaily.com,en,0.3,New microwave frying technique could make french fries much healthier,"Scientists have discovered a way to make French fries less greasy without ruining their taste. By combining regular frying with microwave heating, they reduce the amount of oil absorbed during cooking. The key lies in pressure inside the food—microwaves help …",https://www.sciencedaily.com/releases/2026/04/260402042803.htm,https://www.sciencedaily.com/images/1920/golden-french-fries.webp,,"Fried foods are widely enjoyed, but their high fat content is linked to health issues such as obesity and hypertension. Creating lower fat versions that still deliver the same taste and texture could… [+5045 chars]",,"Neue Mikrowellen-Frittiertechnik könnte Pommes frites viel gesünder machen. Wissenschaftler haben einen Weg gefunden, Pommes Frites weniger fettig zu machen, ohne ihren Geschmack zu beeinträchtigen. Durch die Kombination von regelmäßigem Braten und Erhitzen in der Mikrowelle reduzieren sie die Menge an Öl, die beim Kochen aufgenommen wird. Der Schlüssel liegt im Druck im Inneren der Lebensmittel – Mikrowellen helfen …","New microwave frying technique could make french fries much healthier. Scientists have discovered a way to make French fries less greasy without ruining their taste. By combining regular frying with microwave heating, they reduce the amount of oil absorbed during cooking. The key lies in pressure inside the food—microwaves help …","Nova proin sartagine technica ars gallicas fricta multo salubrius efficere potuit. Docti viam invenerunt ut frictas gallicas minus pingues sine sapore corrumperet. Coniungendo regularem sartagines cum Proin calefactione, absumunt oleum in coctione absorptum. Clavis in pressura intra cibum-proin auxilium ...",2026-04-19 15:34:29+00:00
3177f870d5b71df8662b61a4ca7ea159,2026-04-16T17:07:09Z,'cold wave',gothamist.com,en,0.3,The increasingly rare breed of New Yorkers who drink hot coffee year round,"WNYC/Gothamist producer James Ramsay enjoys hot coffee in hot weather.
 

For this week's Looped In column, we explore why hot coffee die-hards do not care that it's 80 degrees — and why other New Yorkers have converted to cold brew. [ more › ]",https://gothamist.com/arts-entertainment/the-increasingly-rare-breed-of-new-yorkers-who-drink-hot-coffee-year-round,https://api-prod.gothamist.com/images/356491/fill-1200x650|format-webp|webpquality-85/,,"In The Heights, my 5-year-olds favorite movie about New York City, which Ive now seen 30 times, opens with dual crises: Its hot as hell outside, and the fridge where the bodega keeps its milk and hal… [+3496 chars]",,"Die immer seltener werdende Art von New Yorkern, die das ganze Jahr über heißen Kaffee trinken. WNYC/Gothamist-Produzent James Ramsay genießt bei heißem Wetter heißen Kaffee.
 

In der Kolumne „Looped In“ dieser Woche gehen wir der Frage nach, warum es den eingefleischten Liebhabern von heißem Kaffee egal ist, dass es 80 Grad hat – und warum andere New Yorker auf Cold Brew umgestiegen sind. [ mehr > ]","The increasingly rare breed of New Yorkers who drink hot coffee year round. WNYC/Gothamist producer James Ramsay enjoys hot coffee in hot weather.
 

For this week's Looped In column, we explore why hot coffee die-hards do not care that it's 80 degrees — and why other New Yorkers have converted to cold brew. [ more › ]","Magis magisque rara nobilitas Novi Yorkers qui anno rotundo capulus calidum bibunt. WNYC/Gothamista effectrix James Ramsay calidum capulus in aestu aestu fruitur.
 

Ad hanc septimanam in columna distenta, exploramus cur calida capulus moriatur-dura non curant ut LXXX gradus sit - et cur alii Novi Yorkers ad celia frigidam converterunt. [ magis ]",2026-04-19 20:32:32+00:00
b3f9019b7eb197ac852df1e281da5e53,2026-04-17T22:30:05Z,'cold spell',www.shtfplan.com,en,0.3,The American Empire Will End in Poverty and Despair,"I look at the world in 2026, and I no longer see a beacon of liberty, but a dying empire stumbling toward its own ruin. This is not a sentiment born of pessimism, but of cold observation. The American project, hijacked by a nexus of central banking, perpetual…",https://www.shtfplan.com/headline-news/the-american-empire-will-end-in-poverty-and-despair,https://www.shtfplan.com/wp-content/uploads/2017/07/economic-collapse-e1498997370573.png,,"This article was originally published by Mike Adams at Natural News. 
Introduction: The Fraying Fabric of an Empire
I look at the world in 2026, and I no longer see a beacon of liberty, but a dying… [+7807 chars]",,"Das amerikanische Imperium wird in Armut und Verzweiflung enden. Wenn ich auf die Welt im Jahr 2026 schaue, sehe ich kein Leuchtfeuer der Freiheit mehr, sondern ein sterbendes Imperium, das seinem eigenen Untergang entgegenstolpert. Dies ist kein Gefühl, das dem Pessimismus entspringt, sondern einer kalten Beobachtung. Das amerikanische Projekt, gekapert von einer Verbindung aus Zentralbanken, ewigem...","The American Empire Will End in Poverty and Despair. I look at the world in 2026, and I no longer see a beacon of liberty, but a dying empire stumbling toward its own ruin. This is not a sentiment born of pessimism, but of cold observation. The American project, hijacked by a nexus of central banking, perpetual…","Imperium Americanum in paupertate et desperatione finietur. Mundum anno 2026 aspicio, nec iam libertatis typum conspicio, sed moriens imperium in suam perniciem offensionem. Haec sententia non est pessimismi, sed frigidae observationis. American project, per nexum argentariae centralis, perpetuo.",2026-04-19 20:32:32+00:00
