index,published,keyword,domain,language,valid,title,description,url,image,archive,content,quote,de,en,la,added
8afae10f28b609dc54060347deecaf73,2026-07-01T02:21:37Z,'cold spell',www.lifesciencesworld.com,en,0.3,Does the cold bother deer?,"Does the Cold Bother Deer? Understanding Deer and Winter Survival Yes, the cold does bother deer, but they possess remarkable adaptations that allow them to survive even harsh winters. Through physiological changes, behavioral strategies, and access to adequa…",https://www.lifesciencesworld.com/does-the-cold-bother-deer/,,,"Yes, the cold does bother deer, but they possess remarkable adaptations that allow them to survive even harsh winters. Through physiological changes, behavioral strategies, and access to adequate res… [+8672 chars]",,"Stört die Kälte Hirsche? Stört die Kälte Hirsche? Hirsche und das Überleben im Winter verstehen Ja, die Kälte macht Hirschen zu schaffen, aber sie verfügen über bemerkenswerte Anpassungen, die es ihnen ermöglichen, selbst strenge Winter zu überleben. Durch physiologische Veränderungen, Verhaltensstrategien und Zugang zu angemessenen…","Does the cold bother deer?. Does the Cold Bother Deer? Understanding Deer and Winter Survival Yes, the cold does bother deer, but they possess remarkable adaptations that allow them to survive even harsh winters. Through physiological changes, behavioral strategies, and access to adequa…","Frigidus cervos vexat ?. Frigidus est Bother cervi? Intellectus Cervus et Hiems Superstes Immo, frigus cervos vexat, sed adaptationes mirabiles possident, quae eas etiam duras hiemes superesse permittunt. Per mutationes physiologicas, consilia morum et accessus ad adaequationem…",2026-07-02 12:06:40+00:00
77d69518a429a45aa736e4543ca1bcde,2026-07-01T00:00:00Z,'heating system',www.nature.com,en,0.3,Moderate volcanic eruptions and extreme wildfires humidify the stratosphere,"Observations and modelling show that volcanic eruptions and extreme wildfires have systematically increased stratospheric water vapour since 2005, revealing that these episodic aerosol perturbations are a previously overlooked driver of stratospheric water va…",https://www.nature.com/articles/s41586-026-10731-0,https://media.springernature.com/m685/springer-static/image/art%3A10.1038%2Fs41586-026-10731-0/MediaObjects/41586_2026_10731_Fig1_HTML.png,,"<li>Dessler, A. E., Schoeberl, M. R., Wang, T., Davis, S. M. &amp; Rosenlof, K. H. Stratospheric water vapor feedback. Proc. Natl Acad. Sci. USA110, 1808718091 (2013).
Article 
 ADS 
 CAS 
 PubMe… [+12390 chars]",,"Moderate Vulkanausbrüche und extreme Waldbrände befeuchten die Stratosphäre. Beobachtungen und Modellierungen zeigen, dass Vulkanausbrüche und extreme Waldbrände seit 2005 den stratosphärischen Wasserdampf systematisch erhöht haben, was zeigt, dass diese episodischen Aerosolstörungen ein bisher übersehener Treiber für den stratosphärischen Wasserdampf sind.","Moderate volcanic eruptions and extreme wildfires humidify the stratosphere. Observations and modelling show that volcanic eruptions and extreme wildfires have systematically increased stratospheric water vapour since 2005, revealing that these episodic aerosol perturbations are a previously overlooked driver of stratospheric water va…","Molestae eruptiones moderatae et extremae flammae silvestres stratosphaerium humidificant. Animadversiones et exemplares ostendunt eruptiones vulcanicae et extremae flammae ignis systematice augeri vaporum aquae stratosphericae cum 2005, ostendens has perturbationes episodicas aerosolas antea neglectas esse agitator aquae stratosphaerici va…",2026-07-03 07:59:01+00:00
fde3fd547492f06c3b97bacac819a25b,2026-07-02T13:19:00Z,'cold spell',www.prnewswire.co.uk,en,0.7,Heatwave puts refrigeration resilience in the spotlight as industry rethinks design for a changing climate,"GLASGOW, Scotland, July 2, 2026 /PRNewswire/ -- As much of the UK recovers from another spell of exceptionally hot weather, recent comments from the UK Cold Chain Federation and widespread media reports of refrigeration outages have brought renewed attention …",https://www.prnewswire.co.uk/news-releases/heatwave-puts-refrigeration-resilience-in-the-spotlight-as-industry-rethinks-design-for-a-changing-climate-302816845.html,https://mma.prnewswire.com/media/3003346/Star_Refrigeration_Cascade_Ammonia_System.jpg?p=facebook,,"GLASGOW, Scotland, July 2, 2026 /PRNewswire/ -- As much of the UK recovers from another spell of exceptionally hot weather, recent comments from the UK Cold Chain Federation and widespread media repo… [+6850 chars]",,"Heatwave rückt die Widerstandsfähigkeit der Kühlung ins Rampenlicht, während die Industrie das Design für ein sich veränderndes Klima überdenkt. GLASGOW, Schottland, 2. Juli 2026 /PRNewswire/ -- Während sich ein Großteil des Vereinigten Königreichs von einer weiteren Phase außergewöhnlich heißen Wetters erholt, haben jüngste Kommentare der UK Cold Chain Federation und weit verbreitete Medienberichte über Kühlausfälle erneut für Aufmerksamkeit gesorgt …","Heatwave puts refrigeration resilience in the spotlight as industry rethinks design for a changing climate. GLASGOW, Scotland, July 2, 2026 /PRNewswire/ -- As much of the UK recovers from another spell of exceptionally hot weather, recent comments from the UK Cold Chain Federation and widespread media reports of refrigeration outages have brought renewed attention …","Heatwave refrigerationem mollitiem in arcu ponit sicut industria recogitat consilium mutationis climatis. GLASGOW, Scotia, die 2 iulii 2026 /PRNewswire/ -- Quantum in UK ab alio carmine singulari aestus recuperat, commentaria recentia de Foedero UK Frigida Chain ac pervulgata instrumentorum refrigerationis outages relationes renovatam attulerunt operam ...",2026-07-03 16:22:29+00:00
11f5c72f300b3ccecb247b7a68f602bb,2026-07-02T01:49:39Z,'cold snap',www.lifesciencesworld.com,en,0.3,Can ferrets stay outside in winter?,"Can Ferrets Safely Brave the Winter Outdoors? The answer is a qualified no. While some ferrets can tolerate short periods outside in mild winter conditions, leaving them outdoors unsupervised for extended periods during cold weather is generally unsafe and po…",https://www.lifesciencesworld.com/can-ferrets-stay-outside-in-winter/,,,"Can Ferrets Safely Brave the Winter Outdoors?
The answer is a qualified no. While some ferrets can tolerate short periods outside in mild winter conditions, leaving them outdoors unsupervised for ex… [+7756 chars]",,"Können Frettchen im Winter draußen bleiben? Können Frettchen dem Winter im Freien sicher trotzen? Die Antwort ist ein qualifiziertes Nein. Während einige Frettchen bei milden Winterbedingungen kurze Aufenthalte im Freien vertragen, ist es im Allgemeinen unsicher und gefährlich, sie bei kaltem Wetter längere Zeit unbeaufsichtigt im Freien zu lassen.","Can ferrets stay outside in winter?. Can Ferrets Safely Brave the Winter Outdoors? The answer is a qualified no. While some ferrets can tolerate short periods outside in mild winter conditions, leaving them outdoors unsupervised for extended periods during cold weather is generally unsafe and po…","Possuntne galgos foris in hieme manere ?. Potestne Ferrets Tutus Fortis hiemem foris? Dicendum est quid n. Dum ferrets aliquas breves periodos extra lenis hiemis conditiones tolerare possunt, iis foris incautus per intervalla protracta in frigoribus fere tuta et po... relinquunt.",2026-07-04 11:23:19+00:00
3eb51b2c216ba28336b4c8622b82f9ad,2026-07-02T00:00:00Z,'extreme cold',www.nature.com,en,0.8,Ultra flash cold events under global warming,"This study finds that ultra flash cold events, marked by sudden extreme temperature drops, are intensifying over North America but fading over Eurasia. Current climate models miss this divergence, posing several socioeconomical risks.",https://www.nature.com/articles/s41467-026-75094-6,,,"It is widely assumed that global warming will make winters milder and reduce extreme cold. However, this assumption is contradicted by the recurrence of flash cold (FC) eventssudden, violent temperat… [+1117 chars]",,"Ultraschnelle Kälteereignisse im Zuge der globalen Erwärmung. Diese Studie kommt zu dem Ergebnis, dass sich extreme Kälteereignisse, die durch plötzliche extreme Temperaturabfälle gekennzeichnet sind, über Nordamerika verstärken, über Eurasien jedoch nachlassen. Aktuelle Klimamodelle übersehen diese Divergenz, was mehrere sozioökonomische Risiken mit sich bringt.","Ultra flash cold events under global warming. This study finds that ultra flash cold events, marked by sudden extreme temperature drops, are intensifying over North America but fading over Eurasia. Current climate models miss this divergence, posing several socioeconomical risks.","Ultra mico frigus eventus sub calefactione globali. Hoc studium invenit quod eventus ultra fulgurare frigus, quod guttae temperatae extremae subito notatae sunt, augere super Americam septentrionalem sed evanescere super Eurasiam. Exemplaria climatis currentis hanc discrepantiam desiderant, varia pericula oeconomicae ponentes.",2026-07-04 11:23:19+00:00
526169d50782ae9814fa7f19cfad2bb4,2026-07-03T08:30:00Z,'cold front',www.autocar.co.uk,en,0.3,6 ways Renault Scenic is perfect for families,"From a boot that swallows everything to a rear armrest that holds your kid’s tablet, here’s why Renault Scenic E-Tech electric might just be the ultimate family car

Finding a family car that ticks every box is harder than it looks. It needs to be genuinely s…",https://www.autocar.co.uk/car-news/advertising-promotions-promoted-by-renault/6-ways-renault-scenic-perfect-families,https://images.cdn.autocar.co.uk/sites/autocar.co.uk/files/images/car-reviews/first-drives/legacy/main_image_1.jpg,,"Learn more about the Renault Scenic
[1] Model shown is Scenic iconic long range with up to 369 miles. 379 miles based on Scenic techno long range. WLTP figures shown are for comparability purposes o… [+1355 chars]",,"6 Gründe, warum der Renault Scenic perfekt für Familien ist. Von einem Kofferraum, der alles verschluckt, bis hin zu einer hinteren Armlehne, die das Tablet Ihres Kindes hält – hier erfahren Sie, warum der Renault Scenic E-Tech electric möglicherweise das ultimative Familienauto ist

Ein Familienauto zu finden, das alle Anforderungen erfüllt, ist schwieriger als es aussieht. Es muss wirklich so sein…","6 ways Renault Scenic is perfect for families. From a boot that swallows everything to a rear armrest that holds your kid’s tablet, here’s why Renault Scenic E-Tech electric might just be the ultimate family car

Finding a family car that ticks every box is harder than it looks. It needs to be genuinely s…","VI modis Vel Satis perfectus est pro familiis. Ex tabernus quae devorat omnia ad armillam posteriorem quae tabellam tuam tenet, hic est cur Renault Scenic E-Tech electrici modo carrus familiae ultimus esse potest.

Inveniens raedam familiarem quae ricini singulis arca durior est quam spectat. Oportet ut vere s…",2026-07-04 20:51:44+00:00
4765a8eed4cae16f4d84a5eeec85ac76,2026-07-03T10:00:00Z,'colder than usual',www.theatlantic.com,en,0.3,What I Learned from ROTC,"Military experience is, sooner or later, humbling.",https://www.theatlantic.com/ideas/2026/07/army-military-service-training-lessons/687589/,https://cdn.theatlantic.com/thumbor/G74tridMoYYY17KGXDqm67ItUGU=/4x122:2880x1620/1200x625/media/img/mt/2026/06/2026_06_22_What_I_Learned_From_ROTC/original.jpg,,"My military career was part-time, uneventful, and inglorious. I leveled out as a captain in the Army (a courtesy, really, because I got the promotion as I went on inactive status), and other than tra… [+6724 chars]",,Was ich von ROTC gelernt habe. Militärische Erfahrung macht früher oder später demütigend.,"What I Learned from ROTC. Military experience is, sooner or later, humbling.","Quod ex ROTC didici. Rei militaris est, serius vel serius, humilians.",2026-07-04 20:51:44+00:00
cb762b6b5841af3540c53c01ab97ba02,2026-07-03T11:30:45Z,'colder than usual',thefederalist.com,en,0.3,Here’s Your Movie Guide For Hosting The Ultimate America 250 Film Fest,"What better way to celebrate Independence Day than with American stories featuring the good, true, and beautiful -- and the occasional epic chase scene?",https://thefederalist.com/2026/07/03/heres-your-movie-guide-for-hosting-the-ultimate-america-250-film-fest/,https://thefederalist.com/wp-content/uploads/2026/07/Screenshot-2026-07-02-at-2.46.33-PM.png,,"Millions of Americans spanning 50 states are preparing to spend one of the best weekends in history celebrating the best country in history. And nothing goes better with freedom, good food, and blowi… [+7506 chars]",,"Hier ist Ihr Filmführer für die Ausrichtung des Ultimate America 250 Film Fest. Gibt es einen besseren Weg, den Unabhängigkeitstag zu feiern, als mit amerikanischen Geschichten über das Gute, Wahre und Schöne – und gelegentlich epische Verfolgungsjagden?","Here’s Your Movie Guide For Hosting The Ultimate America 250 Film Fest. What better way to celebrate Independence Day than with American stories featuring the good, true, and beautiful -- and the occasional epic chase scene?","Here's Your Movie Guide For Hosting The Ultimate America 250 Film Fest. Quid melius Libertatis Diem celebrare, quam cum Americanis fabulis, bonas, veras, speciosas formare, et interdum epici venandi scenam?",2026-07-04 20:51:44+00:00
54aa80bb841a26963b158913d877bcb2,2026-07-03T14:01:00Z,'colder than usual',www.addictedtoquack.com,en,0.3,Duck Dive: Michigan Football 2026 Preview,"Going deep with the Wolverines’ scheme, returning personnel, and unknowns",https://www.addictedtoquack.com/big-ten-football/61722/duck-dive-michigan-football-2026-preview,https://s.yimg.com/ny/api/res/1.2/iDFhi8NCJpg3t93hj2W2oA--/YXBwaWQ9aGlnaGxhbmRlcjt3PTEyMDA7aD04MDA7Y2Y9d2VicA--/https://media.zenfs.com/en/sb_nation_articles_115/f3ee49f3d367061cc19ebba3cf4174e5,,"Special thanks to Jake Singer of Maize n Brew for joining me to discuss Michigans roster on this weeks podcast:
View Link
In one sense, Michigans 2026 staff turnover to head coach Whittingham and t… [+42771 chars]",,"Duck Dive: Vorschau auf Michigan Football 2026. Tief in den Plan der Wolverines eintauchen, zurückkehrendes Personal und Unbekannte","Duck Dive: Michigan Football 2026 Preview. Going deep with the Wolverines’ scheme, returning personnel, and unknowns","Duck Dive: Michigan Football 2026 Preview. Altum ire cum consilio Wolverinorum, personas reddens, et incognitas",2026-07-04 20:51:44+00:00
1c695479d93e296cfec2906acfdb5a0f,2026-07-03T14:02:40Z,'colder than usual',road.cc,en,0.3,Is this the most predictable Tour de France of the decade? road.cc’s ‘expert’ panel might prove you wrong,"My name is Tadej Pogačar, king of kings: Look on my works, Ye mighty and despair.If a certain Slovenian doesn’t win this year’s Tour de France, it will be a bigger story than if he does. His are not yet vast and trunkless legs, eroded by history into a distan…",https://road.cc/feature/2026-tour-preview-and-predictions,https://cdn.road.cc/wp-content/uploads/2026/04/2025-Tour-de-France-Etape-18-VINGEGAARD-POGACAR-A.S.O.-Charly-Lopez-.jpeg,,"My name is Tadej Pogačar, king of kings: Look on my works, Ye mighty and despair.
If a certain Slovenian doesn’t win this year’s Tour de France, it will be a bigger story than if he does. His are no… [+20282 chars]",,"Ist dies die vorhersehbarste Tour de France des Jahrzehnts? Das Expertengremium von road.cc könnte Ihnen das Gegenteil beweisen. Mein Name ist Tadej Pogačar, König der Könige: Schaut auf meine Werke, ihr Mächtigen und Verzweifelten. Wenn ein gewisser Slowene die diesjährige Tour de France nicht gewinnt, wird das eine größere Geschichte sein, als wenn er sie gewinnt. Seine Beine sind noch nicht riesig und rüssellos, durch die Geschichte in die Ferne erodiert …","Is this the most predictable Tour de France of the decade? road.cc’s ‘expert’ panel might prove you wrong. My name is Tadej Pogačar, king of kings: Look on my works, Ye mighty and despair.If a certain Slovenian doesn’t win this year’s Tour de France, it will be a bigger story than if he does. His are not yet vast and trunkless legs, eroded by history into a distan…","Estne haec praevisissima Tour de Gallia decennii? road.cc's 'decuriam periti' demonstrare posset iniuriam. Meum nomen est Tadej Pogačar, rex regum: Opera mea respice, Fortis et despera. Si quidam Slovenian hoc anno in Tour de France non obtinet, maior fabula erit quam si facit. Nondum sunt eius vasti et trunci crures, historia in distans exesa.",2026-07-04 20:51:44+00:00
324ffa6f8792a79e1f4953bb99838beb,2026-07-03T16:45:37Z,'colder than usual',spacedaily.com,en,0.3,"After the Soviet Union invaded Finland in the winter of 1939 expecting an easy victory in 2 weeks, the Finns held them off for 105 days in temperatures that fell below minus 40 degrees — including a single farmer-turned-sniper named Simo Häyhä who killed more than 500 Soviet soldiers in 100 days without ever using a telescopic sight.",Stalin had expected to reach Helsinki in two weeks. He never reached it. The specific mechanism by which a country of approximately 3.7 million people successfully defended itself for 105 days against an invasion by a country of approximately 170 million peop…,https://spacedaily.com/d-after-the-soviet-union-invaded-finland-in-the-winter-of-1939-expecting-an-easy-victory-in-2-weeks-the-finns-held-them-off-for-105-days-in-temperatures-that-fell-below-minus-40-degrees-inclu/,https://spacedaily.com/wp-content/uploads/2026/07/Posts-1600840-2026-07-03T113344.865.png,,Stalin had expected to reach Helsinki in two weeks. He never reached it. The specific mechanism by which a country of approximately 3.7 million people successfully defended itself for 105 days agains… [+8914 chars],,"Nachdem die Sowjetunion im Winter 1939 in Finnland einmarschiert war und einen leichten Sieg in zwei Wochen erwartete, hielten die Finnen sie 105 Tage lang bei Temperaturen unter minus 40 Grad zurück – darunter ein einziger Landwirt, der zum Scharfschützen namens Simo Häyhä wurde und in 100 Tagen mehr als 500 sowjetische Soldaten tötete, ohne jemals ein Zielfernrohr zu benutzen. Stalin hatte damit gerechnet, Helsinki in zwei Wochen zu erreichen. Er hat es nie erreicht. Der spezifische Mechanismus, mit dem sich ein Land mit etwa 3,7 Millionen Einwohnern 105 Tage lang erfolgreich gegen eine Invasion eines Landes mit etwa 170 Millionen Einwohnern verteidigte …","After the Soviet Union invaded Finland in the winter of 1939 expecting an easy victory in 2 weeks, the Finns held them off for 105 days in temperatures that fell below minus 40 degrees — including a single farmer-turned-sniper named Simo Häyhä who killed more than 500 Soviet soldiers in 100 days without ever using a telescopic sight.. Stalin had expected to reach Helsinki in two weeks. He never reached it. The specific mechanism by which a country of approximately 3.7 million people successfully defended itself for 105 days against an invasion by a country of approximately 170 million peop…","Postquam Unione Sovietica Finniam invasit, hieme anni 1939 facilem victoriam exspectans Finni II septimanas tenuerunt eos per 105 dies in temperaturis infra minus 40 gradus cadentibus — unum agricolam-sniper nomine Simo Häyhä qui plus quam 500 milites Sovietici per 100 dies necavit sine ullo telescopio visus.. Stalin Helsinkium duabus septimanis perventurum putarat. Numquam attigit. Mechanismus specifica, qua regio circiter 3.7 miliones hominum per centum dies se feliciter defendebat contra irruptionem per fines circiter 170 miliones hominum.",2026-07-04 20:51:44+00:00
2805cedc7fa06ef2ad77d8695a9bd3ad,2026-07-03T17:10:07Z,'colder than usual',electrek.co,en,0.3,"Volkswagen’s next electric SUV is almost here, and it’s not just a rebadged ID.4 [Images]","The Volkswagen ID. Tiguan is expected to debut later this year, bringing much more than just a new look and name.",http://electrek.co/2026/07/03/volkswagens-next-ev-suv-not-just-rebadged-id-4-images/,https://i0.wp.com/electrek.co/wp-content/uploads/sites/3/2026/01/Volkswagen-ID.4-refresh.jpeg?resize=1200%2C628&quality=82&strip=all&ssl=1,,"The Volkswagen ID. Tiguan is expected to debut later this year, bringing much more than just a new look and name.
Volkswagen announced in April that it would end production of the ID.4 at its Chatta… [+3186 chars]",,"Der nächste Elektro-SUV von Volkswagen ist fast da, und es ist nicht nur ein umbenannter ID.4 [Bilder]. Der Volkswagen ID. Der Tiguan wird voraussichtlich noch in diesem Jahr auf den Markt kommen und viel mehr als nur ein neues Aussehen und einen neuen Namen mit sich bringen.","Volkswagen’s next electric SUV is almost here, and it’s not just a rebadged ID.4 [Images]. The Volkswagen ID. Tiguan is expected to debut later this year, bringing much more than just a new look and name.","Volkswagen proximus electrici SUV hic fere est, et id non modo rebaded.4 [Images]. Volkswagen ID. Tiguan expectatur serius hoc anno debutturum, multo plus quam novum aspectum et nomen ferens.",2026-07-04 20:51:44+00:00
cfaa2bb73d752bde06cd8892b285f74a,2026-07-03T19:00:00Z,'colder than usual',www.tarheelblog.com,en,0.3,Beating the Heat,It’s hotter than fish grease.,https://www.tarheelblog.com/general/57602/beating-the-heat,https://s.yimg.com/lo/mysterio/api/589f05739dee2c0bc78d5aae2858c338399a4def70c67591aefe801030d6b5a5/lightyear_networkapi/resizefill_w1200;quality_80;format_webp/https:%2F%2Fmedia.zenfs.com%2Fen%2Fsb_nation_articles_115%2Fbc284af0e44c8246222bc31988fdd55f,,"Waves of heat radiate off of expanses of concrete, folding the heavy summer air back onto itself and pooling in low-lying areas like water. Summer has arrived, quick as you like, slamming the door on… [+2542 chars]",,Der Hitze trotzen. Es ist heißer als Fischfett.,Beating the Heat. It’s hotter than fish grease.,Calorem percutere. Adipe piscium calidior est.,2026-07-04 20:51:44+00:00
26dc4df0f5c5f54504ee3af31320d04e,2026-07-03T15:30:23Z,'extreme cold',www.yahoo.com,en,0.3,Washington Post throws cold water on DC fireworks with report of 'hazardous air pollution',"Internal National Park Service documents project hazardous PM2.5 levels from 850,000 fireworks shells launched across 10 sites on the National Mall.",https://www.yahoo.com/news/us/articles/washington-post-throws-cold-water-on-dc-fireworks-with-report-of-hazardous-air-pollution-153023669.html,https://s.yimg.com/lo/mysterio/api/08b4c3cd5fc5a7f12fd99975caeff0f1064426afe9e98e165568f67e4b03a0f1/lightyear_networkapi/resizefill_w1200;quality_80;format_webp/https:%2F%2Fmedia.zenfs.com%2Fen%2Ffox_news_text_979%2F5b1b4eb771e0f378aea206092a8eedb9,,"Fireworks planned for President Donald Trump's July Fourth celebration on the National Mall are expected to cause hazardous air pollution around the Mall and ""very unhealthy"" conditions across centra… [+4342 chars]",,"Washington Post schüttet kaltes Wasser auf Feuerwerkskörper in DC mit Bericht über „gefährliche Luftverschmutzung“. Der Internal National Park Service dokumentiert, dass 850.000 Feuerwerkskörper, die an 10 Standorten in der National Mall abgefeuert wurden, gefährliche PM2,5-Werte aufweisen.","Washington Post throws cold water on DC fireworks with report of 'hazardous air pollution'. Internal National Park Service documents project hazardous PM2.5 levels from 850,000 fireworks shells launched across 10 sites on the National Mall.","Washington Post aquam frigidam in DC ignium iacit cum relatione ""aeris pollutionis ardui"". Interna National Park Service documenta ancipitia PM2.5 gradus exstent ex 850,000 ignium conchis trans 10 locis in National Mallum deductis.",2026-07-05 16:03:24+00:00
d0d05ec0c9c94800267b2ec4a459e79d,2026-07-02T02:17:55Z,'cold snap',www.lifesciencesworld.com,en,0.3,Do moles and voles come in the house?,"Do Moles and Voles Come in the House? No, generally, moles do not come into houses; their subterranean lifestyle prevents them from entering dwellings. Voles, however, are occasionally found indoors, especially during colder months or when seeking shelter. In…",https://www.lifesciencesworld.com/do-moles-and-voles-come-in-the-house/,,,"No, generally, moles do not come into houses; their subterranean lifestyle prevents them from entering dwellings.Voles, however, are occasionally found indoors, especially during colder months or whe… [+8213 chars]",,"Kommen Maulwürfe und Wühlmäuse ins Haus? Kommen Maulwürfe und Wühlmäuse ins Haus? Nein, im Allgemeinen kommen Maulwürfe nicht in Häuser; Ihr unterirdischer Lebensstil hindert sie daran, Wohnungen zu betreten. Wühlmäuse kommen jedoch gelegentlich in Innenräumen vor, insbesondere in den kälteren Monaten oder auf der Suche nach Schutz. In…","Do moles and voles come in the house?. Do Moles and Voles Come in the House? No, generally, moles do not come into houses; their subterranean lifestyle prevents them from entering dwellings. Voles, however, are occasionally found indoors, especially during colder months or when seeking shelter. In…","Num talpae et volae ingrediuntur in domo? Num Moles et Voles in Domo veniunt? Vulgo, talpae aedes non veniunt; subterraneum eorum vivendi genus vetat ut tabernacula ingrediantur. Voles autem interdum domesticas reperiuntur, praesertim mensibus frigidioribus vel cum latebra quaerunt. In…",2026-07-06 02:43:13+00:00
