index,published,keyword,domain,language,valid,title,description,url,image,archive,content,quote,de,en,la,added
8ab357310095a73f37a35ce1d927d4cd,2025-12-09T07:51:13Z,'cold wave',economictimes.indiatimes.com,en,0.9,"Kashmir gets first snowfall of this season, cold wave likely to sweep North India soon: What’s predicted for the coming days","Kashmir Snowfall: While Kashmir celebrates its early winter charm with fresh snow in Sonamarg, the rest of India is bracing for cold wave conditions. The IMD has warned that temperatures may fall, fog may intensify, and cold winds are likely to sweep through …",https://economictimes.indiatimes.com/news/new-updates/kashmir-gets-first-snowfall-of-this-season-cold-wave-likely-to-sweep-north-india-soon-whats-predicted-for-the-coming-days/articleshow/125864684.cms,"https://img.etimg.com/thumb/msid-125864834,width-1200,height-630,imgsize-100812,overlay-economictimes/articleshow.jpg",,"Kashmir Valley remained under an intense cold wave on Monday, with Srinagar recording a minimum temperature of minus 2.4 degrees Celsius and no sign of relief from the biting chill. An intense dry sp… [+2351 chars]",,"Kaschmir bekommt den ersten Schneefall dieser Saison, eine Kältewelle wird wahrscheinlich bald über Nordindien hinwegfegen: Was für die kommenden Tage vorhergesagt wird. Schneefall in Kaschmir: Während Kaschmir in Sonamarg seinen frühen Winterzauber mit Neuschnee feiert, bereitet sich der Rest Indiens auf Kältewellen vor. Das IMD hat gewarnt, dass die Temperaturen sinken könnten, der Nebel stärker werden könnte und kalte Winde durchziehen könnten …","Kashmir gets first snowfall of this season, cold wave likely to sweep North India soon: What’s predicted for the coming days. Kashmir Snowfall: While Kashmir celebrates its early winter charm with fresh snow in Sonamarg, the rest of India is bracing for cold wave conditions. The IMD has warned that temperatures may fall, fog may intensify, and cold winds are likely to sweep through …","Kashmir nix primum huius temporis accipit, unda frigida in Indiam Septentrionalem verturus mox: Quid futurum est diebus praedixit. Kashmir Snowfall: Dum Kashmir suam primam hiemem leporem recentibus nivibus in Sonamarg celebrat, reliqua Indiae condiciones undas frigidas comprehendit. IMD monuit temperaturas cadere possunt, nebula augere potest, et venti frigidi per ... verrere solent.",2025-12-10 10:20:35+00:00
a35506ce1c6db605bb9805cf29bd20d9,2025-12-08T17:38:00Z,'extreme cold',www.hurriyetdailynews.com,en,0.9,Turkish doctors use extreme cold to improve lung disease diagnosis,"Akdeniz University's Faculty of Medicine has introduced a cutting-edge cryobiopsy technique that replaces surgical lung biopsy in diagnosing diffuse parenchymal lung diseases, commonly known as “lung stiffening.”",https://www.hurriyetdailynews.com/turkish-doctors-use-extreme-cold-to-improve-lung-disease-diagnosis-216596,https://image.hurimg.com/i/hurriyet/75/200x200/69370d26600db024f7cefc31.jpg,,"ANTALYA
Akdeniz University's Faculty of Medicine has introduced a cutting-edge cryobiopsy technique that replaces surgical lung biopsy in diagnosing diffuse parenchymal lung diseases, commonly known… [+1651 chars]",,"Türkische Ärzte nutzen extreme Kälte, um die Diagnose von Lungenerkrankungen zu verbessern. Die medizinische Fakultät der Universität Akdeniz hat eine hochmoderne Kryobiopsietechnik eingeführt, die die chirurgische Lungenbiopsie bei der Diagnose diffuser parenchymaler Lungenerkrankungen, allgemein bekannt als „Lungenversteifung“, ersetzt.","Turkish doctors use extreme cold to improve lung disease diagnosis. Akdeniz University's Faculty of Medicine has introduced a cutting-edge cryobiopsy technique that replaces surgical lung biopsy in diagnosing diffuse parenchymal lung diseases, commonly known as “lung stiffening.”","Turcorum medici summo frigore utuntur ad diagnosin pulmonis emendandam. Akdeniz Facultas Medicinae Universitatis increptionem cryobiopsy artem induxit, quae biopsy pulmonem chirurgicum substituit in morbis pulmonis diagnosing diffusis parenchymatis, vulgo ""pulmonis perustis.""",2025-12-11 20:20:18+00:00
818282e7824a5adafa59c3db2a4d08d2,2025-12-09T13:00:00Z,'extreme cold',www.cbc.ca,en,0.8,City of Edmonton activates extreme weather response ahead of frigid temperatures this week,The city has activated its extreme weather response to help protect vulnerable Edmontonians from the cold temperatures that will settle in later this week.,https://www.cbc.ca/news/canada/edmonton/edmonton-extreme-weather-response-9.7008267,"https://i.cbc.ca/ais/1.6671549,1765250940710/full/max/0/default.jpg?im=Crop%2Crect%3D%280%2C0%2C1919%2C1079%29%3BResize%3D620",,"The City of Edmonton activated its extreme weather response on Monday to help protect vulnerable people from some very cold weather that is expected to settle in this week.
As of Monday night, Envir… [+1594 chars]",,"Die Stadt Edmonton reagiert diese Woche auf extreme Wetterbedingungen vor den eisigen Temperaturen. Die Stadt hat ihre Reaktion auf extreme Wetterbedingungen aktiviert, um die gefährdeten Einwohner Edmontons vor den kalten Temperaturen zu schützen, die im Laufe dieser Woche eintreten werden.",City of Edmonton activates extreme weather response ahead of frigid temperatures this week. The city has activated its extreme weather response to help protect vulnerable Edmontonians from the cold temperatures that will settle in later this week.,Civitas Edmonton extremam tempestatum responsionem operatur ante temperaturas frigidas hac septimana. Urbs extremam tempestatem suam responsionem excitavit ut Edmontonianos vulnerabiles a temperaturae algoris algoris hac septimana conservandos adiuvaret.,2025-12-12 20:19:00+00:00
01a77cec8be782670b7a052ccf4a1a95,2025-12-10T12:04:52Z,'extreme cold',www.cnn.com,en,0.9,A new threat to affordability – just in time for winter | CNN Business,A new problem is threatening to worsen the affordability squeeze this winter: Natural gas prices have raced back up just as extreme cold forces Americans to crank up the heat.,https://www.cnn.com/2025/12/10/business/winter-heat-energy-prices,"https://media.cnn.com/api/v1/images/stellar/prod/gettyimages-1194716707.jpg?c=16x9&q=w_800,c_fill",,"A new problem is threatening to worsen the affordability squeeze this winter: Natural gas prices have raced back up just as extreme cold forces Americans to crank up the heat.
President Donald Trump… [+5141 chars]",,"Eine neue Bedrohung für die Erschwinglichkeit – pünktlich zum Winter | CNN-Geschäft. Ein neues Problem droht die Erschwinglichkeitsknappheit in diesem Winter noch zu verschärfen: Die Erdgaspreise sind wieder gestiegen, während extreme Kälte die Amerikaner dazu zwingt, die Heizung anzudrehen.",A new threat to affordability – just in time for winter | CNN Business. A new problem is threatening to worsen the affordability squeeze this winter: Natural gas prices have raced back up just as extreme cold forces Americans to crank up the heat.,Novum periculum ad affordability - sicut in tempore hiemis | Lorem rhoncus. Nova quaestio instat graviorem parabilis hanc hiemem exprimendam: Pretia naturalis gasi tergum sursum currerunt sicut copiae frigidae extremae Americani ad calorem crankunt.,2025-12-13 01:13:59+00:00
2084483c727aa360d70bd70b9b1d833b,2025-12-05T14:41:21Z,'cold snap',www.nbcsports.com,en,0.8,"Tua Tagovailoa will try to keep winning streak going, snap cold weather struggles this Sunday",The Dolphins have shown some spark by winning their last three games and they'll be trying to extend that streak against the Jets in New Jersey on Sunday.,https://www.nbcsports.com/nfl/profootballtalk/rumor-mill/news/tua-tagovailoa-will-try-to-keep-winning-streak-going-snap-cold-weather-struggles-this-sunday,https://nbcsports.brightspotcdn.com/dims4/default/8e5f7b4/2147483647/strip/true/crop/3528x1985+0+0/resize/1440x810!/quality/90/?url=https%3A%2F%2Fnbc-sports-production-nbc-sports.s3.us-east-1.amazonaws.com%2Fbrightspot%2F04%2Fe7%2Ff711835c48c4871c46e672b8038b%2Fhttps-delivery-gettyimages.com%2Fdownloads%2F2249588421,,"The Dolphins have shown some spark by winning their last three games and theyll be trying to extend that streak against the Jets in New Jersey on Sunday. 
Their AFC East rivals wont be the only oppo… [+908 chars]",,"Tua Tagovailoa wird versuchen, ihre Siegesserie fortzusetzen, trotz der Kälteprobleme an diesem Sonntag. Die Dolphins haben mit den Siegen in den letzten drei Spielen einiges an Glanz gezeigt und werden versuchen, diese Serie am Sonntag gegen die Jets in New Jersey auszubauen.","Tua Tagovailoa will try to keep winning streak going, snap cold weather struggles this Sunday. The Dolphins have shown some spark by winning their last three games and they'll be trying to extend that streak against the Jets in New Jersey on Sunday.","Tua Tagovailoa conabitur ad conciliandos series euntes, frigus tempestatum disrumpam luctatur hac Dominica. Delphini scintillam aliquam docuerunt ultimis tribus ludis conciliandis et in Nova Jersey verram illam extendere conantur ut in Nova Jersey die Dominico.",2025-12-13 10:16:45+00:00
a2a82b413100318668ffb0cc9d5a80f0,2025-12-02T06:40:24Z,'heating system',ahouseinthehills.com,en,0.9,The Smart Way to Handle Household Water and Heating Issues,"Water and heating systems are central to the comfort and function of every home. When these systems work properly, daily routines run smoothly and without worry. Yet when problems appear, even the smallest issue can cause disruption and unnecessary stress. Ma…",https://ahouseinthehills.com/the-smart-way-to-handle-household-water-and-heating-issues/,https://ahouseinthehills.com/wp-content/uploads/2025/12/pexels-steve-861414-scaled.jpg,,"Water and heating systems are central to the comfort and function of every home. When these systems work properly, daily routines run smoothly and without worry. Yet when problems appear, even the sm… [+7957 chars]",,"Der intelligente Weg, Wasser- und Heizungsprobleme im Haushalt zu lösen. Wasser- und Heizsysteme sind für den Komfort und die Funktion eines jeden Hauses von zentraler Bedeutung. Wenn diese Systeme ordnungsgemäß funktionieren, laufen die täglichen Abläufe reibungslos und sorgenfrei ab. Doch wenn Probleme auftreten, kann selbst das kleinste Problem zu Störungen und unnötigem Stress führen. Ma…","The Smart Way to Handle Household Water and Heating Issues. Water and heating systems are central to the comfort and function of every home. When these systems work properly, daily routines run smoothly and without worry. Yet when problems appear, even the smallest issue can cause disruption and unnecessary stress. Ma…","Smert via ad tractandum hospitii aqua et calefactio Exitus. Systema calefactionis aquae centralis est ad consolationem et functionem cuiuslibet domus. Cum haec systemata recte laborant, cotidianae consuetudines leniter et sine molestia currunt. Cum tamen quaestiones apparent, etiam minimae quaestiones discidium et accentus supervacuos facere possunt. Ma…",2025-12-14 15:15:46+00:00
