index,published,keyword,domain,language,valid,title,description,url,image,archive,content,quote,de,en,la,added
e4aefb27e7abbbdbca162239af95c2c3,2026-04-08T00:02:26Z,'cold wave',pdx.eater.com,en,0.3,Big Taste Comes in a Small Package at Cutie Pie Pizzeria,"Personal pizzas were something of a novelty back in the day, but Portland has seen a wave of pizzerias focusing on small pies, following on from the high-profile success of small-batch farm-to-table shops like Lovely’s Fifty Fifty and a renewed interest in Ne…",https://pdx.eater.com/dining-report/108112/cutie-pie-pizzeria-review,https://platform.pdx.eater.com/wp-content/uploads/sites/29/2026/04/PXL_20260304_221357325.PORTRAIT.jpg?quality=90&strip=all&crop=0%2C15.232329842932%2C100%2C69.535340314136&w=1200,http://web.archive.org/web/20260412125616/https://pdx.eater.com/dining-report/108112/cutie-pie-pizzeria-review,"In our Dining Reports, we share a firsthand perspective of a recent restaurant visit, covering everything from the vibe to must-get dishes. See more in the Eater app.
Download the app
Personal pizz… [+1940 chars]",,"Großer Geschmack kommt in einer kleinen Packung bei Cutie Pie Pizzeria. Persönliche Pizzen waren damals so etwas wie eine Neuheit, aber Portland hat eine Welle von Pizzerien erlebt, die sich auf kleine Pasteten konzentrierten, gefolgt vom großen Erfolg von Läden, die kleine Mengen direkt vom Bauernhof auf den Tisch bringen, wie Lovely’s Fifty Fifty, und einem erneuten Interesse an New …","Big Taste Comes in a Small Package at Cutie Pie Pizzeria. Personal pizzas were something of a novelty back in the day, but Portland has seen a wave of pizzerias focusing on small pies, following on from the high-profile success of small-batch farm-to-table shops like Lovely’s Fifty Fifty and a renewed interest in Ne…","Magnus Taste venit in parva sarcina apud Cutie Pie Pizzeria. lagani pistrinae personales aliquid novitatis reduxerunt in die, sed Portland undam pizzerias in parvis pies positis vidit, ex successu altorum profile e parvarum villarum ad taber- narium sicut Lovely Quinquaginta et renovatum studium in Ne…",2026-04-15 10:56:02+00:00
b460b542b21c07085380416c401bce91,2026-04-13T15:21:10Z,'cold wave',blog.ericgoldman.org,en,0.8,The Cox Shock: A Tectonic Shift or Just a Tremor? (Guest Blog Post),"by guest blogger Prof. Guy Rub, Temple University Beasley School of Law The Supreme Court’s decision in Cox v. Sony sent a shockwave through the copyright world. In an opinion that felt like a cold shower for copyright owners, Justice Thomas essentially...
Th…",https://blog.ericgoldman.org/archives/2026/04/the-cox-shock-a-tectonic-shift-or-just-a-tremor-guest-blog-post.htm,https://blog.ericgoldman.org/wp-content/uploads/2026/03/copyright-tailor-v2.jpg,,"by guest blogger Prof. Guy Rub, Temple University Beasley School of Law
The Supreme Court’s decision in Cox v. Sony sent a shockwave through the copyright world. In an opinion that felt like a cold s… [+11633 chars]",,"Der Cox-Schock: Eine tektonische Verschiebung oder nur ein Zittern? (Gast-Blogbeitrag). von Gastblogger Prof. Guy Rub, Temple University Beasley School of Law Die Entscheidung des Obersten Gerichtshofs im Fall Cox gegen Sony löste eine Schockwelle in der Welt des Urheberrechts aus. In einer Stellungnahme, die sich für Urheberrechtsinhaber wie eine kalte Dusche anfühlte, sagte Richter Thomas im Wesentlichen ...
Th…","The Cox Shock: A Tectonic Shift or Just a Tremor? (Guest Blog Post). by guest blogger Prof. Guy Rub, Temple University Beasley School of Law The Supreme Court’s decision in Cox v. Sony sent a shockwave through the copyright world. In an opinion that felt like a cold shower for copyright owners, Justice Thomas essentially...
Th…","The Cox Shock: A Tectonic Shift or Just a Tremor? (Hoest Blog Post). per hospitem blogger Prof. Guy Rub, Templum Universitatis Beasley Scholae Iuris Consultum Summi Curiae in Cox v. Sony stimulum per mundum ius missum est. In opinione quae quasi imber frigidus dominus iurisperitorum sensit, Iustitiae Thomas essentialiter...
Th…",2026-04-15 10:56:02+00:00
62e0e3c40e507f5927841a03c8917964,2026-04-01T07:32:27Z,'cold snap',www.thejournal.ie,en,0.3,Wet and windy Easter weekend ahead as temperatures set to drop below freezing tonight,Temperatures could drop as low as -1 degrees some regions tonight.,https://www.thejournal.ie/weather-forecast-easter-weekend-rain-wind-7000323-Apr2026/,https://img2.thejournal.ie/article/7000323/river/?height=400&version=7000324,,"ITS SET TO turn colder tonight before a wet and blustery spell of weather moves in for the Easter weekend, according to Met Éireann.
The forecaster has said that today will start off mostly dry and … [+1540 chars]",,"Es steht ein nasses und windiges Osterwochenende bevor, da die Temperaturen heute Nacht unter den Gefrierpunkt fallen werden. Die Temperaturen könnten heute Nacht in einigen Regionen auf bis zu -1 Grad sinken.",Wet and windy Easter weekend ahead as temperatures set to drop below freezing tonight. Temperatures could drop as low as -1 degrees some regions tonight.,Infectum et ventosum volutpat Paschae praemisit ut temperaturas sub hac nocte congelatio poneret. Temperaturae aliquae regiones hac nocte tam infimae quam -1 gradus decidere potuerunt.,2026-04-15 16:02:38+00:00
fcecfbc5f0f5bcccefb6b776c552e028,2026-04-07T05:01:43Z,'cold snap',roundtable.io,en,0.2,Seattle Mariners Bats Stay Cold in 2-1 Loss to Texas Rangers,The Mariners dropped their third-straight game against an American League West foe in the first of a three-game set against the Rangers,https://roundtable.io/sports/mlb/mariners/game-day/seattle-mariners-bats-stay-cold-in-2-1-loss-to-texas-rangers,https://s.yimg.com/ny/api/res/1.2/batj82x72cbs2ktOjzl.rA--/YXBwaWQ9aGlnaGxhbmRlcjt3PTEyMDA7aD04MDA7Y2Y9d2VicA--/https://media.zenfs.com/en/roundtable_sports_seattle_mariners_articles_463/000af7ceac5757b0094cab927a071a87,http://web.archive.org/web/20260408124037/https://roundtable.io/sports/mlb/mariners/game-day/seattle-mariners-bats-stay-cold-in-2-1-loss-to-texas-rangers,The first quality start of the season for Seattle Mariners starting pitcher Logan Gilbert and first home run of the year for catcher Cal Raleigh weren't enough to lead the M's to victory in a 2-1 los… [+2960 chars],,Die Seattle Mariners Bats bleiben bei der 1:2-Niederlage gegen die Texas Rangers kalt. Die Mariners verloren ihr drittes Spiel in Folge gegen einen Gegner der American League West im ersten von drei Spielen gegen die Rangers,Seattle Mariners Bats Stay Cold in 2-1 Loss to Texas Rangers. The Mariners dropped their third-straight game against an American League West foe in the first of a three-game set against the Rangers,Seattle Nautae Bats manete frigus in 2-1 damnum ad Texas condimentum. Nautae destiterunt suum tertium-rectum ludum contra Americanos Foedus Occidentalem hostem in primo trium ludorum contra Rangers positos.,2026-04-16 02:11:27+00:00
bd8eda5a0af6dca3a1b8f3c9ab71d856,2026-04-03T12:46:00Z,'cold snap',www.orlandosentinel.com,en,0.3,No plays off: Jon Sumrall’s Loaf Report demands accountability from Gators,"GAINESVILLE — Coach Jon Sumrall and his Florida staff are watching — every practice, every snap, every step. Take a play off and everyone will find out. The “Loaf Report” spares no one. Each day after spring practice, players find out who committed the cardin…",https://www.orlandosentinel.com/2026/04/03/florida-gators-football-jon-sumrall-jadan-baught-trent-mcknight-marcus-davis-chris-collins-buster-faulkner-loaf-report/,https://s.yimg.com/ny/api/res/1.2/Bh_5h5YySy2qLhD9.n4pGg--/YXBwaWQ9aGlnaGxhbmRlcjt3PTEyMDA7aD03Njk7Y2Y9d2VicA--/https://media.zenfs.com/en/orlando_sentinel_local_122/8386180ce816d09fdf0fd9906acda7c5,http://web.archive.org/web/20260404024247/https://www.orlandosentinel.com/2026/04/03/florida-gators-football-jon-sumrall-jadan-baught-trent-mcknight-marcus-davis-chris-collins-buster-faulkner-loaf-report/,"GAINESVILLE Coach Jon Sumrall and his Florida staff are watching every practice, every snap, every step.
Take a play off and everyone will find out. The Loaf Report spares no one.
Each day after sp… [+3725 chars]",,"Keine Playoffs: Jon Sumralls Loaf Report fordert von den Gators Rechenschaftspflicht. GAINESVILLE – Trainer Jon Sumrall und seine Mitarbeiter aus Florida beobachten – jedes Training, jeden Schnappschuss, jeden Schritt. Machen Sie ein Playoff und jeder wird es herausfinden. Der „Loaf Report“ verschont niemanden. Jeden Tag nach dem Frühjahrstraining erfahren die Spieler, wer den Kardinal begangen hat …","No plays off: Jon Sumrall’s Loaf Report demands accountability from Gators. GAINESVILLE — Coach Jon Sumrall and his Florida staff are watching — every practice, every snap, every step. Take a play off and everyone will find out. The “Loaf Report” spares no one. Each day after spring practice, players find out who committed the cardin…","Nulla fabula off: Jon Sumrall's Loaf Relatio de Gators rationem postulat. GAINESVILLE — Coach Jon Sumrall et eius Florida baculus aspiciunt — omnem praxim, omnem disrumpam, omnem gradum. Tolle fabulam, et omnes inueniet. Nemini parcit ""Loaf Report"". Cotidie post usum vernum, histriones reperiunt qui cardinem mandaverunt…",2026-04-16 02:11:27+00:00
4e9e858f5160c2d0f79e69a4f5881c30,2026-04-03T14:42:11Z,'cold snap',lifedev.net,en,0.3,7 Powerful Self-Regulation Techniques for Calmer Thoughts and Better Choices,"Self-regulation techniques are not cold psychological tricks, but everyday tools that help a person stay grounded when emotions, thoughts, and situations threaten to spin out of control.  In a time when almost everyone is juggling work demands, family tension…",https://lifedev.net/2026/04/powerful-self-regulation-techniques/,https://lifedev.net/wp-content/uploads/2026/04/self-regulation.jpg,,"Self-regulation techniques are not cold psychological tricks, but everyday tools that help a person stay grounded when emotions, thoughts, and situations threaten to spin out of control. 
In a time … [+12258 chars]",,"7 leistungsstarke Selbstregulierungstechniken für ruhigere Gedanken und bessere Entscheidungen. Selbstregulierungstechniken sind keine kalten psychologischen Tricks, sondern alltägliche Werkzeuge, die einem Menschen helfen, auf dem Boden zu bleiben, wenn Emotionen, Gedanken und Situationen außer Kontrolle zu geraten drohen.  In einer Zeit, in der fast jeder mit Arbeitsanforderungen und familiären Spannungen jongliert …","7 Powerful Self-Regulation Techniques for Calmer Thoughts and Better Choices. Self-regulation techniques are not cold psychological tricks, but everyday tools that help a person stay grounded when emotions, thoughts, and situations threaten to spin out of control.  In a time when almost everyone is juggling work demands, family tension…","7 Valida Self-ordinatio Techniques Animi Calmerorum Cogitationes et Electiones Potiora. Artes moderandae propriae non sunt strophae psychologicae frigidae, sed instrumenta quotidiana quae hominem adiuvant fundatum manere cum motus, cogitationes, condiciones minantur se subtrahere imperium.  In tempore, quo fere omnes praestigiae opus postulat, contentio familiae…",2026-04-16 02:11:27+00:00
44210bac7f589febf9b2edad62aa78b9,2026-04-05T23:49:40Z,'cold snap',www.sfchronicle.com,en,0.3,Giants' Tony Vitello gets hot as offense stays cold in 3rd straight loss to Mets,"Tony Vitello received his first MLB ejection Sunday as the Giants lost 5-2 to the Mets at Oracle Park. San Francisco, held under four runs for the eighth time, fell to an NL-worst 3-7.",https://www.sfchronicle.com/sports/giants/article/giants-tony-vitello-hot-offense-remains-cold-22189530.php,https://s.yimg.com/ny/api/res/1.2/ssM3Ra2gBqxP80IVAe6Wtw--/YXBwaWQ9aGlnaGxhbmRlcjt3PTEyMDA7aD04MDA7Y2Y9d2VicA--/https://media.zenfs.com/en/san_francisco_chronicle_hearst_178/8df8d939569b7d7278412d5ce78f0752,,"Minimal scoring is the norm more often than not so far for the San Francisco Giants, and with the team somnolent again to start things Saturday, Logan Webb was up to the challenge.
The Giants' top s… [+2958 chars]",,"Tony Vitello von den Giants wird heiß, während die Offensive bei der dritten Niederlage in Folge gegen die Mets kalt bleibt. Tony Vitello wurde am Sonntag zum ersten Mal aus der MLB ausgeschlossen, als die Giants im Oracle Park mit 2:5 gegen die Mets verloren. San Francisco, das zum achten Mal unter vier Läufen ausgetragen wurde, fiel mit 3:7 auf die schlechteste NL-Niederlage.","Giants' Tony Vitello gets hot as offense stays cold in 3rd straight loss to Mets. Tony Vitello received his first MLB ejection Sunday as the Giants lost 5-2 to the Mets at Oracle Park. San Francisco, held under four runs for the eighth time, fell to an NL-worst 3-7.","Giants' Tony Vitello calescit ut scandalum moratur frigus in 3rd recta damna ad Mets. Tony Vitello primam MLB eiectionem Dominicam accepit sicut Giants 5-2 ad Mets in Park Oraculo amisit. San Francisco, qui sub quaternis currit pro octava vice, NL pessime obvenit 3-7.",2026-04-16 02:11:27+00:00
5fe775fc0690ca4234d7784846b3544d,2026-04-07T02:47:34Z,'cold snap',sports.yahoo.com,en,0.3,"Brandon Young has crisp spot start for Orioles, who beat White Sox 2-1 to snap 3-game skid","Spot starter Brandon Young pitched five scoreless innings, Gunnar Henderson homered and the Baltimore Orioles beat the Chicago White Sox 2-1 on Monday night to stop a three-game skid. Ryan Helsley worked out of a jam in the ninth for his third save. After an …",https://sports.yahoo.com/articles/brandon-young-crisp-spot-start-024734380.html,https://s.yimg.com/ny/api/res/1.2/UF6K3Uty9.q0sonaGgbGyg--/YXBwaWQ9aGlnaGxhbmRlcjt3PTEyMDA7aD04MDA7Y2Y9d2VicA--/https://media.zenfs.com/en/ap.org/338bd474903f3eab56b2c390c4f2f192,http://web.archive.org/web/20260408070305/https://sports.yahoo.com/articles/brandon-young-crisp-spot-start-024734380.html,"CHICAGO (AP) Spot starter Brandon Young pitched five scoreless innings, Gunnar Henderson homered and the Baltimore Orioles beat the Chicago White Sox 2-1 on Monday night to stop a three-game skid.
R… [+1396 chars]",,"Brandon Young hat einen tollen Start für Orioles, der die White Sox mit 2:1 besiegte und damit einen Drei-Spiele-Ausrutscher sicherte. Spot-Starter Brandon Young warf fünf torlose Innings, Gunnar Henderson erzielte einen Homerun und die Baltimore Orioles besiegten die Chicago White Sox am Montagabend mit 2:1 und stoppten damit einen Rückstand von drei Spielen. Ryan Helsley erkämpfte sich im neunten Durchgang seine dritte Parade. Nach einem …","Brandon Young has crisp spot start for Orioles, who beat White Sox 2-1 to snap 3-game skid. Spot starter Brandon Young pitched five scoreless innings, Gunnar Henderson homered and the Baltimore Orioles beat the Chicago White Sox 2-1 on Monday night to stop a three-game skid. Ryan Helsley worked out of a jam in the ninth for his third save. After an …","Brandon Young maculam rigidam habet initium pro Orioles, qui Albam Sox 2-1 verberavit ut 3-ludum LABOR disrumpam. Macula primarii Brandonus Young quinque innings sexaginta fixit, Gunnar Henderson homered et Baltimore Orioles pulsavit Chicago Albus Sox 2-1 die Lunae nocte, ut tres lusus skid prohiberent. Ryan Helsley elaboratus est de impedito anno nono tertio, excepto. Post an ...",2026-04-16 02:11:27+00:00
346f2fe24d7d2015dd4391225516cbd9,2026-04-08T09:00:56Z,'cold snap',road.cc,en,0.3,Velocio Men’s Alpha Air Jacket,"The Velocio Men’s Alpha Air Jacket is a warm, comfortable and very nicely made top for cold and dry-ish days. I had a few niggles with fit and breathability, but they weren’t enough to spoil my enjoyment – and both aspects may actually work really well for yo…",https://road.cc/review_v2/velocio-mens-alpha-air-jacket,https://cdn.road.cc/wp-content/uploads/2026/03/2025-velocio-men-alpha-air-jacket-scaled.jpg,,"The Velocio Men’s Alpha Air Jacket is a warm, comfortable and very nicely made top for cold and dry-ish days. I had a few niggles with fit and breathability, but they weren’t enough to spoil my enjoy… [+4038 chars]",,"Velocio Herren Alpha Air Jacke. Die Velocio Men's Alpha Air Jacket ist ein warmes, bequemes und sehr gut verarbeitetes Oberteil für kalte und trockene Tage. Ich hatte ein paar Probleme mit der Passform und der Atmungsaktivität, aber das reichte nicht aus, um mir den Spaß zu verderben – und vielleicht funktionieren beide Aspekte wirklich gut für Sie …","Velocio Men’s Alpha Air Jacket. The Velocio Men’s Alpha Air Jacket is a warm, comfortable and very nicely made top for cold and dry-ish days. I had a few niggles with fit and breathability, but they weren’t enough to spoil my enjoyment – and both aspects may actually work really well for yo…","Velocio Men's Alpha Air Jacket. Velocio Men's Alpha Air Jacket calidum, commodus et belle summum diebus frigidis et siccis factus est. Habui paucas nigles cum aptitudine et respirabilitate, sed satis non erant ad praedam meam delectationem - et utraque res vere bene io ...",2026-04-16 02:11:27+00:00
a2ee4e3085519944729d95218a0d24d4,2026-04-10T02:37:55Z,'cold snap',www.royalsreview.com,en,0.3,"Royals bats remain cold as team drops third straight, 2-0",Strong pitching and defense aren’t enough.,https://www.royalsreview.com/kansas-city-royals-game-information/96705/royals-bats-remain-cold-as-team-drops-third-straight-2-0,https://s.yimg.com/ny/api/res/1.2/F8bSqsfvb1v2vvcdQiPi1A--/YXBwaWQ9aGlnaGxhbmRlcjt3PTEyMDA7aD04MDA7Y2Y9d2VicA--/https://media.zenfs.com/en/sb_nation_articles_115/93e3e788afaf08799486de3d1c7bc83f,,"You cant win if you dont score.
For the second time this season, the Royals failed to score a run in a game. A 2-0 loss to the White Sox drops Kansas City to 5-8.
Its the Royals third straight loss… [+1790 chars]",,"Die Fledermäuse der Royals bleiben kalt, während das Team zum dritten Mal in Folge mit 2:0 untergeht. Starkes Pitching und starke Verteidigung reichen nicht aus.","Royals bats remain cold as team drops third straight, 2-0. Strong pitching and defense aren’t enough.","Vespertiliones Regiorum frigidae manent sicut guttae tertiae rectae, 2-0. Fortis figendi et defensionis satis non sunt.",2026-04-16 02:11:27+00:00
e436a68598c902f2036832d5de63a5ab,2026-04-03T15:00:00Z,'cold snap',www.spoilertv.com,en,0.6,Fire Country - Episode 4.16 - Not Worth the Risk - Promotional Photos + Press Release,,https://www.spoilertv.com/2026/04/fire-country-episode-416-not-worth-risk.html,https://blogger.googleusercontent.com/img/b/R29vZ2xl/AVvXsEjfwPvngpHZc5AtCtVVfV4S91DXEXxsdOSvC7w3a9cNQizPHej3eGXzwyALJ57S_O29-5bg0moX9rgsVGpbPHh8SvhcE0sM9wre_9-TwldJhCrQRH64tIYqI-TngWt8a4eP6ZIOKH-zFiHPYPie82StKEXC4PfxMkGV-T0GmhzhTfmTUzOwow/w1200-h630-p-k-no-nu/fire16%20%281%29.png,,"Promotional Photos

 

Press Release


“Not Worth the Risk” – Bode sets out to prove his leadership skills during a historic cold snap that plunges Edgewater into crisis mode. Meanwhile, Jake conte… [+349 chars]",,Fire Country – Folge 4.16 – Das Risiko nicht wert – Werbefotos + Pressemitteilung.,Fire Country - Episode 4.16 - Not Worth the Risk - Promotional Photos + Press Release. ,Ignis Patriae - Episode 4.16 - Non Dignum Periculum - Imagines Promotional + Press Release.,2026-04-16 02:11:27+00:00
ba84f64bce6dd59714e684f7f42960be,2026-04-15T00:00:00Z,'heating system',www.nature.com,en,0.3,Cell-type-targeted mitochondrial transplantation rescues cell degeneration,MitoCatch is a cell-type-specific mitochondrion-targeting system that links mitochondria and the cell surface by protein binders and delivers mitochondria into the target cell.,https://www.nature.com/articles/s41586-026-10391-0,https://media.springernature.com/m685/springer-static/image/art%3A10.1038%2Fs41586-026-10391-0/MediaObjects/41586_2026_10391_Fig1_HTML.png,,"Animals
Animal experiments were performed following standard ethical guidelines (European Communities Guidelines on the Care and Use of Laboratory Animals, 86/609/EEC), and were approved by the Vete… [+117873 chars]",,"Eine zelltypspezifische mitochondriale Transplantation rettet die Zelldegeneration. MitoCatch ist ein zelltypspezifisches Mitochondrien-Targeting-System, das Mitochondrien und die Zelloberfläche durch Proteinbinder verbindet und Mitochondrien in die Zielzelle transportiert.",Cell-type-targeted mitochondrial transplantation rescues cell degeneration. MitoCatch is a cell-type-specific mitochondrion-targeting system that links mitochondria and the cell surface by protein binders and delivers mitochondria into the target cell.,"Cellula transplantatio mitochondrialis iaculis degenerationem cellam liberat. MitoCatch est systema celi-typum speciale mitochondrionis targeti, quod mitochondriacum et superficiem cellulam nexibus dapibus coniungit et mitochondriam in cellam scopo tradit.",2026-04-16 06:55:18+00:00
fc98eb19022d0bdf2f79f3b0429db91c,2026-04-15T00:00:00Z,'cold snap',www.nature.com,en,0.3,An acetylated Tau-174 CSF biomarker discriminates between TDP-43 and tau pathology in patients with frontotemporal lobar degeneration,"A new cerebrospinal fluid biomarker, AcTau174, was elevated in frontotemporal lobar degeneration with TAR DNA-binding protein (FTLD-TDP), distinguishing this pathology from FTLD-Tau, and was associated with disease severity and progression in FTLD-TDP.",https://www.nature.com/articles/s41591-026-04341-6,https://media.springernature.com/m685/springer-static/image/art%3A10.1038%2Fs41591-026-04341-6/MediaObjects/41591_2026_4341_Fig1_HTML.png,,"Patient cohorts
ADC
This study included individuals from the ADC55 and SCIENCe project56 who visited the memory clinic of the Alzheimer Center Amsterdam (Vrije Universiteit Amsterdam, Amsterdam UMC… [+21346 chars]",,"Ein acetylierter Tau-174-CSF-Biomarker unterscheidet zwischen TDP-43- und Tau-Pathologie bei Patienten mit frontotemporaler Lappendegeneration. Ein neuer Liquor-Biomarker, AcTau174, war bei der frontotemporalen Lappendegeneration mit TAR-DNA-bindendem Protein (FTLD-TDP) erhöht, was diese Pathologie von FTLD-Tau unterscheidet, und war mit der Schwere und dem Fortschreiten der Erkrankung bei FTLD-TDP assoziiert.","An acetylated Tau-174 CSF biomarker discriminates between TDP-43 and tau pathology in patients with frontotemporal lobar degeneration. A new cerebrospinal fluid biomarker, AcTau174, was elevated in frontotemporal lobar degeneration with TAR DNA-binding protein (FTLD-TDP), distinguishing this pathology from FTLD-Tau, and was associated with disease severity and progression in FTLD-TDP.","Acetylated Tau-174 CSF biomarker discernit inter TDP-43 et pathologiam in patientibus degenerationis frontotemporalis lobaris. Novus liquor cerebrospinalis biomarker, AcTau174, in frontotemporali degeneratione lobaris cum TAR DNA ligandi interdum (FTLD-TDP), hanc pathologiam ab FTLD-Tau distinguens, in FTLD-TDP associatus est et cum morbo severitatis et progressionis fuit.",2026-04-16 10:59:22+00:00
edd79293161e9fe83c3203006138d092,2026-04-14T11:00:00Z,'cold snap',www.stltoday.com,en,0.8,"Bullpen and rotation take the heat, but another issue lingers: Cardinals' ice-cold offense","Outside of one-man-show Jordan Walker with a third homer in as many days, Cardinals' lineup misses on key chances, fails snap stretch of Busch struggles.",https://www.stltoday.com/sports/professional/mlb/cardinals/article_6b703efe-b814-4434-8886-9c568d1ba94f.html,https://bloximages.newyork1.vip.townnews.com/stltoday.com/content/tncms/assets/v3/editorial/6/b7/6b703efe-b814-4434-8886-9c568d1ba94f/69ddd3d37c93c.preview.jpg?crop=1763%2C926%2C0%2C125&resize=1200%2C630&order=crop%2Cresize,,"St. Louis Cardinals second baseman Thomas Saggese (25) challenges a call, but a strike is confirmed, as Cleveland Guardians catcher Austin Hedges (27) throws a ball back during the eighth inning in a… [+62 chars]",,"Bullpen und Rotation nehmen den Druck auf sich, aber ein anderes Problem bleibt bestehen: die eiskalte Offensive der Cardinals. Abgesehen von der One-Man-Show Jordan Walker mit seinem dritten Homerun in ebenso vielen Tagen vergibt die Aufstellung der Cardinals entscheidende Chancen und scheitert an Busch-Kämpfen.","Bullpen and rotation take the heat, but another issue lingers: Cardinals' ice-cold offense. Outside of one-man-show Jordan Walker with a third homer in as many days, Cardinals' lineup misses on key chances, fails snap stretch of Busch struggles.","Bullpen et rotationis aestum capiunt, sed alia quaestio remanet: Cardinalium offensa glaciei-frigida. Extra unum hominem ostendunt Jordan Walker cum tertio Homero per totidem dies, cardinalium lineum in praecipuis fortunis missorum, disrumpens disrumpens certaminum Busch deficit.",2026-04-16 10:59:22+00:00
