index,published,keyword,domain,language,valid,title,description,url,image,archive,content,quote,de,en,la,added
52a050d7cb06472c53d33d1e0e80afb6,2026-04-10T19:50:37Z,'cold snap',www.vox.com,en,0.9,The real reason your monthly gas bill keeps going up,"This story was originally published by Inside Climate News and is reproduced here as part of the Climate Desk collaboration. From the cold snap this winter to the US war with Iran, rising energy bills are making headlines. But there’s a larger story behind sp…",https://www.vox.com/climate/485398/gas-utility-bill-price-increase-pipe-infrastructure,https://platform.vox.com/wp-content/uploads/sites/2/2026/04/gettyimages-1298391142.jpg?quality=90&strip=all&crop=0%2C15.095986038394%2C100%2C69.808027923211&w=1200,http://web.archive.org/web/20260410230331/https://www.vox.com/climate/485398/gas-utility-bill-price-increase-pipe-infrastructure,"In 2025, gas utility bills rose 60 percent faster than electric ones and four times faster than inflation, according to a new report by the Building Decarbonization Coalition. | Lindsey Nicholson/Edu… [+5593 chars]",,"Der wahre Grund, warum Ihre monatliche Gasrechnung immer weiter steigt. Diese Geschichte wurde ursprünglich von Inside Climate News veröffentlicht und wird hier im Rahmen der Zusammenarbeit mit Climate Desk wiedergegeben. Von der Kältewelle in diesem Winter bis zum Krieg der USA mit dem Iran sorgen steigende Energierechnungen für Schlagzeilen. Aber hinter sp steckt noch eine größere Geschichte …","The real reason your monthly gas bill keeps going up. This story was originally published by Inside Climate News and is reproduced here as part of the Climate Desk collaboration. From the cold snap this winter to the US war with Iran, rising energy bills are making headlines. But there’s a larger story behind sp…","Ratio realis menstrui gasi rogationis pergit ascendit. Haec narratio a Intus Clima Nuntio primum divulgata est et hic ut pars collaborationis Clima Desk producitur. Ex frigore hoc hiemem ad  US bellum US Iraneae disrumpunt, energiae rogationes lacus surgentes faciunt. Sed maior fabula est post sp…",2026-04-16 10:59:22+00:00
2a7bf13e5d4f5a106112760674648be6,2026-04-09T08:07:01Z,'cold front',www.businessinsider.com,en,0.3,I tried the next frontier in cancer screening. I'm dubious.,I tried the $950 blood test Silicon Valley thinks can revolutionize cancer screening. The science—and my results—tell a murkier story.,https://www.businessinsider.com/i-tried-the-next-frontier-in-cancer-screening-blood-colon-2026-4,https://i.insider.com/69d69a3af36fd1a78c051fe5?width=1200&format=jpeg,,"I watch as my crimson-red blood quickly fills two small glass vials, then gets packed into an ice-cold sleeve to be shipped off to a cancer-hunting lab.
I've just completed my first cancer blood dra… [+15420 chars]",,"Ich habe die nächste Grenze der Krebsvorsorge ausprobiert. Ich bin skeptisch. Ich habe den 950-Dollar-Bluttest ausprobiert, von dem Silicon Valley glaubt, dass er die Krebsvorsorgeuntersuchung revolutionieren kann. Die Wissenschaft – und meine Ergebnisse – erzählen eine düsterere Geschichte.",I tried the next frontier in cancer screening. I'm dubious.. I tried the $950 blood test Silicon Valley thinks can revolutionize cancer screening. The science—and my results—tell a murkier story.,Conatus limitem proximum in cancro protegendo. Dubius sum. Scientia—et eventus meos — fabulam narrare murkier.,2026-04-16 16:19:01+00:00
5290e2dd480267acf949ab93a55c087f,2026-04-15T00:00:00Z,'cold front',www.nature.com,en,0.3,Octahedral-rigidity-engineered linear dielectrics for harsh-temperature energy storage capacitors,"The authors engineer an octahedrally rigid perovskite dielectric with a dual-cubic framework and cold-sintering-enabled microstructure, enabling stable capacitive energy storage up to 270 °C.",https://www.nature.com/articles/s41467-026-71800-6,,,"<li>Pan, H. et al. Ultrahighenergy density lead-free dielectric films via polymorphic nanodomain design. Science365, 578582 (2019).
Google Scholar 
</li><li>Yang, B. et al. Engineering relaxors by … [+11325 chars]",,"Mit oktaedrischer Steifigkeit konstruierte lineare Dielektrika für Energiespeicherkondensatoren für raue Temperaturen. Die Autoren entwickeln ein oktaedrisch starres Perowskit-Dielektrikum mit einem dual-kubischen Gerüst und einer Kaltsinter-fähigen Mikrostruktur, das eine stabile kapazitive Energiespeicherung bis zu 270 °C ermöglicht.","Octahedral-rigidity-engineered linear dielectrics for harsh-temperature energy storage capacitors. The authors engineer an octahedrally rigid perovskite dielectric with a dual-cubic framework and cold-sintering-enabled microstructure, enabling stable capacitive energy storage up to 270 °C.","Octahedral-rigiditatem machinis linearibus dielectricis pro dura-temperantia energiae repositionis capaci- tores. Auctores fectum octahedrale rigidum perovskitum dielectric cum compage duali-cubica et microstructura frigido-sintering-enabili, stabilis energiae capacitivae repositae usque ad 270 °C.",2026-04-16 16:19:01+00:00
abb78a0a6c88aab9e09d76036ed6f877,2026-04-14T18:55:47Z,'cold spell',gizmodo.com,en,0.2,The OpenAI-Anthropic Cold War Comes to Illinois,A proxy war in the Land of Lincoln.,https://gizmodo.com/the-openai-anthropic-cold-war-comes-to-illinois-2000746324,https://gizmodo.com/app/uploads/2026/03/AIProtest-1200x675.jpg,,"Despite its best efforts, the Trump administration has been unable to implement a moratorium preventing states from passing laws regulating AI companies. Thus far, most states have used their authori… [+3621 chars]",,Der OpenAI-anthropische Kalte Krieg kommt nach Illinois. Ein Stellvertreterkrieg im Land Lincoln.,The OpenAI-Anthropic Cold War Comes to Illinois. A proxy war in the Land of Lincoln.,Bellum Frigidum OpenAI-Anthropicum ad Illinois venit. Procuratorem belli in terra Lincolnie.,2026-04-16 20:44:02+00:00
74fb5667996b9ac591b8454ca0031dc1,2026-04-02T10:00:10Z,'cold spell',www.androidpolice.com,en,0.3,You should think twice before buying the S26 Ultra for your next vacation — here's why,S26 Ultra fails when it gets cold,https://www.androidpolice.com/s26-ultra-fogging-problem/,https://static0.anpoimages.com/wordpress/wp-content/uploads/2026/03/galaxy-s26-ultra-underwater-with-fogged-camera-lenses-and-bubbles.png?w=1600&h=900&fit=crop,http://web.archive.org/web/20260402232153/https://www.androidpolice.com/s26-ultra-fogging-problem/,"Samsung launched the Galaxy S26 series in February, right in the heart of winter for half the world. Samsung marketed it as a go-anywhere, capture-everything phone.
Yet, for anyone living in a clima… [+4592 chars]",,"Sie sollten es sich zweimal überlegen, bevor Sie das S26 Ultra für Ihren nächsten Urlaub kaufen – hier erfahren Sie, warum. S26 Ultra versagt, wenn es kalt wird",You should think twice before buying the S26 Ultra for your next vacation — here's why. S26 Ultra fails when it gets cold,Bis cogitare debes antequam emere S26 Ultra ad proximas ferias tuas — hic 'cur. S26 Ultra non frigescit,2026-04-16 20:44:02+00:00
306cfe061f22d3ea5b8051680241599f,2026-04-14T03:58:00Z,'heating system',www.globenewswire.com,en,0.2,AutoFull Introduces M6 Ultra+ 2.0: The World’s First Active Cooling & Heating Shiatsu Massage Gaming Chair,"HAMBURG, Germany, April 14, 2026 (GLOBE NEWSWIRE) -- Long hours of sitting for gaming or work has become the norm, extended periods of inactivity can lead to discomfort and even long-term health issues. AutoFull has introduced the M6 Ultra+ 2.0, the world’s f…",https://www.globenewswire.com/news-release/2026/04/14/3272987/0/en/AutoFull-Introduces-M6-Ultra-2-0-The-World-s-First-Active-Cooling-Heating-Shiatsu-Massage-Gaming-Chair.html,https://ml.globenewswire.com/Resource/Download/fe47a6b5-df6c-4bb3-a640-4289c9679932,,"HAMBURG, Germany, April 14, 2026 (GLOBE NEWSWIRE) -- Long hours of sitting for gaming or work has become the norm, extended periods of inactivity can lead to discomfort and even long-term health issu… [+2606 chars]",,"AutoFull stellt M6 Ultra+ 2.0 vor: den weltweit ersten Shiatsu-Massage-Gaming-Stuhl mit aktiver Kühlung und Heizung. HAMBURG, Deutschland, 14. April 2026 (GLOBE NEWSWIRE) – Langes Sitzen zum Spielen oder Arbeiten ist zur Norm geworden, längere Inaktivitätsphasen können zu Beschwerden und sogar zu langfristigen Gesundheitsproblemen führen. AutoFull hat den M6 Ultra+ 2.0 vorgestellt, den weltweit f…","AutoFull Introduces M6 Ultra+ 2.0: The World’s First Active Cooling & Heating Shiatsu Massage Gaming Chair. HAMBURG, Germany, April 14, 2026 (GLOBE NEWSWIRE) -- Long hours of sitting for gaming or work has become the norm, extended periods of inactivity can lead to discomfort and even long-term health issues. AutoFull has introduced the M6 Ultra+ 2.0, the world’s f…","AutoFull Introduces M6 Ultra+ 2.0: Primum Active Cooling & Heating Shiatsu Massage Gaming Chair. HAMBURGUS, Germania, die 14 Aprilis 2026 (GLOBE NEWSWIRE) - Longae horae sedendi ad ludum vel laborem norma facta est, periodi inertiae protractae ad molestiae et etiam longi temporis proventus valetudinis ducere possunt. AutoFull induxit M6 Ultra+ 2.0, mundi f…",2026-04-17 02:07:30+00:00
766e4155aac4b356137397b0dc09d2ec,2026-04-14T16:52:07Z,'heating system',newatlas.com,en,0.3,'Sweater for houses' could reduce heating bills by at least 15%,"Keeping homes warm in winter is becoming extremely expensive, and many existing methods aren't always efficient. In the US alone, tens of millions of people struggle with energy costs and often have to cut back on basic expenses, including food, just to be ab…",https://newatlas.com/energy/sweater-for-houses-reduce-heating-bills/,https://assets.newatlas.com/dims4/default/3e254d7/2147483647/strip/true/crop/1177x618+0+84/resize/1200x630!/quality/85/?url=https%3A%2F%2Fnewatlas-brightspot.s3.amazonaws.com%2F88%2F5b%2F4b8b7ec14137831847a05f492ce9%2Fscreenshot-2026-04-14-at-10-40-43-am.jpeg&na.image_optimisation=0,,"Keeping homes warm in winter is becoming extremely expensive, and many existing methods aren't always efficient. In the US alone, tens of millions of people struggle with energy costs and often have … [+2980 chars]",,"„Pullover für Häuser“ könnten die Heizkosten um mindestens 15 % senken. Das Warmhalten von Häusern im Winter wird immer teurer und viele bestehende Methoden sind nicht immer effizient. Allein in den USA haben Dutzende Millionen Menschen mit Energiekosten zu kämpfen und müssen häufig bei den Grundausgaben, einschließlich Nahrungsmitteln, Kürzungen vornehmen, nur um …","'Sweater for houses' could reduce heating bills by at least 15%. Keeping homes warm in winter is becoming extremely expensive, and many existing methods aren't always efficient. In the US alone, tens of millions of people struggle with energy costs and often have to cut back on basic expenses, including food, just to be ab…","'Succus pro domibus' poterat minuere calefactionem rogationum saltem 15%. Domos servans hieme calida maxime pretiosa fit, et multi modi exsistentes non semper efficiunt. In US soli, decem decies centena milia hominum cum industria impensas moliuntur et saepe resecari debebunt in expensis fundamentalibus, incluso cibo, ab ...",2026-04-17 02:07:30+00:00
8f702129ccf02600f89ed44def8fcfa5,2026-04-14T18:02:15Z,'heating system',alltoc.com,en,0.3,What did Artemis II teach about reentry? #science,"What Artemis II revealed about reentry After NASA’s Artemis II astronauts completed their lunar flyby and returned toward Earth, attention turned to the spacecraft systems needed to survive reentry at extreme speeds. The reporting in the provided material emp…",https://alltoc.com/science/what-did-artemis-ii-teach-about-reentry,https://alltoc.com/cdn/1046/og.png,,"What Artemis II revealed about reentry
After NASAs Artemis II astronauts completed their lunar flyby and returned toward Earth, attention turned to the spacecraft systems needed to survive reentry a… [+1691 chars]",,"Was lehrte Artemis II. über den Wiedereintritt? #Wissenschaft. Was Artemis II über den Wiedereintritt verriet Nachdem die Artemis-II-Astronauten der NASA ihren Vorbeiflug am Mond abgeschlossen hatten und zur Erde zurückkehrten, richtete sich die Aufmerksamkeit auf die Raumfahrzeugsysteme, die erforderlich sind, um den Wiedereintritt bei extremen Geschwindigkeiten zu überstehen. Die Berichterstattung im bereitgestellten Sachverhalt …","What did Artemis II teach about reentry? #science. What Artemis II revealed about reentry After NASA’s Artemis II astronauts completed their lunar flyby and returned toward Earth, attention turned to the spacecraft systems needed to survive reentry at extreme speeds. The reporting in the provided material emp…","Quid docuit Artemis II de reentry? #scientia. Quae Artemis II de reentry demonstravit Postquam NASA Artemis II astronautae volantem lunarem confecerunt et ad Tellurem reversi sunt, ratio operam dedit spatii systematis necessarii ad ultimam celeritatem reintrationem superesse. Relatio in materia provisum emp…",2026-04-17 02:07:30+00:00
2eb377c761c3b8ebd15ca599d17fe56a,2026-04-14T19:21:25Z,'heating system',bringatrailer.com,en,0.3,49k-Mile 2004 Lincoln Navigator Ultimate 4×4 at No Reserve,"This 2004 Lincoln Navigator left the factory in Ultimate specification, the highlights of which include seat heating and ventilation up front, power-folding third-row seating, a sunroof, a power-operated liftgate, Roll Stability Control, and xenon headlights.…",https://bringatrailer.com/listing/2004-lincoln-navigator-7/,https://bringatrailer.com/wp-content/uploads/2026/04/2004_lincoln_navigator_img_0958-31283.jpg,,"This 2004 Lincoln Navigator left the factory in Ultimate specification, the highlights of which include seat heating and ventilation up front, power-folding third-row seating, a sunroof, a power-oper… [+2131 chars]",,"49.000 Meilen 2004 Lincoln Navigator Ultimate 4×4 ohne Reserve. Dieser Lincoln Navigator aus dem Jahr 2004 verließ das Werk in der Ultimate-Ausführung. Zu den Highlights gehören Sitzheizung und Belüftung vorne, elektrisch umklappbare Sitze in der dritten Reihe, ein Schiebedach, eine elektrisch betätigte Heckklappe, Rollstabilitätskontrolle und Xenon-Scheinwerfer.…","49k-Mile 2004 Lincoln Navigator Ultimate 4×4 at No Reserve. This 2004 Lincoln Navigator left the factory in Ultimate specification, the highlights of which include seat heating and ventilation up front, power-folding third-row seating, a sunroof, a power-operated liftgate, Roll Stability Control, and xenon headlights.…","49k-Mile 2004 Lincoln Navigator Ultima 4×4 at No Subsidium. Hoc 2004 Navigator Lincolniensis officinas in ultima specie reliquit, cuius elucidationes includunt calefactionem et evacuationem frontem, potestatem plicatio tertii ordinis sessio, sunroof, elevatio potentiae operatae, gubernatio stabilitatis Roll, et xenon headlights...",2026-04-17 02:07:30+00:00
328a3ec32ae7b36a5fb497b4f4b2e732,2026-04-15T12:15:33Z,'insulation house',www.livingrichwithcoupons.com,en,0.3,bella Pro Barista Elite Espresso Drink Station+ just $89.99 {Reg. $229.99} at Best Buy,"Love this deal at Best Buy! Make espresso at home! Today Only, Pick up the bella Pro Barista Elite Espresso Drink Station+ just $89.99 {Reg. $229.99} at Best Buy Ships free or curbside pickup free at the store Description: 20-Bar High-Pressure Brewing System …",https://www.livingrichwithcoupons.com/2026/04/bella-pro-barista-elite-espresso-drink-station-just-89-99-reg-229-99-at-best-buy.html,https://www.livingrichwithcoupons.com/wp-content/uploads/2026/04/Blank-1000-x-615-copy-157-8.png,,"<li>20-Bar High-Pressure Brewing System
Delivers bold flavor and a beautiful crema every time for true coffeehouse quality.
</li><li>One-Touch Brewing
Brew single or double espresso shots, creamy … [+1046 chars]",,"bella Pro Barista Elite Espresso-Getränkestation+ nur 89,99 $ {Reg. 229,99 $} bei Best Buy. Ich liebe dieses Angebot bei Best Buy! Machen Sie Espresso zu Hause! Nur heute: Holen Sie sich die bella Pro Barista Elite Espresso-Getränkestation+ für nur 89,99 $ {Reg. 229,99 $} bei Best Buy. Versand kostenlos oder kostenlose Abholung am Straßenrand im Geschäft. Beschreibung: 20-Bar-Hochdruck-Brühsystem …","bella Pro Barista Elite Espresso Drink Station+ just $89.99 {Reg. $229.99} at Best Buy. Love this deal at Best Buy! Make espresso at home! Today Only, Pick up the bella Pro Barista Elite Espresso Drink Station+ just $89.99 {Reg. $229.99} at Best Buy Ships free or curbside pickup free at the store Description: 20-Bar High-Pressure Brewing System …","bella Pro Barista Elite Espresso Bibe Station+ iustus $89.99 {Reg. $229.99} at Best Buy. Dilige hoc multum apud Best Buy! Fac espresso domi! Hodie Tantum, tolle bella Pro Barista Elite Espresso Bibe Station+ tantum $89.99 {Reg. $229.99} apud Best Buy Naves liberae vel curbside RAPINA gratis in copia Description: 20-Bar High-Pressure Brewing System ...",2026-04-17 10:51:10+00:00
0f46cf3b5ec7377889cbc5b9e8e386f2,2026-04-16T09:00:00Z,'heating system',prospect.org,en,0.3,Trump: Poor People’s Power Bills Are Too Damn Low (Again),"To help pay for his war of choice with Iran, Trump wants to zero out funding for energy assistance and efficiency programs. But it’s not the first time he’s tried to dismantle them.
The post Trump: Poor People’s Power Bills Are Too Damn Low (Again) appeared f…",http://prospect.org/2026/04/16/trump-poor-peoples-power-bills-too-damn-low-liheap/,https://i0.wp.com/prospect.org/wp-content/uploads/2026/04/Baratta-LIHEAP-041626.jpg?fit=2000%2C1333&ssl=1,,The $4 billion energy assistance program some six million low-income households across the country depend on to pay for home heating and cooling is once again on the chopping block. Thats because Pre… [+8768 chars],,"Trump: Die Stromrechnungen armer Menschen sind (wieder) zu niedrig. Um den von ihm gewählten Krieg mit dem Iran zu finanzieren, will Trump die Finanzierung von Energiehilfe- und Effizienzprogrammen auf null streichen. Aber es ist nicht das erste Mal, dass er versucht, sie zu demontieren.
Der Beitrag „Trump: Die Stromrechnungen armer Menschen sind (schon wieder) zu niedrig“ erschien vor …","Trump: Poor People’s Power Bills Are Too Damn Low (Again). To help pay for his war of choice with Iran, Trump wants to zero out funding for energy assistance and efficiency programs. But it’s not the first time he’s tried to dismantle them.
The post Trump: Poor People’s Power Bills Are Too Damn Low (Again) appeared f…","BUCINUM: Pauperum Power rogationes Nimis Damnant Low (Again). Ad auxilium stipendium ad bellum electionis cum Iran, Trump nihili vult sumptu pro subsidio industriae et progressionis efficientiae. Sed non primum eas detrahere conatus est.
Post BUCINUM: Pauperum potentia rogationes Nimis Damnant Low (iterum) apparuit f…",2026-04-17 10:51:10+00:00
cd7d0690f609c9392389e9c7c71997c0,2026-04-16T07:41:00Z,'heating system',www.geeky-gadgets.com,en,0.8,$649 Bambu X2D 3D Printer : New King of Dual-Extrusion 3D Printers?,"The Bambu X2D 3D printer expands on the P2S model by introducing features such as active chamber heating and a dual extrusion system, which enhance its capabilities for multi-material printing. With a 60°C heated chamber, it handles temperature-sensitive mate…",https://www.geeky-gadgets.com/bambu-x2d-3d-printer-review/,https://www.geeky-gadgets.com/wp-content/uploads/2026/04/the-bambu-x2d-printing-a-complex-model-using-pva-support-material.jpg,,"The Bambu X2D 3D printer expands on the P2S model by introducing features such as active chamber heating and a dual extrusion system, which enhance its capabilities for multi-material printing. With … [+7645 chars]",,649 $ Bambu X2D 3D-Drucker: Neuer König der Dual-Extrusions-3D-Drucker?. Der 3D-Drucker Bambu Mit einer auf 60 °C beheizten Kammer verarbeitet es temperaturempfindliche Materialien.,"$649 Bambu X2D 3D Printer : New King of Dual-Extrusion 3D Printers?. The Bambu X2D 3D printer expands on the P2S model by introducing features such as active chamber heating and a dual extrusion system, which enhance its capabilities for multi-material printing. With a 60°C heated chamber, it handles temperature-sensitive mate…","$649 Bambu X2D 3D Printer: New King of Dual-Extrusion 3D Printers?. Typographus Bambu X2D 3D in exemplar P2S dilatat, inducendo notas ut calefactio camerae activae et systematis extrusionis dualis, quae facultates suas ad multi-materia imprimendi augent. Cum 60°C conclavi calefacto, mate sensibilis temperatus tractat…",2026-04-17 10:51:10+00:00
28467140c12209325d8c31d131ae713c,2026-04-12T05:30:39Z,'cold impacts',exystence.net,en,0.2,Hannah Lew – Hannah Lew (2026),"Listeners could be forgiven for thinking Cold Beat was essentially Hannah Lew‘s solo project. The band’s lineup may have been a revolving door, but her softly compelling voice and fondness for icy electronics were always there. Nevertheless, Lew distinguishes…",https://exystence.net/blog/2026/04/12/hannah-lew-hannah-lew-2026/,,,"Listeners could be forgiven for thinking Cold Beat was essentially Hannah Lew‘s solo project. The band’s lineup may have been a revolving door, but her softly compelling voice and fondness for icy el… [+1977 chars]",,"Hannah Lew – Hannah Lew (2026). Den Zuhörern könnte man denken, dass „Cold Beat“ im Wesentlichen das Soloprojekt von Hannah Lew war. Die Besetzung der Band mag ein Wechselspiel gewesen sein, aber ihre sanfte, überzeugende Stimme und ihre Vorliebe für eisige Elektronik waren immer da. Dennoch unterscheidet Lew…","Hannah Lew – Hannah Lew (2026). Listeners could be forgiven for thinking Cold Beat was essentially Hannah Lew‘s solo project. The band’s lineup may have been a revolving door, but her softly compelling voice and fondness for icy electronics were always there. Nevertheless, Lew distinguishes…","Anna Lew - Anna Lew (2026). Auditores remitti posse putabant Frigus Beatum essentialiter Anna Lew‘s solo inceptum esse. Linea cohortis revolvens ostium fortasse fuit, sed vox eius molliter et studium electronicarum glacialis semper ibi erant. Tamen, Lew distinguit…",2026-04-17 15:56:34+00:00
3b2a5466e2518509ac17b969083139a2,2026-04-14T20:00:28Z,'cold impacts',www.newscientist.com,en,0.3,"Is a super El Niño imminent, and what could the impacts be?","A planet-warming El Niño climate phase is now developing, and some models predict it could turn out to be the strongest on record",https://www.newscientist.com/article/2523034-is-a-super-el-nino-imminent-and-what-could-the-impacts-be/,https://images.newscientist.com/wp-content/uploads/2026/04/14164226/SEI_293140790.jpg,,"A super El Niño led to flooding in China in 1998
ROBYN BECK/AFP via Getty Images
In the past month, weather models have begun to show that a very strong El Niño climate phase could develop later th… [+6329 chars]",,"Steht ein Super-El Niño bevor und welche Auswirkungen könnten die Folgen sein? Derzeit entwickelt sich eine den Planeten erwärmende El-Niño-Klimaphase, und einige Modelle gehen davon aus, dass sie sich als die stärkste aller Zeiten erweisen könnte","Is a super El Niño imminent, and what could the impacts be?. A planet-warming El Niño climate phase is now developing, and some models predict it could turn out to be the strongest on record","Imminens est eximius El Niño, et quid iacti esse possunt? Planeta calefaciens El Niño periodum climatis nunc invalescit, et quaedam exempla praedicunt eum posse evenire ut firmissimum esse memoriae proditum sit.",2026-04-17 15:56:34+00:00
bd2bbf74e4c2b0271c00c0406e541dc4,2026-04-03T17:00:16Z,'insulation house',kevinmd.com,en,0.3,How a minor dry cough amplifies caregiver burden in home health care,"A dry cough can be one of the most misleading symptoms in medicine. At home, it can dominate the emotional climate of an entire household. It interrupts sleep, breaks conversations, unsettles meals, and keeps caregivers in a state of low-grade vigilance. It a…",https://kevinmd.com/2026/04/how-a-minor-dry-cough-amplifies-caregiver-burden-in-home-health-care.html,https://kevinmd.com/wp-content/uploads/bcf52654-5b5a-4719-8fcc-65c0a4e910bf.jpeg,,"A dry cough can be one of the most misleading symptoms in medicine. At home, it can dominate the emotional climate of an entire household. It interrupts sleep, breaks conversations, unsettles meals, … [+8696 chars]",,"Wie ein leichter trockener Husten die Belastung des Pflegepersonals in der häuslichen Pflege erhöht. Ein trockener Husten kann eines der irreführendsten Symptome in der Medizin sein. Zu Hause kann es das emotionale Klima eines ganzen Haushalts dominieren. Es unterbricht den Schlaf, unterbricht Gespräche, bringt das Essen durcheinander und sorgt dafür, dass die Pflegekräfte in einem Zustand geringer Wachsamkeit bleiben. Es ist ein…","How a minor dry cough amplifies caregiver burden in home health care. A dry cough can be one of the most misleading symptoms in medicine. At home, it can dominate the emotional climate of an entire household. It interrupts sleep, breaks conversations, unsettles meals, and keeps caregivers in a state of low-grade vigilance. It a…","Quam minor tussis arida amplificat curantis onus in domo sanitatis. Tussis arida potest esse maxime fallax indicia in medicina. Domi motus caeli totius familiae dominari potest. Somnos interrumpit, sermones frangit, cenas inquietat, in statu humili graduum vigilantiam servat. It a…",2026-04-18 01:59:10+00:00
