index,published,keyword,domain,language,valid,title,description,url,image,archive,content,quote,de,en,la,added
f8a6238aa835dd4be21f27e001cc04ee,2026-07-04T17:03:00Z,'insulation house',newatlas.com,en,0.3,Park model tiny house provides apartment-style living on a single floor,"Some tiny houses seem to prioritize portability over comfort, but the Apex takes the opposite approach. It trades mobility for a spacious single-floor layout that's closer to an apartment than a traditional tiny house.Continue ReadingCategory: Tiny Houses, Ou…",https://newatlas.com/tiny-houses/apex-rover-tiny-homes/,https://assets.newatlas.com/dims4/default/e488c59/2147483647/strip/true/crop/1533x805+0+42/resize/1200x630!/quality/85/?url=https%3A%2F%2Fnewatlas-brightspot.s3.amazonaws.com%2Fe2%2Fe0%2Fe95814fc4032840a069009e185c8%2Fapex-tiny-house-8.png&na.image_optimisation=0,http://web.archive.org/web/20260705053608/https://newatlas.com/tiny-houses/apex-rover-tiny-homes/,"Some tiny houses seem to prioritize portability over comfort, but the Apex takes the opposite approach. It trades mobility for a spacious single-floor layout that's closer to an apartment than a trad… [+2280 chars]",,"Das Tiny House im Park-Modell bietet Wohnen im Apartment-Stil auf einer Etage. Einige Tiny Houses scheinen der Tragbarkeit Vorrang vor dem Komfort zu geben, aber das Apex verfolgt den gegenteiligen Ansatz. Es tauscht Mobilität gegen einen geräumigen, einstöckigen Grundriss, der näher an einer Wohnung ist als an einem traditionellen Tiny House.WeiterlesenKategorie: Tiny Houses, Ou…","Park model tiny house provides apartment-style living on a single floor. Some tiny houses seem to prioritize portability over comfort, but the Apex takes the opposite approach. It trades mobility for a spacious single-floor layout that's closer to an apartment than a traditional tiny house.Continue ReadingCategory: Tiny Houses, Ou…","Exemplar Park parvae domus in una pavimento diaetam stilum vivum praebet. Quaedam domunculae parvae portabilitatem super consolatione prioritizare videntur, sed Apex oppositum aditum accipit. Mobilitatem exercet pro spatioso unius tabulati extensione quod propius ad diaetam quam ad domum parvam traditam. Continue ReadingCategory: Domorum parvarum, Ou…",2026-07-11 20:42:26+00:00
ec06b3651b013bc2c4b43ef21350a0ef,2026-07-05T03:34:55Z,'insulation house',www.lifesciencesworld.com,en,0.3,What kind of houses do squirrels like?,"What Kind of Houses Do Squirrels Like? The Ultimate Guide Squirrels prefer safe, dry, and easily accessible nesting sites, whether it’s a natural cavity in a tree or a human-provided squirrel house that mimics these ideal conditions. Understanding what kind o…",https://www.lifesciencesworld.com/what-kind-of-houses-do-squirrels-like/,,,"Squirrels prefer safe, dry, and easily accessible nesting sites, whether it’s a natural cavity in a tree or a human-provided squirrel house that mimics these ideal conditions. Understanding what kind… [+8714 chars]",,"Welche Häuser mögen Eichhörnchen? Welche Art von Häusern mögen Eichhörnchen? Der ultimative Leitfaden Eichhörnchen bevorzugen sichere, trockene und leicht zugängliche Nistplätze, sei es eine natürliche Höhle in einem Baum oder ein von Menschen geschaffenes Eichhörnchenhaus, das diese idealen Bedingungen nachahmt. Verstehen, welche Art von …","What kind of houses do squirrels like?. What Kind of Houses Do Squirrels Like? The Ultimate Guide Squirrels prefer safe, dry, and easily accessible nesting sites, whether it’s a natural cavity in a tree or a human-provided squirrel house that mimics these ideal conditions. Understanding what kind o…","Quales domos sciuri simile ?. Qualis domus sciuri placet? The Ultimate Guide Squirrels prefer tutam, aridam, et situs nidificandi facile pervia, sive cavitatis naturalis est in arbore vel in domo humana sciurus quae imitatur has condiciones ideales. Intellectus qualis o...",2026-07-11 20:42:26+00:00
05235fd6f064e42b976d918af53061b8,2026-07-05T19:37:26Z,'insulation house',theconversation.com,en,0.3,‘A giant blanket’: how better insulation lowers energy costs for you and the grid,An expert explains how insulation works and why it matters.,https://theconversation.com/a-giant-blanket-how-better-insulation-lowers-energy-costs-for-you-and-the-grid-285342,https://images.theconversation.com/files/743174/original/file-20260622-57-t75304.jpg?ixlib=rb-4.1.0&rect=0%2C215%2C2121%2C1060&q=45&auto=format&w=1356&h=668&fit=crop,http://web.archive.org/web/20260705204909/https://theconversation.com/a-giant-blanket-how-better-insulation-lowers-energy-costs-for-you-and-the-grid-285342,"BrianAJackson/Getty
Australian households are under immense financial pressure – and rising energy costs are a major reason why.

While policy makers and system planners have focused on ways to prod… [+5994 chars]",,"„Eine riesige Decke“: Wie eine bessere Isolierung die Energiekosten für Sie und das Netz senkt. Ein Experte erklärt, wie Isolierung funktioniert und warum sie wichtig ist.",‘A giant blanket’: how better insulation lowers energy costs for you and the grid. An expert explains how insulation works and why it matters.,'Gans stragulum': quo melius insulatio industriam demittit tibi et malesuada euismod. Nulla volutpat et quam ob rem refert peritus exponit.,2026-07-11 20:42:26+00:00
b565262301485fe68f1e119f708af779,2026-07-06T20:26:02Z,'insulation house',www.cbc.ca,en,0.3,N.B. working on deal to join federal home-retrofit program,"New Brunswick is working out a deal with the federal government to join its Canada Greener Homes Affordability Program so that eligible residents can make upgrades, including adding insulation and heat pumps, at no cost.",https://www.cbc.ca/news/canada/new-brunswick/nb-joining-federal-greener-homes-program-9.7260274,"https://i.cbc.ca/ais/1.6629287,1755704772000/full/max/0/default.jpg?im=Crop%2Crect%3D%280%2C0%2C1919%2C1079%29%3BResize%3D620",,"New Brunswick is working on a deal to join Canadas greener homes retrofit program, a government spokesperson says.
The federal Canada Greener Homes Affordability Program provides low- to median-inco… [+4126 chars]",,"Hinweis: Ich arbeite an einer Vereinbarung zur Teilnahme am bundesstaatlichen Haussanierungsprogramm. New Brunswick arbeitet derzeit an einer Vereinbarung mit der Bundesregierung über die Teilnahme am Canada Greener Homes Affordability Program, sodass berechtigte Bewohner kostenlos Modernisierungen vornehmen können, einschließlich des Einbaus von Isolierung und Wärmepumpen.","N.B. working on deal to join federal home-retrofit program. New Brunswick is working out a deal with the federal government to join its Canada Greener Homes Affordability Program so that eligible residents can make upgrades, including adding insulation and heat pumps, at no cost.","N.B. multum opus est ad programmatum domesticum-retrofiti foederati iungere. Novum Brunsvicum paciscendum cum imperio foederati laborat ut suum Canada viridiores Homes Affordability Programma coniungat, ut habiles incolas upgrades facere possint, inclusas velit et calor soleatus nullo pretio addito.",2026-07-11 20:42:26+00:00
7cd3ed00fba5aacb72af489ec8b487d5,2026-07-10T15:51:58Z,'extreme cold',www.psychologytoday.com,en,0.2,Got Heat? Cold? Wildfires? Droughts? Hurricanes?,"Despite the cascading and escalating threats of climate change, many people still avoid talking about it, or struggle to pay attention long enough to act.",https://www.psychologytoday.com/us/blog/the-anti-doomer-mindset/202607/got-heat-cold-wildfires-droughts-hurricanes,https://cdn2.psychologytoday.com/assets/styles/manual_crop_1_91_1_1528x800/public/teaser_image/blog_entry/2026-07/bibi-oirvesprbtm-unsplash.jpg?itok=-4njGlpn,,"This summer, England's temperatures reached 99.9 degrees Fahrenheit, the highest June temperature on record in the UK. A heat wave triggered a ""red heat health alert"" at exactly the same time the cit… [+9983 chars]",,"Hast du Hitze? Kalt? Waldbrände? Dürren? Hurrikane?. Trotz der kaskadenartigen und eskalierenden Bedrohungen durch den Klimawandel reden viele Menschen immer noch nicht darüber oder haben Schwierigkeiten, lange genug darauf zu achten, um zu handeln.","Got Heat? Cold? Wildfires? Droughts? Hurricanes?. Despite the cascading and escalating threats of climate change, many people still avoid talking about it, or struggle to pay attention long enough to act.","Surrexit Calor? Frigida? Wildfires? Siccitates? Turbinum ?. Quamvis minas climatis mutationis lapsus et evadendi, multi tamen de ea loquentes vitant vel contendunt attendere ad agendum satis longum.",2026-07-12 02:13:55+00:00
2cca89066a386c6b1fbaf14a40e49c4a,2026-07-07T10:59:47Z,'extreme cold',www.nakedcapitalism.com,en,0.3,Links 7/7/2026,"Our blue dailly links: shop cats, moar extreme weather, NATO freakout as Russia pounds Ukraine, EU LNG shortage? Germany v. AfD, India typhoid, Cuba grid fail, EU digitgal passport, JD Vance Trump diss, AI debt worries, BNPL as crisis trigger? Saylor sells Bi…",https://www.nakedcapitalism.com/2026/07/links-7-7-2026.html,https://www.nakedcapitalism.com/wp-content/uploads/2026/07/Screenshot-2026-07-07-at-1.13.50 PM.png,http://web.archive.org/web/20260707232233/https://www.nakedcapitalism.com/2026/07/links-7-7-2026.html,"Through the Eyes of Shop Cats Sixth Tone (guurst)
I Thought This Was a Literary Myth Until I Checked Classical Literature (Micael T)
Sciencing With a Primate Brain: Reflections on the Nature of Sci… [+11355 chars]",,"Links 07.07.2026. Unsere blauen täglichen Links: Shop Cats, Moar-Extremwetter, NATO-Freakout, während Russland die Ukraine attackiert, EU-LNG-Mangel? Deutschland gegen AfD, Typhus in Indien, Netzausfall in Kuba, digitaler EU-Pass, JD Vance Trump-Diss, Sorgen um die KI-Schulden, BNPL als Krisenauslöser? Saylor verkauft Bi…","Links 7/7/2026. Our blue dailly links: shop cats, moar extreme weather, NATO freakout as Russia pounds Ukraine, EU LNG shortage? Germany v. AfD, India typhoid, Cuba grid fail, EU digitgal passport, JD Vance Trump diss, AI debt worries, BNPL as crisis trigger? Saylor sells Bi…","Vincula 7/7/2026. Nostri cotidiani caerulei nexus: taberna felium, moar tempestatis extremae, NATO lusus naturae sicut Russia libras Ucrainae, EU LNG penuriam? Germania v. AfD, India typhoideum, Cuba grid deficiunt, digitgal EU passport, JD Vance Trump diss, AI curarum debitum, BNPL sicut discrimen felis? Nauta vendit Bi ...",2026-07-12 02:13:55+00:00
a3e4ffd0fcf8460322507040e01d5d01,2026-07-09T18:01:45Z,'extreme cold',grist.org,en,0.3,Why heat is so deadly and how to stay safe,Understand the risks associated with extreme heat and what to do when you’re facing down a heat wave with this guide based on years of Grist reporting.,https://grist.org/extreme-weather/why-heat-is-so-deadly-and-how-to-stay-safe/,https://grist.org/wp-content/uploads/2026/07/paris-heat-2026.jpg?quality=75&strip=all,http://web.archive.org/web/20260710064732/https://grist.org/extreme-weather/why-heat-is-so-deadly-and-how-to-stay-safe/,"Don’t underestimate heat. While less visible than other extreme weather events like hurricanes or floods, heat consistently accounts for more U.S. fatalities than any other type of weather disaster. … [+6809 chars]",,"Warum Hitze so tödlich ist und wie man auf der sicheren Seite bleibt. Verstehen Sie mit diesem Leitfaden, der auf jahrelanger Grist-Berichterstattung basiert, die mit extremer Hitze verbundenen Risiken und was Sie tun sollten, wenn Sie mit einer Hitzewelle konfrontiert sind.",Why heat is so deadly and how to stay safe. Understand the risks associated with extreme heat and what to do when you’re facing down a heat wave with this guide based on years of Grist reporting.,"Quare calor tam mortifera est, quam tutus manere. Pericula quae cum nimio calore cognosce et quid agere debeas cum fluctum aestum respicis cum hoc duce in annis de Grist renuntiatione.",2026-07-12 02:13:55+00:00
dd4326a7537e8d7de0c2682ba41ccf85,2026-07-08T07:00:02Z,'cold spell',www.newscientist.com,en,0.3,How extreme heat affects the body – and the best ways to cope,A short spell in a heat chamber at the University of Brighton showed Alec Luhn that his body is not adapted to high temperatures – but regular exposure can train the body to respond more effectively,https://www.newscientist.com/article/2533216-how-extreme-heat-affects-the-body-and-the-best-ways-to-cope/,https://images.newscientist.com/wp-content/uploads/2026/07/07134843/SEI_304374726.jpg,http://web.archive.org/web/20260709063920/https://www.newscientist.com/article/2533216-how-extreme-heat-affects-the-body-and-the-best-ways-to-cope/,"Passengers on the London Underground during the heatwave on 26 June
Guy Bell / Alamy
The heatwave that hit Europe at the end of June was the hottest ever and came less than a month after another re… [+4237 chars]",,"Wie sich extreme Hitze auf den Körper auswirkt – und wie man damit am besten umgeht. Ein kurzer Aufenthalt in einer Wärmekammer an der Universität von Brighton zeigte Alec Luhn, dass sein Körper nicht an hohe Temperaturen angepasst ist – aber regelmäßige Einwirkung kann den Körper trainieren, effektiver zu reagieren",How extreme heat affects the body – and the best ways to cope. A short spell in a heat chamber at the University of Brighton showed Alec Luhn that his body is not adapted to high temperatures – but regular exposure can train the body to respond more effectively,Quam calor extremus corpus afficit – et optimas vias tolerare. Brevis incantatio in camera caloris in Universitate Brighton Alec Luhn ostendit corpus suum non ad altas temperaturas accommodatum esse - sed regularis detectio instituere potest corpus ut efficacius respondeat.,2026-07-12 07:26:54+00:00
e19ed251997bbb26454cea5074b6ecb9,2026-07-09T18:00:00Z,'heating system',www.cbc.ca,en,0.3,Canadians design bubbly floating solar for icy lakes,"In this issue of our environmental newsletter, we check out a new design for a floating solar system designed for Canadian winters, see how Toronto boosted cycling to cut traffic during the World Cup and learn how cities could recycle heat produced by data ce…",https://www.cbc.ca/news/climate/what-on-earth-floating-solar-9.7264020,"https://i.cbc.ca/ais/c5a2db87-338d-4f6f-9cf3-4155badb02d1,1783613180989/full/max/0/default.jpg?im=Crop%2Crect%3D%280%2C176%2C4000%2C2250%29%3BResize%3D620",,"Welcome to our weekly newsletter where we highlight environmental trends and solutions that are moving us to a more sustainable world.
Hi, it's Emily. I've been interested in the idea of floating so… [+15509 chars]",,"Kanadier entwerfen sprudelnde schwimmende Solaranlage für eisige Seen. In dieser Ausgabe unseres Umwelt-Newsletters sehen wir uns ein neues Design für ein schwimmendes Solarsystem für kanadische Winter an, sehen, wie Toronto während der Weltmeisterschaft das Radfahren verstärkte, um den Verkehr zu reduzieren, und erfahren, wie Städte die von Datenzentren erzeugte Wärme recyceln könnten …","Canadians design bubbly floating solar for icy lakes. In this issue of our environmental newsletter, we check out a new design for a floating solar system designed for Canadian winters, see how Toronto boosted cycling to cut traffic during the World Cup and learn how cities could recycle heat produced by data ce…","Canadenses designant bubbly nare propter lacus glaciales solares. In hac re nostri environmentalis tabellarii novum consilium inspicimus pro fluitantia systematis solaris ad Canadiensis hiemes destinato, vide quomodo Toronto vehitur revolutio ad mercaturam Mundi inter Secandum et discendum quomodo civitates calor redivivus a data ce…",2026-07-12 11:08:18+00:00
